before_normalisasi,after_normalisasi
dorgu di lecce juga sering dimainkan di sayap kanan selain posisi bek kiri dua kakinya juga sama hidupnya,dorgu di lecce juga sering dimainkan di sayap kanan selain posisi bek kiri dua kakinya juga sama hidupnya
kemungkinan memasukkan mactominay si botak,kemungkinan memasukkan mactominay sih botak
jadwal main kapan jam berapa,jadwal main kapan jam berapa
info mengenai channel streaming pertandingan sudah diupdate,info mengenai channel streaming pertandingan sudah diupdate
mu menang tapi saya merasa masih banyak yang harus diperbaiki lini belakang terlalu sering kebobolan,mu menang tapi saya merasa masih banyak yang harus diperbaiki lini belakang terlalu sering kebobolan
salah siapa pinjemin anthony ma rashport sosoan,salah siapa pinjemin anthony sama rashport sosoan
meskipun menang brighton tetap memberi perlawanan dan mampu menciptakan peluang di beberapa waktu yang krusial,meskipun menang brighton tetap memberi perlawanan dan mampu menciptakan peluang di beberapa waktu yang krusial
amrabat aja udah x main di fiorentina,amrabat saja sudah kali main di fiorentina
opsi buy akhir musim,opsi buy akhir musim
kekalahan dan amorim harus segera temukan cara memperbaiki pertahanan kalau nggak kita bakal terus kalah,kekalahan dan amorim harus segera temukan cara memperbaiki pertahanan kalau enggak kita bakal terus kalah
astaghfirullah united,astaghfirullah united
no tuchel yes,no tuchel yes
jadwal main kapan jam berapa,jadwal main kapan jam berapa
midfield kita sampah nggak bisa ngontrol tempo umpan ngaco semua,midfield kita sampah enggak bisa ngontrol tempo umpan mengaco semua
semoga musim depan mu bisa lebih solid dan bersaing di papan atas,semoga musim depan mu bisa lebih solid dan bersaing di papan atas
laga kedua memperlihatkan perbaikan dalam pertahanan namun rashford harus lebih sering menembak untuk mendapatkan gol,laga kedua memperlihatkan perbaikan dalam pertahanan namun rashford harus lebih sering menembak untuk mendapatkan gol
lini depan kita jauh lebih hidup tapi defense kita masih rapuh harus lebih solid lagi di belakang,lini depan kita jauh lebih hidup tapi defense kita masih rapuh harus lebih solid lagi di belakang
min dalot de ligt martinez mazroui kasih delandang ugarte casemiro bruno maino depan coba zirkzee hojlund,min dalot deh ligt martinez mazroui kasih delandang ugarte casemiro bruno maino depan coba zirkzee hojlund
gegenpressing ala amorim lebih efektif daripada pressing setengah matang ten hag,gegenpressing ala amorim lebih efektif daripada pressing setengah matang ten hag
untung ga el silahkan,untung enggak el silahkan
pemainpemain senior perlu memberi contoh kepada pemain muda di dalam tim,pemainpemain senior perlu memberi contoh kepada pemain muda di dalam tim
ga di tonton menang giliran ditonton kalah mending ga usah nonton dlu,enggak di tonton menang giliran ditonton kalah mending enggak usah menonton dulu
itu bek solid banget anjir,itu bek solid banget anjir
gas,gas
strategi udah bagus tapi finishingnya parah buang peluang mulu,strategi sudah bagus tapi finishingnya parah buang peluang mulu
ya itu karena brightonnya bagus main offside traptrus dengan lu masukin mctominay ada perubahan kah,ya itu karena brightonnya bagus main offside traptrus dengan lu masukin mctominay ada perubahan kah
mungkin kita bisa lebih cepat dalam transisi serangan beberapa kali brighton mampu menahan kita dengan mudah,mungkin kita bisa lebih cepat dalam transisi serangan beberapa kali brighton mampu menahan kita dengan mudah
pelatih fisiknya siapa emyu,pelatih fisiknya siapa emyu
tiap musim gini trus,tiap musim begini terus
jadwal main kapan jam berapa,jadwal main kapan jam berapa
laga kedua memperlihatkan perbaikan dalam pertahanan namun rashford harus lebih sering menembak untuk mendapatkan gol,laga kedua memperlihatkan perbaikan dalam pertahanan namun rashford harus lebih sering menembak untuk mendapatkan gol
kenapa amorim tidak mencoba lebih banyak pemain muda padahal ada potensi,kenapa amorim tidak mencoba lebih banyak pemain muda padahal ada potensi
udah bener dapat tandem pemain yg pas eksperimen gak jelas lagi mas morim mas morim,sudah benar dapat tandem pemain yang pas eksperimen enggak jelas lagi mas morim mas morim
sudah kubilang kalo pemain mu itu lagi bagus sbnerbya bukan pemainnya yg bagus tapi lawannya yg lagi jelek,sudah kubilang kalo pemain mu itu lagi bagus sbnerbya bukan pemainnya yang bagus tapi lawannya yang lagi jelek
biasanya alumni emyu sukses di itali darmian alexis lukaku young smalling,biasanya alumni emyu sukses di itali darmian alexis lukaku young smalling
untung gaada var,untung enggak ada var
yora sports,yora sports
mood kaca balau habis ntn mu pengaruh ga baik buat kesehatan dan kedamaian keluarga,mood kaca balau habis ntn mu pengaruh enggak baik buat kesehatan dan kedamaian keluarga
rashford pun tak guna,rashford pun tak guna
kmrn mainoo dimainin didepan bisa bagus pas dimainin diepl trnyata kocak lg pemainya mau pep pun ngelatih emyu klo pemainny kocak ga bakal kemana,kemarin mainoo dimainin didepan bisa bagus pas dimainin diepl ternyata kocak lagi pemainya mau pep pun ngelatih emyu kalo pemainny kocak enggak bakal kemana
style penalty licha gila cool bet,style penalty licha gila cool banget
surem njir yg cederaancur dah cedera apa arisan itu,surem anjir yang cederaancur deh cedera apa arisan itu
amorim ngebangun mu jadi tim yang fun buat ditonton lagi bukan sekadar parkir bus atau bola mati doang,amorim ngebangun mu jadi tim yang fun buat ditonton lagi bukan sekadar parkir bus atau bola mati doang
senang lihat pemain muda dapat kesempatan di era amorim ini yang kita butuhkan,senang lihat pemain muda dapat kesempatan di era amorim ini yang kita butuhkan
udah bukan salah pelatih bwangg emg emyu yg bapuk,sudah bukan salah pelatih bwangg memang emyu yang bapuk
ten hag berhasil membawa tim lebih dekat dengan identitas bermain yang jelas namun di pertandingan besar masih terlihat kekurangan mental,ten hag berhasil membawa tim lebih dekat dengan identitas bermain yang jelas namun di pertandingan besar masih terlihat kekurangan mental
ini yang salah dari mu pelatih apa pemain,ini yang salah dari mu pelatih apa pemain
yg bener baru match udh x kalah nih pak ten hag,yang benar baru match sudah kali kalah nih pak ten hag
bacot,bacot
nonton final fa ga,menonton final fa enggak
seengganya lah menang bang,seengganya lah menang bang
itu mah ga sengaja sih ga ada niat buat nyentuh dari dia juga,itu mah enggak sengaja sih enggak ada niat buat nyentuh dari dia juga
fcsb garis kerasnya,fcsb garis kerasnya
nyusahin amat mending pindah aja,nyusahin amat mending pindah saja
dia ngelakuin tugas striker masuk kesana plus dah dalam keadaan meluncur bang susah pastinya mikir n ngendaliin anggota badan dalam sepersekian detik bener unlucky kl striker gedebog pisang mungkin dia cuma diem di deket titik pinalti,dia melakukan tugas striker masuk kesana plus deh dalam keadaan meluncur bang susah pastinya mikir n ngendaliin anggota badan dalam sepersekian detik benar unlucky kalo striker gedebog pisang mungkin dia cuma diam di dekat titik pinalti
apasii nih kiperr bab,apasii nih kiperr bab
ganti pelatihnya dulu trus klo udh dapet pelatih baru yg pinter pasti rashford ma casemiro di jual simpel kan ga banyak ribet,ganti pelatihnya dulu terus kalo sudah dapat pelatih baru yang pintar pasti rashford sama casemiro di jual simpel kan enggak banyak ribet
hahaha siap si paling gak fomo,hahaha siap sih paling enggak fomo
klo lu objektif secara permainan match ini udh bagus cuma error pemainnya masih blm berubah ada aja momen miss yg berujung gol atau ga gol,kalo lu objektif secara permainan match ini sudah bagus cuma error pemainnya masih belum berubah ada saja momen miss yang berujung gol atau enggak gol
biarin aja bang wkwk capek sendiri mereka jelas squadnya kaga jelas makanya amorim masih coba trus musim ini di pl keknya ngincer ga degradasi aja ngandelin uel sm fa doang,biarin saja bang wkwk capek sendiri mereka jelas squadnya kagak jelas makanya amorim masih coba terus musim ini di pl kayaknya ngincer enggak degradasi saja ngandelin uel sama fa doang
siapa yg baru maen di epl bagus,siapa yang baru main di epl bagus
rashford emang striker kocak juga nih,rashford memang striker kocak juga nih
lemah wkwkw,lemah wkwkw
nah kan idup mainnya,nah kan hidup mainnya
kalo fans asli sono mah yg di desak bukan pelatih tapi glazers family,kalo fan asli sono mah yang di desak bukan pelatih tapi glazers family
tiap taun sekali gacornya setengah musim doang wkwkwk,tiap tahun sekali gacornya setengah musim doang wkwkwk
pemain kita harus mulai nonton tutorial youtube cara passing yang benar,pemain kita harus mulai menonton tutorial youtube cara passing yang benar
lawak terlucu abad ini,lawak terlucu abad ini
amorim sudah membuat kemajuan besar di sektor pertahanan tetapi serangan balik sering kali tidak cukup tajam untuk memanfaatkan peluang,amorim sudah membuat kemajuan besar di sektor pertahanan tetapi serangan balik sering kali tidak cukup tajam untuk memanfaatkan peluang
dan hebatnya sllu dipasang sm eth,dan hebatnya selalu dipasang sama eth
pengen main di uel aja,pengin main di uel saja
gua bodo amat lah kalah yg jelas wajib minimal thropy akhir musim,gua bodo amat lah kalah yang jelas wajib minimal thropy akhir musim
kapan lagi dapet pemain tapi kalo ke juve oke lah barter sama chiesa mah,kapan lagi dapat pemain tapi kalo ke juve oke lah barter sama chiesa mah
emang gak adagaji juga turun jauh,memang enggak adagaji juga turun jauh
astaghfirullah baru babak pertama padahal di akun bola udah sibuk ini itulah,astaghfirullah baru babak pertama padahal di akun bola sudah sibuk ini itulah
makanya itu gua juga bingung ini raspot maen mulu cadangin kek ganti garnacho kiri ini malah si amad gua juga gedeg dibela karna mental lawan team gede lebih ok haduhh ampun,makanya itu gua juga bingung ini raspot main mulu cadangin kayak ganti garnacho kiri ini malah sih amad gua juga gedeg dibela karena mental lawan team gede lebih ok haduhh ampun
tampil solid di babak pertama tapi babak kedua mulai kehilangan fokus harus lebih fokus di pertandingan selanjutnya,tampil solid di babak pertama tapi babak kedua mulai kehilangan fokus harus lebih fokus di pertandingan selanjutnya
var gk guna njir,var enggak guna anjir
baru dua match tenang aja lagian pemain baru jg butuh waktu buat adaptasi,baru dua match tenang saja lagian pemain baru juga butuh waktu buat adaptasi
elsilahkan,elsilahkan
rashford pun tak guna,rashford pun tak guna
momen fa cup,momen fa cup
bukan sejauh ini sdh dari akhir musim dia main buruk bro di kata dia main jelek karena ada cr lah cr keluar sempat naik tp sisanya amburadul bro,bukan sejauh ini sudah dari akhir musim dia main buruk bro di kata dia main jelek karena ada cr lah cr keluar sempat naik tapi sisanya amburadul bro
ada aja sial nya,ada saja sial nya
ni pelatih emg kebanyakan bacot tong kosong bunyinya emg nyaring dah,ini pelatih memang kebanyakan bacot tong kosong bunyinya memang nyaring deh
pertandingan ini memperlihatkan dominasi kita tetapi brighton tetap memberi tekanan yang perlu kita waspadai ke depannya,pertandingan ini memperlihatkan dominasi kita tetapi brighton tetap memberi tekanan yang perlu kita waspadai ke depannya
mu menang tapi kalau kita nggak perbaiki pertahanan bisa bahaya di lagalaga selanjutnya,mu menang tapi kalau kita enggak perbaiki pertahanan bisa bahaya di lagalaga selanjutnya
taktik tolol ini knp sih gk pke aja heran dah eth trllu memaksakan mount tapi gak mau cadangin bruno,taktik tolol ini kenapa sih enggak pakai saja heran deh eth trllu memaksakan mount tapi enggak mau cadangin bruno
ft win,ft win
mungkin aja kena flu gak melulu soal cedera,mungkin saja kena flu enggak melulu soal cedera
stok pelatih top minim di eropa skrg ya semoga aja eth bisa nemu pakem yg pas setelah kekalahan kemarin harusnya udah gak coba lagi sih terlebih cuma beberapa pemain aja yg cedera,stok pelatih top minim di eropa sekarang ya semoga saja eth bisa nemu pakem yang pas setelah kekalahan kemarin harusnya sudah enggak coba lagi sih terlebih cuma beberapa pemain saja yang cedera
saya rasa ruben amorim sudah menunjukkan perubahan yang positif meskipun hasilnya imbang saya optimis mu akan lebih baik ke depannya,saya rasa ruben amorim sudah menunjukkan perubahan yang positif meskipun hasilnya imbang saya optimis mu akan lebih baik ke depannya
kenapa kaga casemiro yang di ganti malah bruno,kenapa kagak casemiro yang di ganti malah bruno
bayindir bisa nih geser onane,bayindir bisa nih geser onane
jadwal main kapan jam berapa,jadwal main kapan jam berapa
hasil imbang di laga pertama sedikit mengecewakan tapi saya bisa melihat semangat baru dalam permainan mu di bawah ruben amorim,hasil imbang di laga pertama sedikit mengecewakan tapi saya bisa melihat semangat baru dalam permainan mu di bawah ruben amorim
kebanyakan pegang bola sekali d serang gol parah,kebanyakan pegang bola sekali di serang gol parah
kamu keren onana gak pernah becus nangkap penalti,kamu keren onana enggak pernah becus nangkap penalti
pkoknya jual dlu si rasford udah capek kali liat dia main ke gtu mulu,pokoknya jual dulu sih rasford sudah capek kali lihat dia main ke begitu mulu
jadwal main kapan jam berapa,jadwal main kapan jam berapa
mainnya tenang dan rapi seneng banget nontonnya,mainnya tenang dan rapi senang banget nontonnya
udah dari musim kemarin perform rashford ini turun bgtcuma mungkin karena pemain lokal yg harus di utamain jadi ten hag juga gak bisa nolak buat gak mainin dy kayanya,sudah dari musim kemarin perform rashford ini turun bgtcuma mungkin karena pemain lokal yang harus di utamain jadi ten hag juga enggak bisa nolak buat enggak mainin dia kayanya
jadwal main kapan jam berapa,jadwal main kapan jam berapa
defender kita lemot parah kalah sprint sama kakekkakek,defender kita lemot parah kalah sprint sama kakekkakek
eriksen gabisa pressing,eriksen enggak bisa pressing
saya senang melihat bruno fernandes tampil lebih dominan di lini tengah meskipun hasilnya imbang saya optimis dengan masa depan mu di bawah ruben amorim,saya senang melihat bruno fernandes tampil lebih dominan di lini tengah meskipun hasilnya imbang saya optimis dengan masa depan mu di bawah ruben amorim
ruben amorim membawa filosofi permainan yang menarik meskipun imbang saya berharap dia bisa segera membuat mu lebih kompetitif,ruben amorim membawa filosofi permainan yang menarik meskipun imbang saya berharap dia bisa segera membuat mu lebih kompetitif
pendukung itu apa bg aku fans emyu pokok nya yg ga sumbu pendek dan tetep objektif liat kondisi dalam dan luar lapangan,pendukung itu apa bang aku fan emyu pokok nya yang enggak sumbu pendek dan tetap objektif lihat kondisi dalam dan luar lapangan
hojlund makin tajam tapi jika defense nggak diperbaiki mu nggak akan jauh kemenangan masih belum cukup,hojlund makin tajam tapi jika defense enggak diperbaiki mu enggak akan jauh kemenangan masih belum cukup
antony tuker mudryk aja,antony tuker mudryk saja
gila seru banget pertandingan kali ini ayo terus berjuang,gila seru banget pertandingan kali ini ayo terus berjuang
di bawah amorim tim lebih solid secara keseluruhan meski ketajaman di depan gawang perlu ditingkatkan,di bawah amorim tim lebih solid secara keseluruhan meski ketajaman di depan gawang perlu ditingkatkan
maksud dia pemain brighton udah berada dibelakang bola semua,maksud dia pemain brighton sudah berada dibelakang bola semua
martial jilid,martial jilid
ya seperti biasa setelah ini lihat rashford beraksi buat villa dg sentuhan magic nyaseperti pemain mu lainnya yg terbuang,ya seperti biasa setelah ini lihat rashford beraksi buat villa dengan sentuhan magic nyaseperti pemain mu lainnya yang terbuang
midfield kita sampah nggak bisa ngontrol tempo umpan ngaco semua,midfield kita sampah enggak bisa ngontrol tempo umpan mengaco semua
skema serangan balik amorim lebih efektif pemain lebih cepat mengambil keputusan,skema serangan balik amorim lebih efektif pemain lebih cepat mengambil keputusan
nahh forest sering loh maen bek match terakhir menang juga pake formasi itu,nah forest sering loh main bek match terakhir menang juga pakai formasi itu
rasford onana akan selalu jadi starter main full mnt sampe akhir musim tak terkecuali mau main nya jelek sir ten hag nih bos kepala batu,rasford onana akan selalu jadi starter main full minta sampai akhir musim tak terkecuali mau main nya jelek sir ten hag nih bos kepala batu
mungkin krna ini sih jd emyu nambah m ajh,mungkin karena ini sih jadi emyu menambah m saja
tim medis nya dipertanyakan,tim medis nya dipertanyakan
peluang yang terbuang sangat disayangkan harus lebih efektif,peluang yang terbuang sangat disayangkan harus lebih efektif
sabar min masih ada lagi kekalahan demi kekalahan selanjutnya kalau kita ingin tsunami trophy main game aja,sabar min masih ada lagi kekalahan demi kekalahan selanjutnya kalau kita ingin tsunami trophy main game saja
jam berapa main nya bang,jam berapa main nya bang
jadwal main kapan jam berapa,jadwal main kapan jam berapa
piala fa ga ada var ya sepertinya goal maguire offside,piala fa enggak ada var ya sepertinya goal maguire offside
mu harus segera cari bek tengah baru terlalu mudah ditembus lawan,mu harus segera cari bek tengah baru terlalu mudah ditembus lawan
fit tp tll,fit tapi tll
permainan lebih terorganisir di bawah ruben amorim meskipun tim belum tampil maksimal saya melihat banyak potensi dalam tim ini,permainan lebih terorganisir di bawah ruben amorim meskipun tim belum tampil maksimal saya melihat banyak potensi dalam tim ini
maulana jangankan mau menyaingi pep untuk level arteta aja gak akan mampu,maulana jangankan mau menyaingi pep untuk level arteta saja enggak akan mampu
siap coach indraa nanti ingatkan lagi aja ya mungkin manajemen nya lupa,siap coach indraa nanti ingatkan lagi saja ya mungkin manajemen nya lupa
reflex onana sangat bagus tu gol pertama bengong doang,reflex onana sangat bagus itu gol pertama bengong doang
lah dulu beli pemain bintang mahal juga bapuk,lah dulu beli pemain bintang mahal juga bapuk
nah ini yang jadi pertanyakan juga kenapa kemarin mainin si raspot ya,nah ini yang jadi pertanyakan juga kenapa kemarin mainin sih raspot ya
ugarte dm maino cm bruno amf lwf garnacho rwf amad cf hojlund,ugarte dm maino cuma bruno amf lwf garnacho rwf amad cf hojlund
pelatih ga jelas banyak omong hasil,pelatih enggak jelas banyak omong hasil
nah yg heran tuh begitu padahal brighton prlatih baru tapi permainan enak,nah yang heran tuh begitu padahal brighton prlatih baru tapi permainan enak
jadwal main kapan jam berapa,jadwal main kapan jam berapa
iyayang rugi ed yg untung ineos,iyayang rugi ed yang untung ineos
disini gw ga bela onana yaa tapi tadi yang salah maguire malah fokus ke bola ga liat pergerakan welbeck,disini gue enggak bela onana ya tapi tadi yang salah maguire malah fokus ke bola enggak lihat pergerakan welbeck
mainnya lumayan nggak terlalu buruk tapi juga nggak spesial,mainnya lumayan enggak terlalu buruk tapi juga enggak spesial
botak emang beda pemain pengganti kocak semua,botak memang beda pemain pengganti kocak semua
pertandingan seru tapi tim harus lebih konsisten kalau mau menang terus,pertandingan seru tapi tim harus lebih konsisten kalau mau menang terus
betul bro yg penting menang aja udah alhamdulillah,betul bro yang penting menang saja sudah alhamdulillah
dc dlm bersepak bola juga butuh pemain pembawa keberuntungandulu puzzle saf adala eric cantonanomer nggak layak buat mountkalau nggak suruh dia ganti no punggung,dc dalam bersepak bola juga butuh pemain pembawa keberuntungandulu puzzle saf adala eric cantonanomer enggak layak buat mountkalau enggak suruh dia ganti no punggung
kemenangan memang penting tapi lebih penting lagi konsistensi,kemenangan memang penting tapi lebih penting lagi konsistensi
sangat layak tim remukan rengginang tukang sogok wasit harom,sangat layak tim remukan rengginang tukang sogok wasit harom
amorim ngebangun chemistry tim yang solid sampe yang mudamuda pun bisa saling dukung dan berkembang,amorim ngebangun chemistry tim yang solid sampai yang mudamuda pun bisa saling dukung dan berkembang
sabar dulu bang wkwkw pergantiannya emang aneh tunggu tahun lagi biar genap tahun kalo masih gitu gitu aja harus out eth kenapa tahun kita liat aja ke klop di liverpool,sabar dulu bang wkwkw pergantiannya memang aneh tunggu tahun lagi biar genap tahun kalo masih begitu begitu saja harus out eth kenapa tahun kita lihat saja ke klop di liverpool
kenapa tiap emyu cetak gol itu wasit var matanya langsung jeli,kenapa tiap emyu cetak gol itu wasit var matanya langsung jeli
fit tapi planga plongo,fit tapi planga plongo
laga kedua menunjukkan bahwa ruben amorim sudah mulai membuat perubahan dalam permainan tim meskipun masih ada banyak ruang untuk perbaikan,laga kedua menunjukkan bahwa ruben amorim sudah mulai membuat perubahan dalam permainan tim meskipun masih ada banyak ruang untuk perbaikan
busetbaru kalah sekali aja udah kayak kali kalah beruntunlebayy amat permainan udah keliatan jauh meningkat timbang musim kemarenmusim kemaren passing aja pada gak bisaskarang udah bisa keluar dari pressing lawan,busetbaru kalah sekali saja sudah kayak kali kalah beruntunlebayy amat permainan sudah kelihatan jauh meningkat timbang musim kemarenmusim kemarin passing saja pada enggak bisaskarang sudah bisa keluar dari pressing lawan
pergerakan tanpa bola lebih baik di era amorim dibanding ten hag,pergerakan tanpa bola lebih baik di era amorim dibanding ten hag
iya itu maksud gw bola udh depan semua pemain brigton kan suka tuh udh one on one sama kiper trus bola nya di oper ke samping kga offside,iya itu maksud gue bola sudah depan semua pemain brigton kan suka tuh sudah one on one sama kiper terus bola nya di oper ke samping kga offside
jadwal main kapan jam berapa,jadwal main kapan jam berapa
dia free transfer seengga nya ada opsi gelandang apalagi eriksen lindelof sancho mau out bisa ngurangin gaji tim,dia free transfer seengga nya ada opsi gelandang apalagi eriksen lindelof sancho mau out bisa ngurangin gaji tim
keputusan bijak nan cerdas wkwk ga ngikutin sebulan aja hidup rasanya lebih fresh,keputusan bijak nan cerdas wkwk enggak mengikuti sebulan saja hidup rasanya lebih fresh
kekalahan kita bermain sangat buruk terutama di lini belakang harus segera diperbaiki sebelum terlambat,kekalahan kita bermain sangat buruk terutama di lini belakang harus segera diperbaiki sebelum terlambat
jadwal main kapan jam berapa,jadwal main kapan jam berapa
flop juga gak masalah sih harga murahgaji juga turun jauh tidak ada biaya peminjaman juga,flop juga enggak masalah sih harga murahgaji juga turun jauh tidak ada biaya peminjaman juga
kekalahan yang sangat mengecewakan kita terlalu mudah kebobolan dan nggak ada perbaikan di lini belakang,kekalahan yang sangat mengecewakan kita terlalu mudah kebobolan dan enggak ada perbaikan di lini belakang
wkwk kasihan pelatih nya numpuk semua u,wkwk kasihan pelatih nya numpuk semua lu
kelihatannya comment tapi ndak lihat pertandingan,kelihatannya comment tapi indak lihat pertandingan
bales babak ke di stry selalu share l nk nntn emyu,balas babak ke di stry selalu share l nk menonton emyu
kalau mau juara mental harus diperbaiki dulu jangan gampang down kalau ketinggalan,kalau mau juara mental harus diperbaiki dulu jangan gampang down kalau ketinggalan
g jeles amat dokter fishio emyu ini trutma luke shaw,enggak jeles amat dokter fishio emyu ini trutma luke shaw
intinya lebih ke ngapain masih mainin si dalot,intinya lebih ke mengapai masih mainin sih dalot
kebobolan tadi salah martinez bukan maguire dia gak jaga welbeck,kebobolan tadi salah martinez bukan maguire dia enggak jaga welbeck
ayo unyu jangan lawak lagi kek musim lalu dong,ayo unyu jangan lawak lagi kayak musim lalu dong
sehat dah,sehat deh
oi oi oi,oi oi oi
amorim kasih kita kemenangan penting tapi pertahanan tetap jadi masalah buat mu tapi harus lebih solid,amorim kasih kita kemenangan penting tapi pertahanan tetap jadi masalah buat mu tapi harus lebih solid
tolong jangan nonton mu sampe juara,tolong jangan menonton mu sampai juara
ruben amorim sudah menunjukkan tandatanda positif dalam laga pertama meskipun hasilnya imbang saya percaya dia bisa memperbaiki tim lebih baik,ruben amorim sudah menunjukkan tandatanda positif dalam laga pertama meskipun hasilnya imbang saya percaya dia bisa memperbaiki tim lebih baik
klu streaming dimana,kalau streaming dimana
tinggal main doang apa susahnya system lu aja gajelas wkwk,tinggal main doang apa susahnya system lu saja enggak jelas wkwk
antony tuker mudryk aja,antony tuker mudryk saja
luke shaw masih idupkirain dah mati,luke shaw masih idupkirain deh mati
sangat mengecewakan kalah pertahanan dan serangan sangat buruk kita harus belajar dari kesalahan ini,sangat mengecewakan kalah pertahanan dan serangan sangat buruk kita harus belajar dari kesalahan ini
jadwal main kapan jam berapa,jadwal main kapan jam berapa
lae tenang ada mas mount,lae tenang ada mas mount
harus beli tipikal pemain no dan bisa free role plus penyerang pengalaman,harus beli tipikal pemain no dan bisa free role plus penyerang pengalaman
chemistry tim meningkat di bawah amorim pemain lebih bebas berekspresi,chemistry tim meningkat di bawah amorim pemain lebih bebas berekspresi
rashford pun tak guna,rashford pun tak guna
terus coba sebutin siapa yg cocok gantiin,terus coba sebutin siapa yang cocok gantiin
belum terlihat perubahan signifikan tapi setidaknya ada perbaikan kecil dalam pola permainan,belum terlihat perubahan signifikan tapi setidaknya ada perbaikan kecil dalam pola permainan
gak jelas maen y kaya tim liga bri njirr,enggak jelas main ya kaya tim liga bri anjir
meskipun kami hanya bermain imbang saya melihat adanya perubahan positif dalam gaya bermain mu di bawah ruben amorim,meskipun kami hanya bermain imbang saya melihat adanya perubahan positif dalam gaya bermain mu di bawah ruben amorim
