before_normalisasi,after_normalisasi
starting lineup premierleague mw crystal palace vs manchester united lineup yang hampir sama dengan mw saat emyu mengalahkan southampton bedanya garnacho starting amp,starting lineup premierleague mau crystal palace vs manchester united lineup yang hampir sama dengan mau saat emyu mengalahkan southampton bedanya garnacho starting amp
enawa ngati a gay,enawa ngati a gay
dan emyu masih gila,dan emyu masih gila
de ligt dan zirkzee masuk dalam squad belanda untuk jeda internasional manchesterunited deligt zirkzee kingemyu,deh ligt dan zirkzee masuk dalam squad belanda untuk jeda internasional manchesterunited deligt zirkzee kingemyu
banter liverpoolnya mana coach padahal kalah am juru kunci liga divisi loh coach ato emng malas ngebanter liverpool grgr kurang engagement kah ga emyu ga makan kah coach,banter liverpoolnya mana coach padahal kalah sama juru kunci liga divisi loh coach atau memang malas ngebanter liverpool grgr kurang engagement kah enggak emyu enggak makan kah coach
keliatan kek overweight,kelihatan kayak overweight
masih kak,masih kak
fulltime epl fulham manchester united gol semata wayang martinez selamatkan emyu,fulltime epl fulham manchester united gol semata wayang martinez selamatkan emyu
sejarah mulu yang di ungkit kek cewe aja,sejarah mulu yang di ungkit kayak cewek saja
goblok,goblok
tukang parkir pelaku pelecehan yg viral akhirnya diamankan kepolisian tkp di dekat rumah duka di bekasi timur kota bekasi nyamuk wulan guritno mulyono manchester united kalah tegal depok andika hendi menang emyu kemenangan istana wakil presiden,tukang parkir pelaku pelecehan yang viral akhirnya diamankan kepolisian tkp di dekat rumah duka di bekasi timur kota bekasi nyamuk wulan guritno mulyono manchester united kalah tegal depok andika hendi menang emyu kemenangan istana wakil presiden
dilain sisi andre onana juga mulai dipertanyakan penampilannya hanya mengandalkan distribusi bola tapi melupakan fungsi utama kiper yaitu menghalau bola untuk menjadi gol waktunya bayindir manchesterunited onana kingemyu,dilain sisi andre onana juga mulai dipertanyakan penampilannya hanya mengandalkan distribusi bola tapi melupakan fungsi utama kiper yaitu menghalau bola untuk menjadi gol waktunya bayindir manchesterunited onana kingemyu
kasihan menghibur diri terus lu ya paling sebentar lagi juga udh bisa dilewati tuh,kasihan menghibur diri terus lu ya paling sebentar lagi juga sudah bisa dilewati tuh
hbd mus,hbd mus
pelatih batu kyk gini masih di pakai aja,pelatih batu kayak begini masih di pakai saja
makanya kalo emyu maen jam malem auto skip wkwk,makanya kalo emyu main jam malem auto skip wkwk
emang sialan klub bola satu ini,memang sialan klub bola satu ini
manchester united vs fenerbache erik ten hag vs mourinho bruno amp,manchester united vs fenerbache erik ten hag vs mourinho bruno amp
bubarin aja dah ini klub ga ada benernya,bubarin saja deh ini klub enggak ada benernya
sruh gabung pemuda pancasila,sruh gabung pemuda pancasila
suruh balik lgi aja tuu pemain anyar kasian mentalnya ancur,suruh balik lagi saja tuh pemain anyar kasihan mentalnya hancur
emyu gak cape apa ya noh liat chelsea sama maresca barcelona sama flick pelatih itu penting woi becanda mulu ni club manchesterunited tenhagout,emyu enggak cape apa ya noh lihat chelsea sama maresca barcelona sama flick pelatih itu penting woi becanda mulu ini club manchesterunited tenhagout
resmi jadon sancho pindah ke chelsea dengan status pinjaman opsi wajib beli dengan ini transfer window resmi ditutup manchesterunited sancho kingemyu,resmi jadon sancho pindah ke chelsea dengan status pinjaman opsi wajib beli dengan ini transfer window resmi ditutup manchesterunited sancho kingemyu
katakata hari ini bang onahlo yhaa jangan lupa tonton emyu di kandang sendiri superlive supersoccer inirasanyasuper manchesterunited,katakata hari ini bang onahlo yhaa jangan lupa tonton emyu di kandang sendiri superlive supersoccer inirasanyasuper manchesterunited
anjg,anjg
ganti klub malam aja gblk,ganti klub malam saja gblk
bang,bang
sahabat sejati kan,sahabat sejati kan
selamat hari sumpah pemuda oktober maju bersama indonesia raya sumpahpemuda timnasday majubersama indonesiaraya oktober arsliv pemudaindonesia selamatharisumpahpemuda arsenal manchester united emyu lolos australia van dijk arteta najwa,selamat hari sumpah pemuda oktober maju bersama indonesia raya sumpahpemuda timnasday majubersama indonesiaraya oktober arsliv pemudaindonesia selamatharisumpahpemuda arsenal manchester united emyu lolos australia van dijk arteta najwa
belajarnya drill drill fundamental mentalnya besar,belajarnya drill drill fundamental mentalnya besar
jadwal main kapan jam berapa,jadwal main kapan jam berapa
jadi yg problematic siapa nih bingung saya pemain emyu kalau pergi malah jadi jago,jadi yang problematic siapa nih bingung saya pemain emyu kalau pergi malah jadi jago
emyu kalahan aja saya gak pindah ngefans klub lain apalagi ada solidaritas kayak gini manchester united is the best club in the world,emyu kalahan saja saya enggak pindah ngefans klub lain apalagi ada solidaritas kayak begini manchester united is the best club ini the world
selesai tuh emyu,selesai tuh emyu
ayo semangat semangat dong,ayo semangat semangat dong
lah jadinya apa boss,lah jadinya apa bos
tumbang t nya apa adik adik,tumbang t nya apa adik adik
pemain lu kocak kocak,pemain lu kocak kocak
hadeh masa harus menjelaskan ulang udah banyak yg jelasin itu carok itu opsii terakhir kalau tetep gamau damai pihak sananya mereka tetep berharap bisa jalur damai bang,hadeh masa harus menjelaskan ulang sudah banyak yang jelasin itu carok itu opsii terakhir kalau tetap enggak mau damai pihak sananya mereka tetap berharap bisa jalur damai bang
bau bau bikin mager nonton ni mah,bau bau bikin mager menonton ini mah
seperti biasa yg dibahas prestasi musim ini dijawabnya dengan sejarah masa lalu sip terbaiks ente,seperti biasa yang dibahas prestasi musim ini dijawabnya dengan sejarah masa lalu sip terbaiks ente
bener bner pak mewakili ortu murid lain ny nihh,benar benar pak mewakili orang tua murid lain nya nih
pemain manchester united yg berlaga di jeda internasional telah kembali semua dengan keadaan tanpa cidera manchesterunited kingemyu,pemain manchester united yang berlaga di jeda internasional telah kembali semua dengan keadaan tanpa cidera manchesterunited kingemyu
itu emang emyu tulisan arabnya dibaca manchester united,itu memang emyu tulisan arabnya dibaca manchester united
minggu malam hujan deras squidward di tv bahas realmadrid vs manchester united azka cek lovescoutep uya kuya di story aguan bahas trump berurat banget celetuk emyu fans virnight sambil lihat shaniweddingday trending absurd banget link,minggu malam hujan deras squidward di tv bahas realmadrid vs manchester united azka cek lovescoutep uya kuya di story aguan bahas trump berurat banget celetuk emyu fan virnight sambil lihat shaniweddingday trending absurd banget link
gue nunggu lu ngetrol jersey tanah abang min plis hayukk,gue nunggu lu ngetrol jersey tanah abang min plis hayo
ugarte telah tiba di carington dan akan menandatangani kontraknya hari ini pengumuman official akan menyusul manchesterunited ugarte kingemyu,ugarte telah tiba di carington dan akan menandatangani kontraknya hari ini pengumuman official akan menyusul manchesterunited ugarte kingemyu
jgn salah cinta masih ada masih tetep di hati tpi untuk saat ini gk nonton dulu nyakitin mulu,jangan salah cinta masih ada masih tetap di hati tapi untuk saat ini enggak menonton dulu nyakitin mulu
cireng emyu,cireng emyu
cocok dengan hastagnya muntot emyu babi,cocok dengan hastagnya muntot emyu babi
bahas sejarah mulu awokawok,bahas sejarah mulu awokawok
kick off babak ke dua manchester united vs leicester city skor sementara emyu unggul dua gol tanpa balas tadi sempat lihat anak kecil yang nonton di old trafford bawa tulisan terima kasih buat ruud van nistelrooy dan minta dia tetap di mufc munlei,kick off babak ke dua manchester united vs leicester city skor sementara emyu unggul dua gol tanpa balas tadi sempat lihat anak kecil yang menonton di old trafford bawa tulisan terima kasih buat ruud van nistelrooy dan meminta dia tetap di mufc munlei
pagi td beli jersey birunya malam ini mainnya kyk babi bgst tau gitu duitnya gw belikan makanan,pagi tadi beli jersey birunya malam ini mainnya kayak babi bgst tau begitu duitnya gue belikan makanan
manchester united saat ini tidak kesepakatan atau ketertarikan untuk ben chilwell manchesterunited kingemyu,manchester united saat ini tidak kesepakatan atau ketertarikan untuk ben chilwell manchesterunited kingemyu
selesai tuh emyu,selesai tuh emyu
starting lineup premierleague mw manchester united vs leicester rvn menurunkan skuad serupa saat imbangi chelsea bedanya kali ini amad start garnacho bench match ini jadi laga keempat sekaligus terakhir bagi nistelrooy as manager interim emyu mufc munlei,starting lineup premierleague mau manchester united vs leicester rvn menurunkan skuad serupa saat imbangi chelsea bedanya kali ini amad start garnacho bench match ini jadi laga keempat sekaligus terakhir bagi nistelrooy as manager interim emyu mufc munlei
sangat benaarr,sangat benaarr
habis nonton persib lanjut emyu poin semua inimah persib manchesterunited,habis menonton persib lanjut emyu poin semua inimah persib manchesterunited
whatever it is its fucking work akhirnya bisa nahan imbang emyu hamdallah,whatever itu is its fucking work akhirnya bisa menahan imbang emyu hamdallah
tiada hari tanpa memaki mu,tiada hari tanpa memaki mu
gws licha,gws licha
di emyu era kegelapan ga begitu,di emyu era kegelapan enggak begitu
beginilah seharusnya manchester united bermain amorim master class muneve mufc,beginilah seharusnya manchester united bermain amorim master class muneve mufc
kata gua mah kan udah tau hasilnya ga ditonton jga btw masih mending sih mbaknya ga fans emyu juga,kata gua mah kan sudah tau hasilnya enggak ditonton juga btw masih mending sih mbaknya enggak fan emyu juga
perkenalan ot langsung minn,perkenalan ot langsung minn
berak dulu min,berak dulu min
gass terus lee,gass terus lee
hahaha udah bener ternyata gua tinggal tidur tadi malam emang kagak beres ini tim mainnya busuk gitu gajelas,hahaha sudah benar ternyata gua tinggal tidur tadi malam memang kagak beres ini tim mainnya busuk begitu enggak jelas
manchester united emyu onana garbacho novi agus malam jumat maljum pagii sarapan,manchester united emyu onana garbacho novi agus malam jumat maljum pagii sarapan
saatnya meramaikan wa nya fandar,saatnya meramaikan wa nya fandar
akun emyu paling ga jelas ini beritain emyu no yg penting drama sama bahas timnas,akun emyu paling enggak jelas ini beritain emyu no yang penting drama sama bahas timnas
siap,siap
cek jersey manchester united emyu away grade_ori_import thailand baju bola mu kaos bola man united setelan dewasa jersy sepakbola dengan harga rp dapatkan di shopee sekarang,cek jersey manchester united emyu away grade_ori_import thailand baju bola mu kaos bola man united setelan dewasa jersy sepakbola dengan harga rp dapatkan di shopee sekarang
bubarin aja yuk ini klub,bubarin saja yuk ini klub
bubar wae ngisinni,bubar wae ngisinni
first winnya amorim langsung dapat pujian settings langit dari michael owen waktunya emyu tsunami trofi khh superlive supersoccer inirasanyasuper manchesterunited,first winnya amorim langsung dapat pujian settings langit dari michael owen waktunya emyu tsunami trofi khh superlive supersoccer inirasanyasuper manchesterunited
mu babi,mu babi
wkwkwkwkkwwk botak bukan sembarang botak ini botak yg bersinar kocak bukan sembarang kocak emyu semakin terjungkal,wkwkwkwkkwwk botak bukan sembarang botak ini botak yang bersinar kocak bukan sembarang kocak emyu semakin terjungkal
fans mu ora stress nonton kowe main wae wes apik,fan mu ora stres menonton kowe main wae wes apik
goblok,goblok
manchester united akan menerima m dari penjualan hanibal mejbri manchesterunited hanibalmejbri kingemyu,manchester united akan menerima m dari penjualan hanibal mejbri manchesterunited hanibalmejbri kingemyu
ini saluran king emyu kenapa guys manchesterunited footbalovers fbtlindonesia emyu,ini saluran king emyu kenapa guys manchesterunited footbalovers fbtlindonesia emyu
nonton emyu bertandang ke kandang arsenal ga terima gua sama paul merson yang bilang arsenal bakal menang mudah lawan manchester united dan prediksi di google yang nunjukin peluang emyu menang di pertandingan ini cuma menit ke skor masih imbang tanpa gol arsmun,menonton emyu bertandang ke kandang arsenal enggak terima gua sama paul merson yang bilang arsenal bakal menang mudah lawan manchester united dan prediksi di google yang nunjukin peluang emyu menang di pertandingan ini cuma menit ke skor masih imbang tanpa gol arsmun
selesai tuh emyu,selesai tuh emyu
dimas drajad,dimas drajad
auah terserah lu aja lah,auah terserah lu saja lah
ten hag goblog pemain goblog semuanya goblog,ten hag goblog pemain goblog semuanya goblog
seng genah mainmu bang abang cok i,seng genah mainmu bang abang cok i
ow yeah bocil emyu,ow yeah bocil emyu
ak fans emyu bgt padahal,aku fan emyu banget padahal
sangat benaarr,sangat benaarr
sumber berita yg mengatakan antony ingin pergi ke fenerbache tidak valid hoax manchesterunited antony kingemyu,sumber berita yang mengatakan antony ingin pergi ke fenerbache tidak valid hoax manchesterunited antony kingemyu
first touch udah oke dribbling okelah tinggal tekniknya doang ni dik garna,first touch sudah oke dribbling okelah tinggal tekniknya doang ini dik garna
angel gomes ketika meninggalkan manchester united saat saya pergi sepertinya itu adalah ide untuk saya menjadi pemain dan pribadi lebih baik manchesterunited kingemyu,angel gomes ketika meninggalkan manchester united saat saya pergi sepertinya itu adalah ide untuk saya menjadi pemain dan pribadi lebih baik manchesterunited kingemyu
ke mu dah coba,ke mu deh coba
manchester united semakin terpuruk usai kalah telak dari tottenham dengan bruno fernandes diusir keluar erik ten hag semakin di bawah tekanan kala chelsea merangsak naik di papan atas muntot epl premier league vidio ten hag emyu spurs dalot emyu,manchester united semakin terpuruk usai kalah telak dari tottenham dengan bruno fernandes diusir keluar erik ten hag semakin di bawah tekanan kala chelsea merangsak naik di papan atas muntot epl premier league vidio ten hag emyu spurs dalot emyu
meanwhile di eredivisie ajax lg memimpin klasemen poin sama ma psv tp msh pny match pelatihnya bagus nih cocok ngelatih emyu,meanwhile di eredivisie ajax lagi memimpin klasemen poin sama sama psv tapi masih punya match pelatihnya bagus nih cocok ngelatih emyu
pelatihe pecat goblok,pelatihe pecat goblok
semoga harimu senin terus dolor,semoga harimu senin terus dolor
emyu dalam ancaman king maharaja mudryk masuk munche mufc manchesterunited,emyu dalam ancaman king maharaja mudryk masuk munche mufc manchesterunited
kenapa harus ten hag disalahin harusnya yg disalahin itu fans atau suporter mu menganggap mu adalah club besar padahal hanya sekelas norwich city,kenapa harus ten hag disalahin harusnya yang disalahin itu fan atau suporter mu menganggap mu adalah club besar padahal hanya sekelas norwich city
dilain sisi andre onana juga mulai dipertanyakan penampilannya hanya mengandalkan distribusi bola tapi melupakan fungsi utama kiper yaitu menghalau bola untuk menjadi gol waktunya bayindir manchesterunited onana kingemyu,dilain sisi andre onana juga mulai dipertanyakan penampilannya hanya mengandalkan distribusi bola tapi melupakan fungsi utama kiper yaitu menghalau bola untuk menjadi gol waktunya bayindir manchesterunited onana kingemyu
emyu dan siti malam ini manchesterunited manchestercity,emyu dan siti malam ini manchesterunited manchestercity
ciri fans emyu kalo lagi bapuk bahas sejarah,ciri fan emyu kalo lagi bapuk bahas sejarah
ku yakin kau bisa,ku yakin kau bisa
kalo emyu menang aja pada keluar lu coba kalah masuk goa lu pada dasar fans kardus manchesterunited muneve,kalo emyu menang saja pada keluar lu coba kalah masuk goa lu pada dasar fan kardus manchesterunited muneve
oke gas muatamu,oke gas muatamu
ada unsur komedinya kaga nih,ada unsur komedinya kagak nih
karena kami tau walau emyu gak juara epl pun tetap yg terbanyak juara epl itu manchester united,karena kami tau walau emyu enggak juara epl pun tetap yang terbanyak juara epl itu manchester united
usut punya usut beliau ke komplek latihan manchester united pagi buta itu mencoba untuk mencari sang legenda emyu katanya dulu di mu ada pemain terhebat sepanjang masa dimana dia berlatih lebih dulu sebelum temantemannya datang d,usut punya usut beliau ke komplek latihan manchester united pagi buta itu mencoba untuk mencari sang legenda emyu katanya dulu di mu ada pemain terhebat sepanjang masa dimana dia berlatih lebih dulu sebelum temantemannya datang di
ga bisa liga inggris,enggak bisa liga inggris
sedikit sedikit lah niru kakakmu dari italia ya,sedikit sedikit lah meniru kakakmu dari italia ya
ini zaman jose vs fergusson manchester united vs chelsea wib saksikan livenya jangan sampai ketinggalan kita liat chelsea bisa ngalahain emyu di oldtrafford atau memang kalah tipis chelsea mufc ggmu,ini zaman jose vs fergusson manchester united vs chelsea wib saksikan livenya jangan sampai ketinggalan kita lihat chelsea bisa ngalahain emyu di oldtrafford atau memang kalah tipis chelsea mufc ggmu
dalot kocak,dalot kocak
manuel ugarte telah menyelesaikan tes medisnya di manchester united pengumuman resminya akan diumumkan hari kamis waktu setempat manchesterunited ugarte kingemyu,manuel ugarte telah menyelesaikan tes medisnya di manchester united pengumuman resminya akan diumumkan hari kamis waktu setempat manchesterunited ugarte kingemyu
fans emyu satu ini meresahkan banget,fan emyu satu ini meresahkan banget
met tanggal ye,selamat tanggal ye
emyu lagi emyu lagi kasihan banget emyu,emyu lagi emyu lagi kasihan banget emyu
wkwwkwk katanya doangklau liverpool di bilang satu,wkwwkwk katanya doangklau liverpool di bilang satu
manchester united emyu menang rrq menang liverpool kalah malam minggu yang indah kawan,manchester united emyu menang rrq menang liverpool kalah malam minggu yang indah kawan
atau nih,atau nih
gas gak sih menangin kmrn sial aja si henderson jadi jago parah,gas enggak sih menangin kemarin sial saja sih henderson jadi jago parah
nyimak fans emyu metu guo,menyimak fan emyu metu guo
ayo semangat semangat dong,ayo semangat semangat dong
breaking untuk kesekian kalinya marcus rashford tidak masuk skuad manchester united ia ditinggal untuk laga liga europa menghadapi fcsb lusa nanti di emyu dicampakkan dijual sulit gimana ini le,breaking untuk kesekian kalinya marcus rashford tidak masuk skuad manchester united ia ditinggal untuk laga liga europa menghadapi fcsb lusa nanti di emyu dicampakkan dijual sulit bagaimana ini boleh
kalo fans emyu antara makin sedih atau jadi marah,kalo fan emyu antara makin sedih atau jadi marah
manchester united catatkan kekalahan beruntun laga selanjutnya mereka akan menghadapi lawan berat melawan pemuncak klasemen premier league liverpool dan melawan arsenal di putaran ketiga fa cup gimana fans emyu,manchester united catatkan kekalahan beruntun laga selanjutnya mereka akan menghadapi lawan berat melawan pemuncak klasemen premier league liverpool dan melawan arsenal di putaran ketiga fa cup bagaimana fan emyu
kalo misal khusus emyu minta gawang yang lebih kecil bisa ga min,kalo misal khusus emyu meminta gawang yang lebih kecil bisa enggak min
untuk kasus oyedele dia akan main di salah satu klub top di negara yang dia bela di level internasional itu kan kabar baik disyukuri aja kalau karir dia bagus bahkan dia gak balik ke emyu pun dia akan tetap selalu jadi lulusan akademi manchester united itu membanggakan,untuk kasus oyedele dia akan main di salah satu klub top di negara yang dia bela di level internasional itu kan kabar baik disyukuri saja kalau karir dia bagus bahkan dia enggak balik ke emyu pun dia akan tetap selalu jadi lulusan akademi manchester united itu membanggakan
kalau pemain emyu pasti banyak media yang bilang ruined by manchester united,kalau pemain emyu pasti banyak media yang bilang ruined by manchester united
min pliss deh besok senin,min pliss deh besok senin
bahas sejarah mulu le,bahas sejarah mulu boleh
noussair mazraoui membuat challenges dan memenangkan semuanya manchesterunited mazraoui kingemyu,noussair mazraoui membuat challenges dan memenangkan semuanya manchesterunited mazraoui kingemyu
harusnya yang minta maaf sis,harusnya yang meminta maaf sis
halloween kali ini temanya jadi manchester united kurang jerseinya doang tapi ga mau beli jersei emyu njir,halloween kali ini temanya jadi manchester united kurang jerseinya doang tapi enggak mau beli jersei emyu anjir
statistik emyu in laliga goal goa antony goal hormat,statistik emyu ini laliga goal goa antony goal hormat
pasang aja onana terus,pasang saja onana terus
pesan perpisajan hanibal mejbri manchesterunited hanibalmejbri kingemyu,pesan perpisajan hanibal mejbri manchesterunited hanibalmejbri kingemyu
due tige bujan lapuk emyu semakin bapuk manchesterunited emyu melayu,due tige bujan lapuk emyu semakin bapuk manchesterunited emyu melayu
dibantu wasit menangnya,dibantu wasit menangnya
tim tetangga kapan win nya tuh emyu manchesterunited amorimball,tim tetangga kapan win nya tuh emyu manchesterunited amorimball
facup aet manchester united liverpool mctominay antony rashford amad diallo amad diallo mac allister salah elliott gila gila gila emyu ke semifinal,facup aet manchester united liverpool mctominay antony rashford amad diallo amad diallo mac allister salah elliott gila gila gila emyu ke semifinal
ft premier league r ben amorim debut king emyu ditahan imbang tim promosi yang sedang berada di zona degradasi ipswich town manchester united gol hutchison rashford,ft premier league r ben amorim debut king emyu ditahan imbang tim promosi yang sedang berada di zona degradasi ipswich town manchester united gol hutchison rashford
sampah,sampah
manchester united emyu mu,manchester united emyu mu
emg bagus sebener ni orang dah pas di ajax juga lumayan ke emyu ngapa jadi kaya terasi aceh lemes bgt,memang bagus sebener ini orang deh pas di ajax juga lumayan ke emyu ngapa jadi kaya terasi aceh lemes banget
sudah menjadi tradisi sepertinya selalu ada pemain yang bodoh disetiap pertandingan emyu yg bodoh lawan wolves kali ini bruno fernandes onana garnacho tertawakan yang keras untuk manchester united _ sack ten hag antony amorim emyu mufc onana,sudah menjadi tradisi sepertinya selalu ada pemain yang bodoh disetiap pertandingan emyu yang bodoh lawan wolves kali ini bruno fernandes onana garnacho tertawakan yang keras untuk manchester united _ sack ten hag antony amorim emyu mufc onana
koq kalah,kok kalah
ga menang gw santet satu satu,enggak menang gue santet satu satu
apa perlu ditutorin cara main yg bener ama persib bandung min,apa perlu ditutorin cara main yang benar sama persib bandung min
jadi fans emyu kak soalnya saya gitu kaya ngerasa lebih tertantang buat hidup lebih lama,jadi fan emyu kak soalnya saya begitu kaya merasa lebih tertantang buat hidup lebih lama
cepat sembuh licha gimana ga cape nge cover terus menerus dalot yg kelewat trs,cepat sembuh licha bagaimana enggak cape nge cover terus menerus dalot yang kelewat terus
ajg sombongnya,ajg sombongnya
kena lagi aja emyu,kena lagi saja emyu
mending ngepens sama emyu bang biar makin stress,mending ngepens sama emyu bang biar makin stres
knp tiap pelatih ke emyu selalu ada favoritism ten hag dgn antony lah amorim sm dalot jga football iq nya dalot ini bener jelek,kenapa tiap pelatih ke emyu selalu ada favoritism ten hag dengan antony lah amorim sama dalot juga football iq nya dalot ini benar jelek
emyu gua mah udah menang cah,emyu gua mah sudah menang cah
joshua zirkzee untuk beberapa saat memang sulit ini manchester united dan ini adalah tim besar manchesterunited zirkzee kingemyu,joshua zirkzee untuk beberapa saat memang sulit ini manchester united dan ini adalah tim besar manchesterunited zirkzee kingemyu
manchester united mu kembali telan kekalahan takluk dari wolves pekan ke liga inggris dengan skor di stadion molineux jumat dini hari wib posting ini sambil ngga enak ati ke fans emyu,manchester united mu kembali telan kekalahan takluk dari wolves pekan ke liga inggris dengan skor di stadion molineux jumat dini hari wib posting ini sambil enggak enak ati ke fan emyu
ini kiper terbodoh sepanjang sejarah mu,ini kiper terbodoh sepanjang sejarah mu
manuel ugarte telah berlatih bersama tim utama hari ini dan kemungkinan akan disiapkan untuk laga melawan liverpool manchesterunited ugarte kingemyu,manuel ugarte telah berlatih bersama tim utama hari ini dan kemungkinan akan disiapkan untuk laga melawan liverpool manchesterunited ugarte kingemyu
merem bentaran mimpi emyu menang kok bisa ya manchesterunited,merem bentaran mimpi emyu menang kok bisa ya manchesterunited
sama sama admin,sama sama admin
kobbie mainoo mencatatkan dribel akurasi umpan amp,kobbie mainoo mencatatkan dribel akurasi umpan amp
ubur ikan lelee,ubur ikan lelee
anjinglah onana,anjinglah onana
kalo menang alhamdulillah kalo kalah yaudah lah yasampe g bisa sedih loh kalian kalah,kalo menang alhamdulillah kalo kalah yaudah lah yasampe enggak bisa sedih loh kalian kalah
liverpool manchester united ini emyu apa madrid woyy livmun premierleague,liverpool manchester united ini emyu apa madrid woyy livmun premierleague
club lain kenapa tiap ganti pelatih pasti bagus anjing ini emyu gua tiap ganti pelatih kenapa selalu ampas dah manchesterunited,club lain kenapa tiap ganti pelatih pasti bagus anjing ini emyu gua tiap ganti pelatih kenapa selalu ampas deh manchesterunited
akhirnya bisa liat luke shaw main lagi,akhirnya bisa lihat luke shaw main lagi
