before_normalisasi,after_normalisasi
tipis aja emyu menang manchesterunited,tipis saja emyu menang manchesterunited
waktunya muntot,waktunya muntot
goblok ah,goblok ah
bocil emyu,bocil emyu
alhamdulillah ya rabb,alhamdulillah ya rabb
resmi trebel hanya di pegang emyu dan city lessgo,resmi trebel hanya di pegang emyu dan city lessgo
yang penting punya hp,yang penting punya hp
semalam habis nonton emyu pasti,semalam habis menonton emyu pasti
gebrakan september,gebrakan september
ampun,ampun
jadwal lengkap pot europa league manchesterunited kingemyu,jadwal lengkap pot europa league manchesterunited kingemyu
semoga harimu senin terus dolor,semoga harimu senin terus dolor
reset mulu tiap match gapunya pakem tetep gitu langsung kelarin aja ga sih liga lanjut uel sama fa aja z,reset mulu tiap match enggak punya pakem tetap begitu langsung kelarin saja enggak sih liga lanjut uel sama fa saja saja
keren emyu baru kemarin mengakhiri januari dengan kemenangan eh ganti bulan bentar langsung mengawali februari dengan kekalahan dong mantep dah manchester united mantep tololnya,keren emyu baru kemarin mengakhiri januari dengan kemenangan eh ganti bulan bentar langsung mengawali februari dengan kekalahan dong mantap deh manchester united mantap tololnya
keren bentar lagi tsunami,keren bentar lagi tsunami
gabisa liga inggris anjeng,enggak bisa liga inggris anjeng
half time tottenham untuk sementara unggul atas manchester united bruno fernandes mendapatkan kartu merah man united harus bermain dengan pemain di sisa waktu masih ada peluang buat emyu terhindar dari kekalahan,half time tottenham untuk sementara unggul atas manchester united bruno fernandes mendapatkan kartu merah man united harus bermain dengan pemain di sisa waktu masih ada peluang buat emyu terhindar dari kekalahan
disuruh nangkep malah duduk wkwk,disuruh nangkep malah duduk wkwk
chelsea masuk dalam perburuan jadon sancho manchesterunited sancho kingemyu,chelsea masuk dalam perburuan jadon sancho manchesterunited sancho kingemyu
kenapa pas gw tonton kalah mlu ajg kmren ga gw tonton menang mlu tim tolol,kenapa pas gue tonton kalah melulu ajg kemarin enggak gue tonton menang melulu tim tolol
ugarte dilaga melawan venezuela manchesterunited ugarte kingemyu,ugarte dilaga melawan venezuela manchesterunited ugarte kingemyu
antenganteng aja om,antenganteng saja om
mu ini gobloknya minta ampun,mu ini gobloknya meminta ampun
ogah,ogah
cireng emyu,cireng emyu
fans emyu rasah dijak,fan emyu rasah dijak
kreak lagi lah bang lumayan banyak gaya walau hasil merana,kreak lagi lah bang lumayan banyak gaya walau hasil merana
seng genah mainmu bang abang cok i,seng genah mainmu bang abang cok i
kalo maen jam udh pasti menang tapi kalo maen jam an udh pasti kalah,kalo main jam sudah pasti menang tapi kalo main jam an sudah pasti kalah
udh pemanasan aja dlu amorimout,sudah pemanasan saja dulu amorimout
eth presscon after match ya ini hasil yang bagus untuk kami setidaknya kami hanya kebobolan gol premierleague chelsea emyu manchesterunited mufc tenhagout,eth presscon after match ya ini hasil yang bagus untuk kami setidaknya kami hanya kebobolan gol premierleague chelsea emyu manchesterunited mufc tenhagout
iyaa gpp ufi di penjara siapa tau emyu jadi bagus maennya ga di nontonin dia,iya enggak apa-apa ufi di penjara siapa tau emyu jadi bagus maennya enggak di nontonin dia
bubar weh lah,bubar weh lah
dan emyu masih gila,dan emyu masih gila
nah comeback menang lah jangan kalah mulu fans ggmu merasa kecewa,nah comeback menang lah jangan kalah mulu fan ggmu merasa kecewa
angel gomes ketika meninggalkan manchester united saat saya pergi sepertinya itu adalah ide untuk saya menjadi pemain dan pribadi lebih baik manchesterunited kingemyu,angel gomes ketika meninggalkan manchester united saat saya pergi sepertinya itu adalah ide untuk saya menjadi pemain dan pribadi lebih baik manchesterunited kingemyu
buka distro jo,buka distro jo
min kok harinya,min kok harinya
siapa yang bisa gendong emyu kalo pilarnya justru tuntas kkm aja kagak mau bilang apaan ke mereka ges superlive supersoccer inirasanyasuper manchesterunited,siapa yang bisa gendong emyu kalo pilarnya justru tuntas kkm saja kagak mau bilang apaan ke mereka ges superlive supersoccer inirasanyasuper manchesterunited
starting xi facup r arsenal vs manchester united laga perdana fa cup emyu langsung ketemu big team mufc arsmun,starting xi facup r arsenal vs manchester united laga perdana fa cup emyu langsung ketemu big team mufc arsmun
staf pelatih manchester united sangat senang dengan perkembangan andre onana di musim kedua sejak bergabung dari inter milan sumber fabrizio romano bener juga sih kalau bukan karena onana sudah nambah berapa gol lagi yang bersarang di gawang emyu,staf pelatih manchester united sangat senang dengan perkembangan andre onana di musim kedua sejak bergabung dari inter milan sumber fabrizio romano benar juga sih kalau bukan karena onana sudah menambah berapa gol lagi yang bersarang di gawang emyu
zirkzee dilaga vs boznia manchesterunited zirkzee kingemyu,zirkzee dilaga vs boznia manchesterunited zirkzee kingemyu
fulltime epl fulham manchester united gol semata wayang martinez selamatkan emyu,fulltime epl fulham manchester united gol semata wayang martinez selamatkan emyu
fans liverpool terbangsat dan alay bilang fans emyu miskin akting lu miskin kang malu ynwa,fan liverpool terbangsat dan alay bilang fan emyu miskin akting lu miskin kang malu ynwa
tumbang o dewe,tumbang o dewe
sahabat sejati kan,sahabat sejati kan
pemain lu kocak kocak,pemain lu kocak kocak
blm ngerasain puncak klasemen tp udh dingin bgt,belum ngerasain puncak klasemen tapi sudah dingin banget
ted lasso ngelatih emyu baru menarik,ted lasso ngelatih emyu baru menarik
degradasi aja ini klub,degradasi saja ini klub
semoga ga parah amat bang bucher,semoga enggak parah amat bang bucher
awal lihat starting nya aja dah gak expect menang,awal lihat starting nya saja deh enggak expect menang
udah gue bilang obama itu babi tolol,sudah gue bilang obama itu babi tolol
hahaha udah bener ternyata gua tinggal tidur tadi malam emang kagak beres ini tim mainnya busuk gitu gajelas,hahaha sudah benar ternyata gua tinggal tidur tadi malam memang kagak beres ini tim mainnya busuk begitu enggak jelas
dari kandang emyu ke kandang chelsea,dari kandang emyu ke kandang chelsea
menang sekali kalah sering kali,menang sekali kalah sering kali
breaking news klubklub premier league telah mengusulkan agar manchester united didiskualifikasi dari premier league musim ini klub klub inggris merasa king emyu telah berada di level yang berbeda pihak premier league masih mempertimban,breaking news klubklub premier league telah mengusulkan agar manchester united didiskualifikasi dari premier league musim ini klub klub inggris merasa king emyu telah berada di level yang berbeda pihak premier league masih mempertimban
yg emyu emyu aja,yang emyu emyu saja
skwkkwkwkw pr bgt yaa,skwkkwkwkw pr banget ya
emyu,emyu
selama pelatihnya amorim terabas ajalah gw percaya sama taktiknya dia beda klo yg pegang botak belanda draw mulu,selama pelatihnya amorim terabas ajalah gue percaya sama taktiknya dia beda kalo yang pegang botak belanda draw mulu
eh kepengen dah nobar emyu kyk gini kayaknya seru,eh kepengen deh menonton bareng emyu kayak begini kayaknya seru
gajadi semua kaya tai lah,gajadi semua kaya tahi lah
siap melihat king emyu memasak serigala jadi jadian manchesterunited,siap melihat king emyu memasak serigala jadi jadian manchesterunited
mu butuh michael carrick,mu butuh michael carrick
kalo el gasing gacor berarti emyu bermasalah,kalo el gasing gacor berarti emyu bermasalah
dan apa onana masih dikasih kesempatan dulur awokwok untung menang,dan apa onana masih dikasih kesempatan dulur awokwok untung menang
siap degradasi le,siap degradasi boleh
langsung kasih aja pialanya ke emyu cik manchester united ggmu mufc acmliv antony rashford carabao cup,langsung kasih saja pialanya ke emyu cik manchester united ggmu mufc acmliv antony rashford carabao cup
jangan sia sia kan waktu istirahat mu dengan menonton tim setan,jangan sia sia kan waktu istirahat mu dengan menonton tim setan
cc kang,cc kang
yang fans edition kaga ada nih,yang fan edition kagak ada nih
history emyu ucl kak sekarang siap degradasi dulu,history emyu ucl kak sekarang siap degradasi dulu
paling ganas iki lee,paling ganas iki lee
ban kapten dicopot sempat ditarik dari starting dicemooh fans sendiri dapat ancaman serius baik ke pribadi maupun keluarganya dijadikan bahan lelucon dunia real mentality monster dihina tidak tumbang,ban kapten dicopot sempat ditarik dari starting dicemooh fan sendiri dapat ancaman serius baik ke pribadi maupun keluarganya dijadikan bahan lelucon dunia real mentality monster dihina tidak tumbang
emyu mu manchester united,emyu mu manchester united
belum selesai kira kira minggu depan masih ada pembantaian lagi gak ya,belum selesai kira kira minggu depan masih ada pembantaian lagi enggak ya
kalo menang alhamdulillah kalo kalah yaudah lah yasampe g bisa sedih loh kalian kalah,kalo menang alhamdulillah kalo kalah yaudah lah yasampe enggak bisa sedih loh kalian kalah
asal admin mu jangan ya ges,asal admin mu jangan ya ges
kiper anjing mula sama rambut dulu tuh benerin baru jadi kiper jg tolol woi lu main di old trafford tp kek tai itu kiper lu muka nya mirip monyet,kiper anjing mula sama rambut dulu tuh benerin baru jadi kiper juga tolol woi lu main di old trafford tapi kayak tahi itu kiper lu muka nya mirip monyet
dimas drajad,dimas drajad
bantal emyu,bantal emyu
ow yeah bocil emyu,ow yeah bocil emyu
rashford garnacho casemiro dan malacia satu dari mereka kemungkinan bakal cabut dari emyu januari ini dengan nama pertama adalah mungkin yang paling kencang untuk keluar dari manchester united,rashford garnacho casemiro dan malacia satu dari mereka kemungkinan bakal cabut dari emyu januari ini dengan nama pertama adalah mungkin yang paling kencang untuk keluar dari manchester united
tahun siap liat king emyu angkat trofi superlive supersoccer inirasanyasuper manchesterunited,tahun siap lihat king emyu angkat trofi superlive supersoccer inirasanyasuper manchesterunited
ini tim seminggu ga ada latihan apa gini gini aja maen nya,ini tim seminggu enggak ada latihan apa begini begini saja main nya
tolol goblok tim sampah,tolol goblok tim sampah
lagian kata siapa emyu bakal di uel musim depan jir,lagian kata siapa emyu bakal di uel musim depan jir
wkwk bener bang klub goblok dah itu gadak yg bisa dibanggain,wkwk benar bang klub goblok deh itu gadak yang bisa dibanggain
newcastle akan mengalihkan tergetnya ke antony jika pendekatan mereka untuk elanga gagal manchester united akan menjualnya diangka m eddie howe percaya mereka akan mendapaktan dengan harga yg sesuai gw doain kekabul dah manchesterunited antony,newcastle akan mengalihkan tergetnya ke antony jika pendekatan mereka untuk elanga gagal manchester united akan menjualnya diangka m eddie howe percaya mereka akan mendapaktan dengan harga yang sesuai gue doain kekabul deh manchesterunited antony
belum selesai kira kira minggu depan masih ada pembantaian lagi gak ya,belum selesai kira kira minggu depan masih ada pembantaian lagi enggak ya
rumor transfer terbaru arsenal berminat pada nico williams dari athletic bilbao manchester united berhasil amankan kesepakatan juta untuk gyokeres sumber arsenal manchesterunited emyu gyokeres nicowilliams,rumor transfer terbaru arsenal berminat pada nico williams dari athletic bilbao manchester united berhasil amankan kesepakatan juta untuk gyokeres sumber arsenal manchesterunited emyu gyokeres nicowilliams
buang buang waktu saya saja anda ini,buang buang waktu saya saja anda ini
goblok,goblok
musim kebelakang itu maksudnya cupu kalo secara sejarah atau history emg blm ada yg bisa lewatin,musim kebelakang itu maksudnya cupu kalo secara sejarah atau history memang belum ada yang bisa lewatin
santai santai emyu jg kalah sm brighton,santai santai emyu juga kalah sama brighton
tolol banget,tolol banget
tayik sama mu le,tayik sama mu boleh
iya pemanasan buat kalah,iya pemanasan buat kalah
arsenal akan menggunakan jersey keramat ini minggu nanti untuk menghadapi manchester united di fa cup selamat untuk emyu,arsenal akan menggunakan jersey keramat ini minggu nanti untuk menghadapi manchester united di fa cup selamat untuk emyu
gaji gede pas main bego itulah fasilitas di emyu,gaji gede pas main bego itulah fasilitas di emyu
lebih ke penggemar klub besar secara umum walau emang fans emyu emang lumayan toxic kadang gua sendiri juga merasa agak toxic gua jujur agak males buka sosmed kalo hasil tim lagi jelek lebih ga tahan gua lihat timeline x daripada performa united sendiri,lebih ke penggemar klub besar secara umum walau memang fan emyu memang lumayan toxic kadang gua sendiri juga merasa agak toxic gua jujur agak malas buka sosmed kalo hasil tim lagi jelek lebih enggak tahan gua lihat timeline kali daripada performa united sendiri
babik,babik
emyu sm madrid sedarah sekandungan wkwkw,emyu sama madrid sedarah sekandungan wkwkw
hadehh dua tim calon degradasi,hadehh dua tim calon degradasi
pesan perpisajan hanibal mejbri manchesterunited hanibalmejbri kingemyu,pesan perpisajan hanibal mejbri manchesterunited hanibalmejbri kingemyu
wahai raja tahta kita mau di kudeta oleh si burung merah tetap kami akan kawal meski tahta harus seimbang,wahai raja tahta kita mau di kudeta oleh sih burung merah tetap kami akan kawal meski tahta harus seimbang
tim terkuat di bumi nih lee,tim terkuat di bumi nih lee
baru kemaren liat emyu maen rasanya bangga sekarang malah balik ke setelan pabrik emyu mu manchesterunited,baru kemarin lihat emyu main rasanya bangga sekarang malah balik ke setelan pabrik emyu mu manchesterunited
main di kandang ya apalagi kalo gak kalah,main di kandang ya apalagi kalo enggak kalah
koe nek latihan iku jan e ngopo ae to,koe nek latihan iku jangan e ngopo saja tapi
kalau gitu langsung kasih aja piala nya ke king emyu,kalau begitu langsung kasih saja piala nya ke king emyu
cek simbojoy smartwatch zld layar terang anti air ip olahraga pemantauan tidur dan detak jantung jam tangan pria wanita dengan harga rp dapatkan di shopee sekarang manchester united,cek simbojoy smartwatch zld layar terang anti air ip olahraga pemantauan tidur dan detak jantung jam tangan pria wanita dengan harga rp dapatkan di shopee sekarang manchester united
kl logika ini d pake maka tim baru yg kuat akan selalu kalah pamor,kalo logika ini di pakai maka tim baru yang kuat akan selalu kalah pamor
awas dibawa ke linkedin wkwkwkwk,awas dibawa ke linkedin wkwkwkwk
daftar ke kemenkumham aja lu jadi ormas jangan jadi klub bola terlalu idiet,daftar ke kemenkumham saja lu jadi ormas jangan jadi klub bola terlalu idiet
ngga wkwkw,enggak wkwkw
kalah mulu,kalah mulu
ganti klub malam aja gblk,ganti klub malam saja gblk
jadon sancho sepertinya akan meninggalkan manunited di deadline day bursa transfer juventus dan chelsea masih mengusahakan kesepakatan permanen ataupun peminjaman manchesterunited sancho kingemyu,jadon sancho sepertinya akan meninggalkan manunited di deadline day bursa transfer juventus dan chelsea masih mengusahakan kesepakatan permanen ataupun peminjaman manchesterunited sancho kingemyu
om amorim atur ajalah mau kek mana yg penting ga degradasi aja tim badut ini,om amorim atur ajalah mau kayak mana yang penting enggak degradasi saja tim badut ini
napoli sepertinya akan menaikan pembayaran untuk scott mctominay sebesar m sepertinya waktu tes medis menunjukan kalo mctominay ini zidane regen makanya ditambahin manchesterunited mctominay kingemyu,napoli sepertinya akan menaikan pembayaran untuk scott mctominay sebesar m sepertinya waktu tes medis menunjukan kalo mctominay ini zidane regen makanya ditambahin manchesterunited mctominay kingemyu
kalo maen jam udh pasti menang tapi kalo maen jam an udh pasti kalah,kalo main jam sudah pasti menang tapi kalo main jam an sudah pasti kalah
harihari melihat kebodohan,harihari melihat kebodohan
city sdh treble,city sudah treble
sepi ga ya yg nggoreng klo emyu yg kalah digoreng abis an ini,sepi enggak ya yang nggoreng kalo emyu yang kalah digoreng habis an ini
starting lineup premierleague mw manchester united vs chelsea laga debut nistelrooy sebagai manager interim emyu di epl amp,starting lineup premierleague mau manchester united vs chelsea laga debut nistelrooy sebagai manager interim emyu di epl amp
suarawarga manchester united liverpool emyu berak terlalu banyak kesalahan individu khusunya casemiro padahal menit pertaman mainnya meyakinkan tapi selalu gelagapan kalau udah ketinggalan apalagi kalau ada pemain yg blunder rashford walau melepaskan,suarawarga manchester united liverpool emyu berak terlalu banyak kesalahan individu khusunya casemiro padahal menit pertaman mainnya meyakinkan tapi selalu gelagapan kalau sudah ketinggalan apalagi kalau ada pemain yang blunder rashford walau melepaskan
kasihan tim ini udah ga menyeramkan lagi,kasihan tim ini sudah enggak menyeramkan lagi
utamakan orangtua mu diri mu impian mu dan keinginan mu lalu mu emyu derby nanti malam gees lawan ny tim biasa ajah menang lagi ini mah manchesterunited emyu,utamakan orangtua mu diri mu impian mu dan keinginan mu lalu mu emyu derby nanti malam gees lawan nya tim biasa saja menang lagi ini mah manchesterunited emyu
tim kau selesai wakk,tim kau selesai wakk
g ngroasting g makan kali ini bukan emyu celsi melainkan el gasing,enggak ngroasting enggak makan kali ini bukan emyu celsi melainkan el gasing
sangar tenan lee,sangar tenan lee
puasin dah bulan lagi disamain liverpool dan liverpool punya ucl wkwk,puasin deh bulan lagi disamain liverpool dan liverpool punya ucl wkwk
we ga ndelok wong gegeran kro pans lipertol,we enggak ndelok wong gegeran kro fan lipertol
gua belain nahan ngantuk mai nonton emyu kirain manchester united vs tottenham mulai tepat wib ga taunya masih menit lagi muntot,gua membela menahan ngantuk mai menonton emyu mengira manchester united vs tottenham mulai tepat wib enggak taunya masih menit lagi muntot
fix masalahnya ada di emyu,fix masalahnya ada di emyu
lah emg kenapaa kalo emg punya sejarah bagus ya gapapa di pamerin dong,lah memang kenapa kalo memang punya sejarah bagus ya gapapa di pamerin dong
mau juara kemaren sore jg bakal jadi sejarah,mau juara kemarin sore juga bakal jadi sejarah
gila keluar dari emyu jadi mantep jir,gila keluar dari emyu jadi mantap jir
sampah,sampah
manuel ugarte telah terdaftar di premier league manchesterunited ugarte kingemyu,manuel ugarte telah terdaftar di premier league manchesterunited ugarte kingemyu
sesuai taggar lah ya muncry alias manchester united menangis,sesuai taggar lah ya muncry alias manchester united menangis
selesaisudah ten dan onana,selesaisudah ten dan onana
sabar koh mau diganti sama allegri,sabar koh mau diganti sama allegri
emyu oh emyu manchesterunited manchester manutd mufc manchesterunitedindonesia mufc_family epl eriktenhag,emyu oh emyu manchesterunited manchester manutd mufc manchesterunitedindonesia mufc_family epl eriktenhag
udah gua bilang fans emyu ini belom kena karma aja gua sumpahin emyu diakui sisi raffi ahmad jadi dah lu rans manchester united,sudah gua bilang fan emyu ini belum kena karma saja gua sumpahin emyu diakui sisi raffi ahmad jadi deh lu rans manchester united
saran gue mending bubar dari liga inggris terus masuk liga indonesia karuan lawan persita daripada totenham,saran gue mending bubar dari liga inggris terus masuk liga indonesia karuan lawan persita daripada totenham
masalahnya kayaknya emyu harus degradasi dulu biar para pemimpinnya out terus dibeli arab balik lagi ke epl jadi makin garang,masalahnya kayaknya emyu harus degradasi dulu biar para pemimpinnya out terus dibeli arab balik lagi ke epl jadi makin garang
walah susah banget kalo dah di depan kaya bingung mau ngapain,walah susah banget kalo deh di depan kaya bingung mau mengapai
mending nonton siaran ulang emyu vs palace,mending menonton siaran ulang emyu vs palace
emyu otw besar,emyu otw besar
syukur post hasil akhir,syukur post hasil akhir
ada orang nge fans emyu aja udh aneh,ada orang nge fan emyu saja sudah aneh
goblok,goblok
daftar para pemain legend yg akan ikut serta dalam laga manchester united legends vs celtic legends manchesterunited kingemyu,daftar para pemain legend yang akan ikut serta dalam laga manchester united legends vs celtic legends manchesterunited kingemyu
ahli sejarah,ahli sejarah
zirkzee dilaga vs boznia manchesterunited zirkzee kingemyu,zirkzee dilaga vs boznia manchesterunited zirkzee kingemyu
lg eksperimen kan ya mending maksimalin dorgu dibanding dalot yg dah jelas mutunya,lagi eksperimen kan ya mending maksimalin dorgu dibanding dalot yang deh jelas mutunya
antony debut di sana langsung gacor min,antony debut di sana langsung gacor min
dulu treble sekarang trouble le,dulu treble sekarang trouble boleh
saatnya bahas sejarah le,saatnya bahas sejarah boleh
pelatih berbakat tenhagstay,pelatih berbakat tenhagstay
emyu dimana mana bahkan lintas or,emyu dimana mana bahkan lintas or
saatnya mengeluarkan jurus terakhir emyu manchesterunited,saatnya mengeluarkan jurus terakhir emyu manchesterunited
biasalah rutinitas,biasalah rutinitas
assalamualaikum,assalamualaikum
habis seri di derby jadi goblok gini wkwk,habis seri di derby jadi goblok begini wkwk
nggak tau apakah pelatih inggris yang baru tuchel bakal ngasih kepercayaan ke pemain emyu lagi atau nggak hm superlive supersoccer inirasanyasuper manchesterunited,enggak tau apakah pelatih inggris yang baru tuchel bakal mengasih kepercayaan ke pemain emyu lagi atau enggak hm superlive supersoccer inirasanyasuper manchesterunited
bertabur aroma trebel ni le,bertabur aroma trebel ini boleh
bismillah jadi wali jalur fans emyu bibarkatil manchester united,bismillah jadi wali jalur fan emyu bibarkatil manchester united
ayoo kita belii wkwk,ayo kita belii wkwk
kampung,kampung
nonton emyu ngantok emyu kalah ngantoke ilang cok juwancok ngene ki pie meh turu ancen tim pekok,menonton emyu ngantok emyu kalah ngantoke hilang cok juwancok ngene ki pie meh turu ancen tim pekok
mending kontrak aji santoso ae,mending kontrak aji santoso saja
jujur a aku masih percaya dgn kalimat trust the process walaupun udh tahun,jujur a aku masih percaya dengan kalimat trust the process walaupun sudah tahun
carabao cup manchester united vs barnsley old trafford stadium rabu september ko wib manchesterunited kingemyu,carabao cup manchester united vs barnsley old trafford stadium rabu september kok wib manchesterunited kingemyu
tiada hari tanpa memaki mu,tiada hari tanpa memaki mu
waktunya manchester united amorim ball akan tersaji malam ini lawan everton di kandang pula stop fear spread hope gg mu muneve emyu manchesterunited,waktunya manchester united amorim ball akan tersaji malam ini lawan everton di kandang pula stop fear spread hope enggak mu muneve emyu manchesterunited
andai begini mainnya pas di liga emyu kocak manchesterunited,andai begini mainnya pas di liga emyu kocak manchesterunited
memang suka tantangan fans emyu keknya wazza ngacu ke nick wayne rooney fans emyu model gini ga dikit cm ga semuanya jg cuman biasanya ga nyadar kalo dianya bermasalah n ga nyadar dia sumber masalah krn org ga mau ribet n mendi,memang suka tantangan fan emyu kayaknya wazza ngacu ke nick wayne rooney fan emyu model begini enggak dikit cuma enggak semuanya juga cuman biasanya enggak menyadar kalo dianya bermasalah n enggak menyadar dia sumber masalah karena orang enggak mau ribet n mendi
serunya liga inggris tuh gini lho gatau kek ada aja momen beginian tapi gk kebayang klo emyu ada di posisi kek gini auto makan kenyang media rek,serunya liga inggris tuh begini lho enggak tau kayak ada saja momen beginian tapi enggak terbayang kalo emyu ada di posisi kayak begini auto makan kenyang media rek
bursa transfer masih ada udah obral diskon pemain sisa musim pake yg msh guna akademi,bursa transfer masih ada sudah obral diskon pemain sisa musim pakai yang masih guna akademi
tidak ada team sesampah emyu sekian dan terima kasih manutd manchesterunited,tidak ada team sesampah emyu sekian dan terima kasih manutd manchesterunited
pertahanin erik ten hug dy pelatih mu terbaik sepanjang masa dy bakal bawa mu jadi juara amp,pertahanin erik ten hug dia pelatih mu terbaik sepanjang masa dia bakal bawa mu jadi juara amp
zirkzee gol dan assist di timnas belanda melawan finlandia manchesterunited zirkzee kingemyu,zirkzee gol dan assist di timnas belanda melawan finlandia manchesterunited zirkzee kingemyu
ieu kunaon marah marah cees umak,ieu kunaon marah marah cees umak
fakta mees helgers mu adalah tim segurem ini anda punggawa timnas jgn berpuas diri amp,fakta mees helgers mu adalah tim segurem ini anda punggawa timnas jangan berpuas diri amp
kalau tidak ada manchester united emyu mau jadi apa sepakbola,kalau tidak ada manchester united emyu mau jadi apa sepakbola
otw turu,otw turu
emg iya min,memang iya min
lebih baik dilanjutkan untuk menghibur fans yg lain,lebih baik dilanjutkan untuk menghibur fan yang lain
selesai tuh tim anjing,selesai tuh tim anjing
kasian emyu,kasihan emyu
ada yang tapi bukan emyu muehehe easy arsenal liverpool arsliv manchesterunited,ada yang tapi bukan emyu muehehe easy arsenal liverpool arsliv manchesterunited
mu medioker umum,mu medioker umum
oalah pendukung emyu goblok ternyata minimal bales komenan jgn sama semua ah mode nya,oalah pendukung emyu goblok ternyata minimal balas komentar jangan sama semua ah mode nya
gelandang dengan atribut paling lengkap long pass bisa carry the ball bisa shooting gaperlu diragukan benerbener pengatur tempo pada saat itu sayang banget emyu sekarang gapunya gelandang kayak gini lagi,gelandang dengan atribut paling lengkap long pass bisa carry the ball bisa shooting gaperlu diragukan benerbener pengatur tempo pada saat itu sayang banget emyu sekarang enggak punya gelandang kayak begini lagi
