before_normalisasi,after_normalisasi
fa dan european league reality,fa dan european league reality
amrabat aja udah x main di fiorentina,amrabat saja sudah kali main di fiorentina
kocak,kocak
teruskan bang jangan nonton sampe mu juara,teruskan bang jangan menonton sampai mu juara
altay bayindir mode gacor laga yg luar biasa mau dzolimi emyu noh di bayar kontan dgn kemenangan,altay bayindir mode gacor laga yang luar biasa mau dzolimi emyu noh di bayar kontan dengan kemenangan
banyak hal yang bisa diperbaiki tapi ada peningkatan signifikan di penguasaan bola semoga pertahanan lebih solid,banyak hal yang bisa diperbaiki tapi ada peningkatan signifikan di penguasaan bola semoga pertahanan lebih solid
keliatan miskin taktik nya si botak ini dilihat dari transfernya eks ajax kek udah mentok bgt anjir otaknya sampe ga mau coba pemain baru,kelihatan miskin taktik nya sih botak ini dilihat dari transfernya eks ajax kayak sudah mentok banget anjir otaknya sampai enggak mau coba pemain baru
sama palmer juta fix hayu,sama palmer juta fix hayu
tim lebih solid tapi masih kurang kreativitas di lini tengah,tim lebih solid tapi masih kurang kreativitas di lini tengah
prattama bukan opsi tapi wajib,prattama bukan opsi tapi wajib
bruno fernandes tetap menjadi pengatur permainan meskipun ada beberapa kali dia kehilangan bola dalam situasi krusial,bruno fernandes tetap menjadi pengatur permainan meskipun ada beberapa kali dia kehilangan bola dalam situasi krusial
jadwal main kapan jam berapa,jadwal main kapan jam berapa
cuma bisa siap si paling siap si paling pake otak makanya kalo komen anjing,cuma bisa siap sih paling siap sih paling pakai otak makanya kalo komen anjing
duh,duh
jadwal main kapan jam berapa,jadwal main kapan jam berapa
teruk gila finishing mu semalam sepatutnya boleh gol lebih dari tapi attacker dan finishing mu teruk gila,teruk gila finishing mu semalam sepatutnya boleh gol lebih dari tapi attacker dan finishing mu teruk gila
mu bermain luar biasa kemenangan di laga kedua amorim tapi saya masih merasa defense perlu diperbaiki,mu bermain luar biasa kemenangan di laga kedua amorim tapi saya masih merasa defense perlu diperbaiki
mu menang tapi kalau kita nggak rapat di belakang bisa bahaya di pertandingan berikutnya,mu menang tapi kalau kita enggak rapat di belakang bisa bahaya di pertandingan berikutnya
lahh hoax,lah hoax
tim bobrookk tim bobrokk,tim bobrookk tim bobrokk
satu lagi emang manajemen minta de gea sama greenwood balik lagi kocak,satu lagi memang manajemen meminta deh gea sama greenwood balik lagi kocak
konstribusi gw nonton live stream bayar di vidiocom,konstribusi gue menonton live stream bayar di vidiocom
alhamdulillah menang hoki,alhamdulillah menang hoki
mu harus meningkatkan permainan passing di lini tengah banyak yang harus diperbaiki,mu harus meningkatkan permainan passing di lini tengah banyak yang harus diperbaiki
setuju,setuju
klo ga drama ya kalah,kalo enggak drama ya kalah
konstribusi gw nonton live stream bayar di vidiocom,konstribusi gue menonton live stream bayar di vidiocom
main aja jarang tapi kaga fit aneh,main saja jarang tapi kagak fit aneh
terus coba sebutin siapa yg cocok gantiin,terus coba sebutin siapa yang cocok gantiin
suka banget sama kerja sama timnya makin kompak tiap pertandingan,suka banget sama kerja sama timnya makin kompak tiap pertandingan
taktik counter press amorim lebih efektif dari ten hag,taktik counter press amorim lebih efektif dari ten hag
emyu legend main jam berapa min,emyu legend main jam berapa min
nah berarti game plan nya jalan kan,nah berarti game plan nya jalan kan
tomini emang oke sih cuman skill dia cool down nya lama banget match oke match kedepan bapuk gitu terus siklus nya,tomini memang oke sih cuman skill dia cool down nya lama banget match oke match kedepan bapuk begitu terus siklus nya
jadwal main kapan jam berapa,jadwal main kapan jam berapa
maguire kelas,maguire kelas
main dah satu squad,main deh satu squad
dan itulah faktanya,dan itulah faktanya
kalau jaman saf ini pasti dicadangin dulu kayak de gea duku juga diparkir dulu ama saf diganti ama lindegaard,kalau jaman saf ini pasti dicadangin dulu kayak deh gea duku juga diparkir dulu sama saf diganti sama lindegaard
jadwal main kapan jam berapa,jadwal main kapan jam berapa
mentalitas tim ini harus ditingkatkan jangan sampai kalah lagi,mentalitas tim ini harus ditingkatkan jangan sampai kalah lagi
kapan lagi dapet pemain tapi kalo ke juve oke lah barter sama chiesa mah,kapan lagi dapat pemain tapi kalo ke juve oke lah barter sama chiesa mah
nahh forest sering loh maen bek match terakhir menang juga pake formasi itu,nah forest sering loh main bek match terakhir menang juga pakai formasi itu
tuker palmer kalo mau,tuker palmer kalo mau
mainoo beban sih,mainoo beban sih
saya melihat perbaikan yang jelas di bawah ruben amorim tetapi kami harus lebih tajam di depan gawang hasil imbang menunjukkan bahwa masih banyak yang perlu diperbaiki,saya melihat perbaikan yang jelas di bawah ruben amorim tetapi kami harus lebih tajam di depan gawang hasil imbang menunjukkan bahwa masih banyak yang perlu diperbaiki
ruben amorim bawa angin segar buat mu pemainpemain muda makin berkembang apalagi garnacho yang makin jago,ruben amorim bawa angin segar buat mu pemainpemain muda makin berkembang apalagi garnacho yang makin jago
bruno pertahankan standart kita,bruno pertahankan standart kita
apaan krosing cuma kesamping gk ke arah kotak pinalti,apaan krosing cuma kesamping enggak ke arah kotak pinalti
fix jgn nonton live emyu,fix jangan menonton live emyu
cuman onana doang yang ngelawak,cuman onana doang yang ngelawak
amad mending diganti dulu dehh,amad mending diganti dulu deh
saya melihat banyak peningkatan dalam permainan tim meskipun hasilnya imbang saya optimis dengan filosofi yang dibawa oleh ruben amorim,saya melihat banyak peningkatan dalam permainan tim meskipun hasilnya imbang saya optimis dengan filosofi yang dibawa oleh ruben amorim
mending ole tapi diteriakin out,mending ole tapi diteriakin out
miracle in emirates stadium,miracle ini emirates stadium
comment text,comment text
yg mau streaming dm aja yak,yang mau streaming dm saja ya
amorim master class babak kedua,amorim master class babak kedua
tim ini butuh striker yang lebih tajam ayo belanja pemain baru,tim ini butuh striker yang lebih tajam ayo belanja pemain baru
standup comedy,standup comedy
wajar ngab orang gak pernah dikasih menit bermain yang layak beda dengan onani starter terus plangaplongo iyaa logikanya gini ente sering main ps bola lawan orang yang jarang maen ps bola bakal menang mana,wajar ngab orang enggak pernah dikasih menit bermain yang layak beda dengan onani starter terus plangaplongo iya logikanya begini ente sering main pas bola lawan orang yang jarang main pas bola bakal menang mana
posisi juga unbeaten kan bang,posisi juga unbeaten kan bang
sama gan sumpah males,sama gan sumpah malas
mu menang di laga ketiga amorim tapi lini belakang masih harus lebih solid kita harusnya bisa menang lebih besar,mu menang di laga ketiga amorim tapi lini belakang masih harus lebih solid kita harusnya bisa menang lebih besar
betul bang apalagi tekanan di emyu sangat tinggi takut nya ga berkembang malah down,betul bang apalagi tekanan di emyu sangat tinggi takut nya enggak berkembang malah down
defensifnya lumayan kuat tapi perlu variasi serangan biar nggak gampang ditebak,defensifnya lumayan kuat tapi perlu variasi serangan biar enggak gampang ditebak
tai tai taii,tahi tahi taii
jadwal main kapan jam berapa,jadwal main kapan jam berapa
bermain cukup rapi tapi kadang defensifnya ga konsisten tim butuh lebih banyak waktu untuk berkembang,bermain cukup rapi tapi kadang defensifnya enggak konsisten tim butuh lebih banyak waktu untuk berkembang
ten hag sering kesulitan dalam merotasi pemain amorim lebih fleksibel,ten hag sering kesulitan dalam merotasi pemain amorim lebih fleksibel
garnacho makin berkembang tapi masih perlu lebih sering dikasih kesempatan,garnacho makin berkembang tapi masih perlu lebih sering dikasih kesempatan
utk visi masih bagus pogba casemirocmn doi ini maine spartan cepat cover area cepet mutus serangan lawan masih bisa meningkat lg,untuk visi masih bagus pogba casemirocmn doi ini maine spartan cepat cover area cepat mutus serangan lawan masih bisa meningkat lagi
stop mainin rashford sm casemiro sebagai starter kasih amad sm ugarte yg main inti,stop mainin rashford sama casemiro sebagai starter kasih amad sama ugarte yang main inti
amad dapet menit main lebih banyak dribblingnya ngeri akhirnya talenta muda mu beneran dikasih kesempatan,amad dapat menit main lebih banyak dribblingnya ngeri akhirnya talenta muda mu benaran dikasih kesempatan
setuju sekali posisi garna emg posisi raspot raspot udah kacau bgt ga ada keberanian duel menusuk ketika pegang bola ada lawan malah back pass,setuju sekali posisi garna memang posisi raspot raspot sudah kacau banget enggak ada keberanian duel menusuk ketika pegang bola ada lawan malah back pass
apalagi yg di shoot kenceng banget dari samping ketepis sama bayindir anjas gilaa tuh bocahh,apalagi yang di shoot kencang banget dari samping ketepis sama bayindir anjas gila tuh bocahh
rashy emang udah malesan sekarang g kalo main,rashy memang sudah malesan sekarang enggak kalo main
kok case ga pernah di pake lagi ya,kok case enggak pernah di pakai lagi ya
kekalahan memalukan kita terlalu mudah kebobolan dan serangan kita nggak efektif sama sekali amorim harus bekerja keras,kekalahan memalukan kita terlalu mudah kebobolan dan serangan kita enggak efektif sama sekali amorim harus bekerja keras
liat di juve lumayan oke speed nya bisa lewatim lawan mount ngatur serangan nya kurang opsi gantiin bruno lebih bagus dari tominay gaji nego aja lama juga turun rumor terbaru juga dia mau ke emyu,lihat di juve lumayan oke speed nya bisa lewatim lawan mount mengatur serangan nya kurang opsi gantiin bruno lebih bagus dari tominay gaji nego saja lama juga turun rumor terbaru juga dia mau ke emyu
permainan lebih enak ditonton tapi lini belakang masih sering bikin khawatir perlu ada perbaikan cepat,permainan lebih enak ditonton tapi lini belakang masih sering bikin khawatir perlu ada perbaikan cepat
konstribusi gw nonton live stream bayar di vidiocom,konstribusi gue menonton live stream bayar di vidiocom
kekalahan memalukan kita terlalu mudah kebobolan dan serangan kita nggak efektif sama sekali amorim harus bekerja keras,kekalahan memalukan kita terlalu mudah kebobolan dan serangan kita enggak efektif sama sekali amorim harus bekerja keras
tp kata pemujanya itu tidak bs dilakukan arteta di arsenal tp secara kolektif dan permainan arsenal jauh lebih bagus,tapi kata pemujanya itu tidak bisa dilakukan arteta di arsenal tapi secara kolektif dan permainan arsenal jauh lebih bagus
hah nonton mu wkwk ga akan lagi nonton mu buat selamanya ngapain nonton badut di jam pagi konyol,hah menonton mu wkwk enggak akan lagi menonton mu buat selamanya mengapai menonton badut di jam pagi konyol
dukungan saya untuk mu tidak akan pernah luntur selalu memberikan yang terbaik,dukungan saya untuk mu tidak akan pernah luntur selalu memberikan yang terbaik
amorim perlu perbaiki pertahanan setpiece masih sering kebobolan dari situasi bola mati,amorim perlu perbaiki pertahanan setpiece masih sering kebobolan dari situasi bola mati
jadi inget dulu dia waktu pertama kali debut cocok nya jadi supersub coba aja dia jadiin supersub main nya pas babak ke,jadi ingat dulu dia waktu pertama kali debut cocok nya jadi supersub coba saja dia jadikan supersub main nya pas babak ke
ten hag punya ide bagus tapi eksekusi buruk amorim lebih realistis dengan kondisi tim,ten hag punya ide bagus tapi eksekusi buruk amorim lebih realistis dengan kondisi tim
ruben amorim memperbaiki permainan tim namun kami masih harus lebih tajam di depan gawang greenwood dan rashford harus lebih banyak mencetak gol,ruben amorim memperbaiki permainan tim namun kami masih harus lebih tajam di depan gawang greenwood dan rashford harus lebih banyak mencetak gol
amorim kasih kita lebih solid di depan tapi defense kita masih bisa lebih rapat kemenangan tapi jangan lengah,amorim kasih kita lebih solid di depan tapi defense kita masih bisa lebih rapat kemenangan tapi jangan lengah
kekalahan sangat mengecewakan kita perlu lebih solid di lini belakang dan perbaiki koordinasi tim,kekalahan sangat mengecewakan kita perlu lebih solid di lini belakang dan perbaiki koordinasi tim
lini pertahanan terlihat lebih solid di bawah ruben amorim namun lini serang perlu lebih tajam untuk meraih kemenangan di pertandingan berikutnya,lini pertahanan terlihat lebih solid di bawah ruben amorim namun lini serang perlu lebih tajam untuk meraih kemenangan di pertandingan berikutnya
maksud dia pemain brighton udah berada dibelakang bola semua,maksud dia pemain brighton sudah berada dibelakang bola semua
wkwk setidaknya tidak sebapuk ini bila perlu sampai ethes presiden,wkwk setidaknya tidak sebapuk ini bila perlu sampai ethes presiden
dia niatnya mau ngindar bola mau berdiri itu dia juga asalnya mau ngambil bola dari bruno tapi ga nyampe alhasil gitu bang uncluky banget,dia niatnya mau ngindar bola mau berdiri itu dia juga asalnya mau ngambil bola dari bruno tapi enggak sampai alhasil begitu bang uncluky banget
kapan main lagi dan jam berapa,kapan main lagi dan jam berapa
ya kalau gua sih kurang seharusnya sih,ya kalau gua sih kurang seharusnya sih
jadwal main kapan jam berapa,jadwal main kapan jam berapa
kalau nonton mu harus babak kedua babak pertama ngantuk terus,kalau menonton mu harus babak kedua babak pertama ngantuk terus
kapan mainnya bang,kapan mainnya bang
berdoa mulai,berdoa mulai
saya percaya ruben amorim akan bisa membawa mu kembali ke jalur kemenangan meskipun kami hanya bermain imbang di pertandingan pertama,saya percaya ruben amorim akan bisa membawa mu kembali ke jalur kemenangan meskipun kami hanya bermain imbang di pertandingan pertama
main dah satu squad,main deh satu squad
amorim bawa perubahan positif tim lebih berani menyerang,amorim bawa perubahan positif tim lebih berani menyerang
kalau aja jojo ga maksain pasti goal itu,kalau saja jojo enggak maksain pasti goal itu
tidak seperti emyu yang ku kenal saat jual pemain,tidak seperti emyu yang ku kenal saat jual pemain
gabisa main lwan emyu cuma selama semusim saat loan aja atau gimana min,enggak bisa main lwan emyu cuma selama semusim saat loan saja atau bagaimana min
haha sama bang gua aja heran sama si ten hag,haha sama bang gua saja heran sama sih ten hag
mungkin eth kaga mandang fase build up lagi bang udah mau fokus nyerang aja tau tau malah ke gol in,mungkin eth kagak mandang fase build up lagi bang sudah mau fokus menyerang saja tau tau malah ke gol ini
bruno fernandes tetap menjadi pengatur permainan meskipun ada beberapa kali dia kehilangan bola dalam situasi krusial,bruno fernandes tetap menjadi pengatur permainan meskipun ada beberapa kali dia kehilangan bola dalam situasi krusial
laga kedua memperlihatkan perbaikan dalam pertahanan namun rashford harus lebih sering menembak untuk mendapatkan gol,laga kedua memperlihatkan perbaikan dalam pertahanan namun rashford harus lebih sering menembak untuk mendapatkan gol
positif kalah si,positif kalah sih
belum terlihat perubahan signifikan tapi setidaknya ada perbaikan kecil dalam pola permainan,belum terlihat perubahan signifikan tapi setidaknya ada perbaikan kecil dalam pola permainan
banyak pelanggaran aneh tapi terlepas dari itu mainnya jelek rashford mentok garnacho juga ikut ikutan zirkzee oke bruno kalo udah frustasi ya gitu case sih parah semoga ugarte bisa gantiin role nya onana udah dah bapuk buildup sih lumayan tapi kurang efektif,banyak pelanggaran aneh tapi terlepas dari itu mainnya jelek rashford mentok garnacho juga ikut ikutan zirkzee oke bruno kalo sudah frustasi ya begitu case sih parah semoga ugarte bisa gantiin role nya onana sudah deh bapuk buildup sih lumayan tapi kurang efektif
garnaco gawang udah kosong ngapain ga langsung di masukan babi,garnaco gawang sudah kosong mengapai enggak langsung di masukan babi
kekalahan memalukan kita terlalu mudah kebobolan dan serangan kita nggak efektif sama sekali amorim harus bekerja keras,kekalahan memalukan kita terlalu mudah kebobolan dan serangan kita enggak efektif sama sekali amorim harus bekerja keras
senggol dikit pelanggan,senggol dikit pelanggan
rashford diistirahatkan dulu ganti garna rw biar diisi amad kemaren kita kurang dari sisi pressing ngejar bola rasford bikin sisi kanan lawan leluasa karena dia sering telat turun karena mager sepertinya duta mager diteruskan ke rashford,rashford diistirahatkan dulu ganti garna rw biar diisi amad kemarin kita kurang dari sisi pressing ngejar bola rasford bikin sisi kanan lawan leluasa karena dia sering telat turun karena mager sepertinya duta mager diteruskan ke rashford
yoi bng mungkin untuk casemiro bakal dicoba klo ugarte udh masuk squad,yoi bang mungkin untuk casemiro bakal dicoba kalo ugarte sudah masuk squad
dialo n maino knp,dialo n maino kenapa
sebenernya offside kayanya si itu cuma kalopun di anulir dan perpanjangan waktu gua tetep pede kalo mu bakal menang si karna keliatan menit menit akhir udah pada panas pemainnya,sebenarnya offside kayanya sih itu cuma kalopun di anulir dan perpanjangan waktu gua tetap percaya diri kalo mu bakal menang sih karena kelihatan menit menit akhir sudah pada panas pemainnya
nonton ane bang,menonton ane bang
setuju betul,setuju betul
pengenya gitu bang tapi susah,pengenya begitu bang tapi susah
ten hag kaya bocah main ps pokoknya ada pemain baru label bintang masukin,ten hag kaya bocah main pas pokoknya ada pemain baru label bintang masukin
ten hag memberi tim banyak kejelasan dalam taktik permainan namun mereka masih sulit mengatasi tekanan di pertandingan besar,ten hag memberi tim banyak kejelasan dalam taktik permainan namun mereka masih sulit mengatasi tekanan di pertandingan besar
pertandingan menang berturut semoga berlanjut,pertandingan menang berturut semoga berlanjut
amorim mulai nunjukin progres tapi pertahanan kita masih lemah banget menang tapi masih banyak pr,amorim mulai nunjukin progres tapi pertahanan kita masih lemah banget menang tapi masih banyak pr
kalah mulu,kalah mulu
jadwal main kapan jam berapa,jadwal main kapan jam berapa
tanda tanda terpongkeng,tanda tanda terpongkeng
apa sih yang dicari heran ruben ruben sarwendah nungguin drmh,apa sih yang dicari heran ruben ruben sarwendah menunggu drmh
palmer juga boleh lho wkwk,palmer juga boleh lho wkwk
mainoo beban sih,mainoo beban sih
bermain cukup rapi tapi kadang defensifnya ga konsisten tim butuh lebih banyak waktu untuk berkembang,bermain cukup rapi tapi kadang defensifnya enggak konsisten tim butuh lebih banyak waktu untuk berkembang
terus coba sebutin siapa yg cocok gantiin,terus coba sebutin siapa yang cocok gantiin
garnacho dan bruno makin bersinar tapi kalau pertahanan nggak lebih rapat kita bisa kesulitan di lagalaga berikutnya,garnacho dan bruno makin bersinar tapi kalau pertahanan enggak lebih rapat kita bisa kesulitan di lagalaga berikutnya
pertandingan kemarin lumayan seru tapi sayang hasilnya kurang memuaskan,pertandingan kemarin lumayan seru tapi sayang hasilnya kurang memuaskan
yang bilang ten hag bagus pasti matanya katarak amorim bawa mu ke level baru,yang bilang ten hag bagus pasti matanya katarak amorim bawa mu ke level baru
untuk saat ini belum ada,untuk saat ini belum ada
kekalahan nggak bisa diterima pertahanan kita bocor di banyak kesempatan harus segera diperbaiki,kekalahan enggak bisa diterima pertahanan kita bocor di banyak kesempatan harus segera diperbaiki
rotasi squad lebih masuk akal tidak ada pemain yang terlalu dipaksakan main,rotasi squad lebih masuk akal tidak ada pemain yang terlalu dipaksakan main
umpan lu case dah itu aja sama lari jangan lemot,umpan lu case deh itu saja sama lari jangan lemot
saham,saham
pemain bgs disiain pelatih katrok,pemain bagus disiain pelatih katrok
mending chiesa lebih gg drpd sterling apalagi minyak sanco,mending chiesa lebih enggak daripada sterling apalagi minyak sanco
casemiro tomini cok ndang cepat jual aja tuh,casemiro tomini cok ndang cepat jual saja tuh
untung gada var wkk,untung enggak ada var wkk
zirkzee mulai mencair,zirkzee mulai mencair
chilwell boleh tuh apalagi shaw encok mulu,chilwell boleh tuh apalagi shaw encok mulu
iyaa tapi itu butuh waktu sampe elu di pecat,iya tapi itu butuh waktu sampai lu di pecat
saya sangat senang melihat perkembangan dari rashford meskipun hasil imbang ruben amorim berhasil membawa perubahan yang positif di tim,saya sangat senang melihat perkembangan dari rashford meskipun hasil imbang ruben amorim berhasil membawa perubahan yang positif di tim
hah garnacho di game kemarin malah ga keliatan pakrashford mending masih mau ngumpan ke zirkzee dont judge pemain kita terus terusan semua ada waktu nyagarnacho mainoo dan amad masih terlalu muda untuk di andalkanmental sama pengalamannya mas,hah garnacho di game kemarin malah enggak kelihatan pakrashford mending masih mau ngumpan ke zirkzee dont judge pemain kita terus terusan semua ada waktu nyagarnacho mainoo dan amad masih terlalu muda untuk di andalkanmental sama pengalamannya mas
kenapa bukan onana yg cidera,kenapa bukan onana yang cidera
patung mendekati bola,patung mendekati bola
stay semusim lagi,stay semusim lagi
ruben amorim membawa permainan yang lebih terorganisir namun hasil imbang ini menunjukkan bahwa masih banyak perbaikan yang harus dilakukan,ruben amorim membawa permainan yang lebih terorganisir namun hasil imbang ini menunjukkan bahwa masih banyak perbaikan yang harus dilakukan
masih bisa alasan belum ada bek kiri yang fit dalot bapuk,masih bisa alasan belum ada bek kiri yang fit dalot bapuk
intinya lebih ke ngapain masih mainin si dalot,intinya lebih ke mengapai masih mainin sih dalot
kiper gantibek juga,kiper gantibek juga
ga usah muluk muluk lah yg penting punya ciri bermain atau taktiknya di matengin lagi jangan pas kebobolan langsung kaya orang bingung,enggak usah muluk muluk lah yang penting punya ciri bermain atau taktiknya di matengin lagi jangan pas kebobolan langsung kaya orang bingung
belom tentu tergantung si ten hag,belum tentu tergantung sih ten hag
pasrah lah dengan hasil malam ini,pasrah lah dengan hasil malam ini
nah yg heran tuh begitu padahal brighton prlatih baru tapi permainan enak,nah yang heran tuh begitu padahal brighton prlatih baru tapi permainan enak
tuker palmer kalo mau,tuker palmer kalo mau
setuju min ten hag hrs berani cadangon rashford stop menganak emaskan pemain yg perform nya jelek,setuju min ten hag harus berani cadangon rashford stop menganak emaskan pemain yang perform nya jelek
b benerr wkwk,b benar wkwk
kalo fans asli sono mah yg di desak bukan pelatih tapi glazers family,kalo fan asli sono mah yang di desak bukan pelatih tapi glazers family
buang bruno,buang bruno
bersama tenhag akan tertawa terbahak bahak,bersama tenhag akan tertawa terbahak bahak
wkwkwkwkwk dan itu sangat benar,wkwkwkwkwk dan itu sangat benar
gw yang coba sabar sama progres eth juga lama kesel anjay out aja lah kalo sampe akhir musim gini doang mah,gue yang coba sabar sama progres eth juga lama kesel anjay out saja lah kalo sampai akhir musim begini doang mah
ada aja masalah nya ya,ada saja masalah nya ya
ten hag menunjukkan kemajuan dalam struktur permainan tetapi ada kelemahan jelas di lini serang yang harus diperbaiki,ten hag menunjukkan kemajuan dalam struktur permainan tetapi ada kelemahan jelas di lini serang yang harus diperbaiki
bisa banget bestie,bisa banget bestie
hahaha,hahaha
kalah lawan besiktas,kalah lawan besiktas
keren semoga bisa terus berjuang di pertandingan selanjutnya,keren semoga bisa terus berjuang di pertandingan selanjutnya
jangan liat pemain lain liat arah bola yang nerimamaguire lari dari belakang bek lawan,jangan lihat pemain lain lihat arah bola yang nerimamaguire lari dari belakang bek lawan
brighton terlalu kuat untuk emyusemoga gak degradasi aja,brighton terlalu kuat untuk emyusemoga enggak degradasi saja
bruno pertahankan standart kita,bruno pertahankan standart kita
ruben amorim sudah mulai memperkenalkan permainan yang lebih menyerang meskipun hanya imbang saya rasa tim ini akan berkembang lebih baik,ruben amorim sudah mulai memperkenalkan permainan yang lebih menyerang meskipun hanya imbang saya rasa tim ini akan berkembang lebih baik
dorgu tu type pemain versatile sama kayak marcos llorente rodrigo de paul di atm bisa main di beberapa posisi kalo lu main efootball pasti tau,dorgu itu type pemain versatile sama kayak marcos llorente rodrigo deh paul di atm bisa main di beberapa posisi kalo lu main efootball pasti tau
mending tukang kebun old trafford jadi pelatih daripada amorim sungguh memalukan,mending tukang kebun old trafford jadi pelatih daripada amorim sungguh memalukan
berharap onana cedera panjang,berharap onana cedera panjang
ya pak onana menang balon dor,ya pak onana menang balon dor
kalo kerja karuan gausa di tonton bang energinya dikuras pas nntn mu,kalo kerja karuan gausa di tonton bang energinya dikuras pas menonton mu
kiper kita lebih cocok jadi badut gampang banget kebobolan,kiper kita lebih cocok jadi badut gampang banget kebobolan
betul bre yg penting menang aja udah alhamdulillah,betul bre yang penting menang saja sudah alhamdulillah
di lapangan aja gak gerak apa ya pasti tetap fitlah onanananananaa,di lapangan saja enggak gerak apa ya pasti tetap fitlah onanananananaa
lini kita udah oke tapi kita masih banyak celah di belakang tapi defense harus diperbaiki,lini kita sudah oke tapi kita masih banyak celah di belakang tapi defense harus diperbaiki
livereuse lumayan lama setengah musim aja ga ada toh pemain yg skrg peninggalan ten haag semua ga bisa berharap banyak,livereuse lumayan lama setengah musim saja enggak ada toh pemain yang sekarang peninggalan ten haag semua enggak bisa berharap banyak
yg penting bisa ngelawak,yang penting bisa ngelawak
