before_normalisasi,after_normalisasi
jadwal main kapan jam berapa,jadwal main kapan jam berapa
yang bikin harga pemain yg mau di beli mu mahal apa ya contoh kata nya yoro talenta berbakat gaya main seperti varane tapi melihat dia bermain tidak seperti harga nya yg fantastis di usia nya yg segitu dan masih minim prestasi juga pengalaman,yang bikin harga pemain yang mau di beli mu mahal apa ya contoh kata nya yoro talenta berbakat gaya main seperti varane tapi melihat dia bermain tidak seperti harga nya yang fantastis di usia nya yang segitu dan masih minim prestasi juga pengalaman
loan,loan
pertanyaan apa ini ekwkwk dipikirnya sekelas city ga pernah kalah sama tim lain wkwkwk dipikirnya sepakbola itu matematika this is premier league bro fans bola baru ya,pertanyaan apa ini ekwkwk dipikirnya sekelas city enggak pernah kalah sama tim lain wkwkwk dipikirnya sepakbola itu matematika this is premier league bro fan bola baru ya
bapuknya mulai keliatan aslinya biasa banget ni pemain di munchen aja dibuang,bapuknya mulai kelihatan aslinya biasa banget ini pemain di munchen saja dibuang
kebiasaan pelatih ini gitu cuma main aman berharap hoki musim ke melatih main gak aktraktif ada striker pasang bruno pelatih lfc aja baru datang mainnya lebih aktraktif dan efektif,kebiasaan pelatih ini begitu cuma main aman berharap hoki musim ke melatih main enggak aktraktif ada striker pasang bruno pelatih lfc saja baru datang mainnya lebih aktraktif dan efektif
wkwk lawak arsenal,wkwk lawak arsenal
formasi amorim ini gila serangan tajam pertahanan kokoh,formasi amorim ini gila serangan tajam pertahanan kokoh
salfok ada bendera thailand,salah fokus ada bendera thailand
ten hag jauh lebih bagus amorim belum membuktikan apaapa,ten hag jauh lebih bagus amorim belum membuktikan apaapa
fa dan european league reality,fa dan european league reality
lah emang kenapa sancho dan antony itu beli kalau dijual paling juga an wkwk,lah memang kenapa sancho dan antony itu beli kalau dijual paling juga an wkwk
bagus ga bang dorgu mainnya,bagus enggak bang dorgu mainnya
harus beli tipikal pemain no dan bisa free role plus penyerang pengalaman,harus beli tipikal pemain no dan bisa free role plus penyerang pengalaman
karo iwak kali,karo iwak kali
pemainpemain senior perlu memberi contoh kepada pemain muda di dalam tim,pemainpemain senior perlu memberi contoh kepada pemain muda di dalam tim
benci banget sama permainan era amorim ini kayak nonton tim sunday league,benci banget sama permainan era amorim ini kayak menonton tim sunday league
tehag botag apa gua kata lu ga ngarep apa pasang pemain bgitu tanpa penyerang bruno smpe ke garis pertahanan ambil bola lah di dpn kosong punya sayap ga smngt lu beli pemain gamainin kocak,tehag botag apa gua kata lu enggak mengharap apa pasang pemain begitu tanpa penyerang bruno sampai ke garis pertahanan ambil bola lah di depan kosong punya sayap enggak smngt lu beli pemain gamainin kocak
untung untuk sancho nya lah,untung untuk sancho nya lah
banyak pemain mu yang performanya naik turun harusnya lebih konsisten,banyak pemain mu yang performanya naik turun harusnya lebih konsisten
ya kudu sabar pengen nya langsung cetak gol menang dan besuk selanjut nya gitu lagi tp lawan nya ga tidur butuh adaptasi dan strategi,ya kudu sabar pengin nya langsung cetak gol menang dan besuk selanjut nya begitu lagi tapi lawan nya enggak tidur butuh adaptasi dan strategi
rashford out aja mumpung psg mau bayar mahal,rashford out saja mumpung psg mau bayar mahal
case mending main buat di kebo cup sama fa cup ugarte buat liga sama europa league,case mending main buat di kebo cup sama fa cup ugarte buat liga sama europa league
pemain muda harus lebih diberi kesempatan mereka punya potensi,pemain muda harus lebih diberi kesempatan mereka punya potensi
harusnya yg diganti eth sih coba rvn jadi coach nya asistennya rvp eth bagian cuci jersey capek juga nunggu eth bangun tim,harusnya yang diganti eth sih coba rvn jadi coach nya asistennya rvp eth bagian cuci jersey capek juga nunggu eth bangun tim
kalo ada var pasti offside,kalo ada var pasti offside
gak layak finishing havertz hancur parah,enggak layak finishing havertz hancur parah
kekalahan di laga ketiga pertahanan kita benarbenar buruk amorim harus segera menemukan solusi,kekalahan di laga ketiga pertahanan kita benarbenar buruk amorim harus segera menemukan solusi
beberapa pemain masih kesulitan memahami filosofi permainan amorim,beberapa pemain masih kesulitan memahami filosofi permainan amorim
bingung liat pemain salah passing terus jadi gapernah berhasil buat build up serangan,bingung lihat pemain salah passing terus jadi enggak pernah berhasil buat build up serangan
isnan kan siapa tau balik jadi penyerang bisa sat set sat set lagi,isnan kan siapa tau balik jadi penyerang bisa sat set sat set lagi
onana tetap akan main klau gak main manchester united rugi itu lah hasil bisnis kesepakatan para mafia di manchester united masih kotor mikirin bisnis dari pada juara,onana tetap akan main kalau enggak main manchester united rugi itu lah hasil bisnis kesepakatan para mafia di manchester united masih kotor memikirkan bisnis dari pada juara
bnyak komen org glory hunter ajg alias karduss fans layar kaca doang kek macam datg nnton langsung di ot,banyak komen orang glory hunter ajg alias karduss fan layar kaca doang kayak macam datg menonton langsung di ot
iya tapi siapa mau beli,iya tapi siapa mau beli
isnan kan siapa tau balik jadi penyerang bisa sat set sat set lagi,isnan kan siapa tau balik jadi penyerang bisa sat set sat set lagi
ngantuk,ngantuk
kelen hnya eth trus di salahkn pdahal main emyu bgus aja padahal di player nya yg emng bapuk,kelen hanya eth terus di salahkn padahal main emyu bagus saja padahal di player nya yang memang bapuk
ayo semangat emyu pasti bisa menang ayo semangat emyu pasti bisa menang,ayo semangat emyu pasti bisa menang ayo semangat emyu pasti bisa menang
cape,cape
blunder paling fatal membuang mengganti degea dgn onana,blunder paling fatal membuang mengganti degea dengan onana
aish,aish
sudah kubilang zirkzee martial v,sudah kubilang zirkzee martial v
inpo ig wasit,inpo ig wasit
lu kan nanya posisi unbeaten juga bilbao emang unbeaten kah,lu kan tanya posisi unbeaten juga bilbao memang unbeaten kah
pendukung itu apa bg aku fans emyu pokok nya yg ga sumbu pendek dan tetep objektif liat kondisi dalam dan luar lapangan,pendukung itu apa bang aku fan emyu pokok nya yang enggak sumbu pendek dan tetap objektif lihat kondisi dalam dan luar lapangan
pemain kita kayak kehilangan otak di lapangan banyak keputusan bodoh,pemain kita kayak kehilangan otak di lapangan banyak keputusan bodoh
tampil solid di babak pertama tapi babak kedua mulai kehilangan fokus harus lebih fokus di pertandingan selanjutnya,tampil solid di babak pertama tapi babak kedua mulai kehilangan fokus harus lebih fokus di pertandingan selanjutnya
salah si botak sih ini,salah sih botak sih ini
ruben amorim sudah menunjukkan tandatanda positif dalam laga pertama meskipun hasilnya imbang saya percaya dia bisa memperbaiki tim lebih baik,ruben amorim sudah menunjukkan tandatanda positif dalam laga pertama meskipun hasilnya imbang saya percaya dia bisa memperbaiki tim lebih baik
pemain seperti pogba sangat dibutuhkan dalam formasi utama,pemain seperti pogba sangat dibutuhkan dalam formasi utama
hojlund makin menunjukkan kualitasnya tapi kita nggak bisa hanya berharap dari lini depan defense harus lebih kompak mu menang,hojlund makin menunjukkan kualitasnya tapi kita enggak bisa hanya berharap dari lini depan defense harus lebih kompak mu menang
pelatih fisiknya siapa emyu,pelatih fisiknya siapa emyu
hojlund jadi pembeda tapi pertahanan kita nggak solid harus lebih rapat lagi di belakang,hojlund jadi pembeda tapi pertahanan kita enggak solid harus lebih rapat lagi di belakang
jadwal main kapan jam berapa,jadwal main kapan jam berapa
sungguh mengecewakan kita kalah dan masih banyak sekali kesalahan defensif amorim harus segera bertindak,sungguh mengecewakan kita kalah dan masih banyak sekali kesalahan defensif amorim harus segera bertindak
inal masih aja berharap sama org yg di warlok manchesternya aja udh gak diterima kocak move on deh cepet dan jangan nyalahin management united,inal masih saja berharap sama orang yang di warlok manchesternya saja sudah enggak diterima kocak move on deh cepat dan jangan menyalahkan management united
pertahanan mu harusnya lebih agresif jangan gampang kecolongan,pertahanan mu harusnya lebih agresif jangan gampang kecolongan
masih ada beberapa pemain yang belum nyetel dengan taktik amorim,masih ada beberapa pemain yang belum nyetel dengan taktik amorim
tenhag out carrick in,tenhag out carrick ini
hoki gada var wkwk,hoki enggak ada var wkwk
tetep,tetap
pasti kebobolan gak mungkin gak ada kata gak gol pasti kebobolan jewer kuping gw kalo sampe gak kebonolan,pasti kebobolan enggak mungkin enggak ada kata enggak gol pasti kebobolan jewer kuping gue kalo sampai enggak kebonolan
suka banget sama kerja sama timnya makin kompak tiap pertandingan,suka banget sama kerja sama timnya makin kompak tiap pertandingan
rashford dapet peluang juga,rashford dapat peluang juga
sosoan beli loan pemain ke tim lain pengganti nya gaada transfer window bukanya manfaatin malah beli satu,sosoan beli loan pemain ke tim lain pengganti nya enggak ada transfer window bukanya manfaatin malah beli satu
wkwkkwkkwkwkwkwkwkwkwkwkwkwkwkwkwkkwkkwkwkwkwkkwkwkwkwkwkwkwkwkwkkwkwkwkw pagi pagi udah ngakak,wkwkkwkkwkwkwkwkwkwkwkwkwkwkwkwkwkkwkkwkwkwkwkkwkwkwkwkwkwkwkwkwkkwkwkwkw pagi pagi sudah mengakak
pendukung tenhag,pendukung tenhag
hojlund striker tolol,hojlund striker tolol
mending tukang kebun old trafford jadi pelatih daripada amorim sungguh memalukan,mending tukang kebun old trafford jadi pelatih daripada amorim sungguh memalukan
pelatih overrated kalian masih blm sadar,pelatih overrated kalian masih belum sadar
eth aneh bin ajaibbruno out malah tumini in,eth aneh bin ajaibbruno out malah tumini ini
rashford pun tak guna,rashford pun tak guna
permainan ten hag terlihat lebih stabil namun penyelesaian akhir tim masih jauh dari memuaskan,permainan ten hag terlihat lebih stabil namun penyelesaian akhir tim masih jauh dari memuaskan
kata siapa tahun bisa juga tahun wkwk,kata siapa tahun bisa juga tahun wkwk
tim lebih berani mengambil inisiatif serangan dari awal pertandingan,tim lebih berani mengambil inisiatif serangan dari awal pertandingan
ambil chihwel aja,ambil chihwel saja
mu menang tapi kita nggak bisa terus menerus bergantung pada hojlund dan garnacho pertahanan harus lebih rapat,mu menang tapi kita enggak bisa terus menerus bergantung pada hojlund dan garnacho pertahanan harus lebih rapat
selama pelatihnya masih pelatih medioker kelas rendahan ga bakal bisa juara premier league semua pemain asal liga belanda dah dibawa semua skrg permainannya masih anginan aowkwkw,selama pelatihnya masih pelatih medioker kelas rendahan enggak bakal bisa juara premier league semua pemain asal liga belanda deh dibawa semua sekarang permainannya masih anginan aowkwkw
gaji turungak ada biaya peminjaman,gaji turungak ada biaya peminjaman
jadwal main kapan jam berapa,jadwal main kapan jam berapa
de gea diamonde de light maguire mazroi mctomnay mainodavies kvaratskhelia hojlundgyokeres olise,deh gea diamonde deh light maguire mazroi mctomnay mainodavies kvaratskhelia hojlundgyokeres olise
kenapa kita masih mempertahankan pemain sampah ini nggak ada kontribusi,kenapa kita masih mempertahankan pemain sampah ini enggak ada kontribusi
rotasi pemain amorim lebih masuk akal dibanding ten hag yang sering memaksakan,rotasi pemain amorim lebih masuk akal dibanding ten hag yang sering memaksakan
r saat loan lah karna masih berstatus pemain emyu kontraknya jadi ikut maunya emyu pas udah resmi kontrak dg chelsea ya sukasuka chelsea mau diapain ini pemain,r saat loan lah karena masih berstatus pemain emyu kontraknya jadi ikut maunya emyu pas sudah resmi kontrak dengan chelsea ya sukasuka chelsea mau diapakan ini pemain
udah dari musim kemarin perform rashford ini turun bgtcuma mungkin karena pemain lokal yg harus di utamain jadi ten hag juga gak bisa nolak buat gak mainin dy kayanya,sudah dari musim kemarin perform rashford ini turun bgtcuma mungkin karena pemain lokal yang harus di utamain jadi ten hag juga enggak bisa nolak buat enggak mainin dia kayanya
gak paham tapi tiap main pasti rame aja,enggak paham tapi tiap main pasti rame saja
chemistry tim butuh waktu tapi arah permainan sudah lebih jelas,chemistry tim butuh waktu tapi arah permainan sudah lebih jelas
jadi mu serba salah fansnya ringan hujat,jadi mu serba salah fansnya ringan hujat
laga kedua ini menunjukkan adanya peningkatan di lini pertahanan namun lini serang masih belum cukup tajam untuk meraih kemenangan,laga kedua ini menunjukkan adanya peningkatan di lini pertahanan namun lini serang masih belum cukup tajam untuk meraih kemenangan
main dah satu squad,main deh satu squad
ga di tonton menang giliran ditonton kalah mending ga usah nonton dlu,enggak di tonton menang giliran ditonton kalah mending enggak usah menonton dulu
keren banget menit loh main dengan pemain,keren banget menit loh main dengan pemain
amad masih gak fokus main habis berduka,amad masih enggak fokus main habis berduka
pelatih freak ke wkwkwk,pelatih freak ke wkwkwk
taktik oke cuma di belakang masih gampang bocor harus lebih hatihati menghadapi serangan lawan,taktik oke cuma di belakang masih gampang bocor harus lebih hatihati menghadapi serangan lawan
tau proses gol garnacho,tau proses gol garnacho
kalo gak perform gw yakin sih desember awal tahun juga si botak di depak ineos,kalo enggak perform gue yakin sih desember awal tahun juga sih botak di depak ineos
nah itu dia,nah itu dia
at least kritikannya ada isinya bos biar agak paham gak cuma bisa koar doang,at least kritikannya ada isinya bos biar agak paham enggak cuma bisa koar doang
halu,halu
udah bener dapat tandem pemain yg pas eksperimen gak jelas lagi mas morim mas morim,sudah benar dapat tandem pemain yang pas eksperimen enggak jelas lagi mas morim mas morim
tenang bro duit mu banyak jual baju bulan udh balik modal kok itu,tenang bro duit mu banyak jual baju bulan sudah balik modal kok itu
round ini belum pake var,round ini belum pakai var
kribo dongong,kribo dongong
betul,betul
gatau sorry namanya juga manusia bukan nabi boy,enggak tau sorry namanya juga manusia bukan nabi boy
dulu maguire down sekarang bagus sekarang plz kunciin raspot di wc,dulu maguire down sekarang bagus sekarang plz kunciin raspot di wc
ya bisa aja bang trgantung keinginan pemain nya itu sndiri sbenernya tapi kog gw merasa ga ada tekad sebesar itu,ya bisa saja bang trgantung keinginan pemain nya itu sendiri sbenernya tapi kok gue merasa enggak ada tekad sebesar itu
udh uzur,sudah uzur
ugarte dm maino cm bruno amf lwf garnacho rwf amad cf hojlund,ugarte dm maino cuma bruno amf lwf garnacho rwf amad cf hojlund
ugarte benerbener ngasih keseimbangan di tengah duetnya sama mainoo udah kayak prime scholescarrick,ugarte benerbener mengasih keseimbangan di tengah duetnya sama mainoo sudah kayak prime scholescarrick
yang penting tetap dukung tim kesayangan menang kalah itu biasa,yang penting tetap dukung tim kesayangan menang kalah itu biasa
senang lihat pemain muda dapat kesempatan di era amorim ini yang kita butuhkan,senang lihat pemain muda dapat kesempatan di era amorim ini yang kita butuhkan
relate sekali bang wkwkwkw,relate sekali bang wkwkwkw
amorim lebih fleksibel dalam mengganti skema saat pertandingan berlangsung,amorim lebih fleksibel dalam mengganti skema saat pertandingan berlangsung
jadwal main kapan jam berapa,jadwal main kapan jam berapa
yok semangat bisa wins,yuk semangat bisa wins
akhirnya kalah,akhirnya kalah
gila amorim mengubah tim ini menjadi mesin kemenangan,gila amorim mengubah tim ini menjadi mesin kemenangan
sty in,sty ini
tim lebih sering melakukan pressing tinggi dibanding sebelumnya,tim lebih sering melakukan pressing tinggi dibanding sebelumnya
malah kebobolan pula,malah kebobolan pula
bukan bro dia bocah yg ikutan doang karena temennya dukung emyu wkwkwkwk duskardus,bukan bro dia bocah yang ikutan doang karena temannya dukung emyu wkwkwkwk duskardus
semoga musim depan ada perubahan signifikan,semoga musim depan ada perubahan signifikan
maulana eh gimana sih bang gua pendukung bayindir,maulana eh bagaimana sih bang gua pendukung bayindir
untuk saat ini belum ada,untuk saat ini belum ada
kasih setahun lagi kita liat ini mu udah dateng banyak pemain ditunggu aja baru match,kasih setahun lagi kita lihat ini mu sudah datang banyak pemain ditunggu saja baru match
benerbener diterpa badai coy,benerbener diterpa badai coy
kan kata gue lihat sampai akhir musim baru percaya gak percaya ini baru match elu sudah bisa rangkumin sampai match ke atau epl,kan kata gue lihat sampai akhir musim baru percaya enggak percaya ini baru match lu sudah bisa rangkumin sampai match ke atau epl
pergantian yang salah dan tidak tepat atau memang pelatih yang medioker dengan merekrut yang rata eks ajax,pergantian yang salah dan tidak tepat atau memang pelatih yang medioker dengan merekrut yang rata eks ajax
gapapa secara permainan aja dah bagus prospeknya oke,gapapa secara permainan saja deh bagus prospeknya oke
ugarte come on,ugarte come on
lini pertahanan semakin solid di bawah ruben amorim namun greenwood dan rashford harus lebih tajam dalam menyelesaikan peluang,lini pertahanan semakin solid di bawah ruben amorim namun greenwood dan rashford harus lebih tajam dalam menyelesaikan peluang
palmer juga boleh lho wkwk,palmer juga boleh lho wkwk
ente penyefong onanin dan tengag,ente penyefong onanin dan tengag
rotasi pemain lebih masuk akal tidak ada yang dipaksa main saat tidak fit,rotasi pemain lebih masuk akal tidak ada yang dipaksa main saat tidak fit
jadwal main kapan jam berapa,jadwal main kapan jam berapa
naikin gaji maino,naikin gaji maino
fred sering membuat keputusan terburuburu yang menyebabkan kita kehilangan bola di area kritis,fred sering membuat keputusan terburuburu yang menyebabkan kita kehilangan bola di area kritis
bayindir mazraoui de ligt martinez dalot mainoo ugarte amad bruno garnacho zirkzee onana pinjemin aja liga tarkam,bayindir mazraoui deh ligt martinez dalot mainoo ugarte amad bruno garnacho zirkzee onana pinjemin saja liga tarkam
udah bukan salah pelatih bwangg emg emyu yg bapuk,sudah bukan salah pelatih bwangg memang emyu yang bapuk
bukan kena dengkul emg sengaja disenggol wkwkw anjir kesel bet liatnya,bukan kena dengkul memang sengaja disenggol wkwkw anjir kesel banget lihatnya
gajadi loan ya berarti,gajadi loan ya berarti
kemenangan memang penting tapi lebih penting lagi konsistensi,kemenangan memang penting tapi lebih penting lagi konsistensi
lebih untung chelsea jual mason mount jt yg tinggal hampasnya doang,lebih untung chelsea jual mason mount juta yang tinggal hampasnya doang
intinya sudah berhenti berharap dapet juara liga fa cup atau carabao udah seneng masuk zona champion juga udah alhamdulillah aja lelah berharap pada botak ktl skema itu ajaa gak ada perubahannya,intinya sudah berhenti berharap dapat juara liga fa cup atau carabao sudah senang masuk zona champion juga sudah alhamdulillah saja lelah berharap pada botak ktl skema itu saja enggak ada perubahannya
hahaha,hahaha
bener banggajelas mang ni pelatih trus suka so soan experimen di liga inggris pemain giliran kiper gamau dia,benar banggajelas memang ini pelatih terus suka so soan experimen di liga inggris pemain giliran kiper enggak mau dia
bagus ga bang dorgu mainnya,bagus enggak bang dorgu mainnya
d inggris aja dah tersingkir ini si botak msh maksain aja apa yg d harapkan dr pemain males lari,di inggris saja deh tersingkir ini sih botak masih maksain saja apa yang di harapkan dari pemain malas lari
kok case ga pernah di pake lagi ya,kok case enggak pernah di pakai lagi ya
jual baju mah yang cuan adidasnya wkwkwk kalau duitnya ke mu juga terus adidas dapat apa,jual baju mah yang cuan adidasnya wkwkwk kalau duitnya ke mu juga terus adidas dapat apa
jadwal main kapan jam berapa,jadwal main kapan jam berapa
sepakat,sepakat
nah itu dia bro beda kalo hojlund udah mentok masuk si zikri langsung leluasa banget winger mu karna bisa buka ruang walaupun cuma keliatan mondar mandir,nah itu dia bro beda kalo hojlund sudah mentok masuk sih zikri langsung leluasa banget winger mu karena bisa buka ruang walaupun cuma kelihatan mondar mandir
gila seru banget pertandingan kali ini ayo terus berjuang,gila seru banget pertandingan kali ini ayo terus berjuang
lah chilwell lebih parah encok nya daripada shaw mereka,lah chilwell lebih parah encok nya daripada shaw mereka
jadwal main kapan jam berapa,jadwal main kapan jam berapa
hapus bg jgn sampe dilihat sancho,hapus bang jangan sampai dilihat sancho
assist bruno kelas bgt crossing membelah lautan,assist bruno kelas banget crossing membelah lautan
stop mainin rashford sm casemiro sebagai starter kasih amad sm ugarte yg main inti,stop mainin rashford sama casemiro sebagai starter kasih amad sama ugarte yang main inti
di lapangan aja gak gerak apa ya pasti tetap fitlah onanananananaa,di lapangan saja enggak gerak apa ya pasti tetap fitlah onanananananaa
dari sekian banyak yg cedera merasa banget kehilangan amad dialo,dari sekian banyak yang cedera merasa banget kehilangan amad dialo
adtya amorim ajg,adtya amorim ajg
boleh juga yah main joshua zikri sekarang,boleh juga ya main joshua zikri sekarang
udh gitu peluang depan mata gaada masuk ama dia wkwkwk puas banget gw ngetawain havertz malam ini,sudah begitu peluang depan mata enggak ada masuk sama dia wkwkwk puas banget gue ngetawain havertz malam ini
ft win,ft win
tetep aja rashford main fulltime yg diganti amad,tetap saja rashford main fulltime yang diganti amad
tapi memang fakta saat ini,tapi memang fakta saat ini
jadwal main kapan jam berapa,jadwal main kapan jam berapa
waduh chilwell siap bpjs,waduh chilwell siap bpjs
tiap taun sekali gacornya setengah musim doang wkwkwk,tiap tahun sekali gacornya setengah musim doang wkwkwk
tai kabeh,tahi kabeh
bruno fernandes tetap menjadi pengatur permainan meskipun ada beberapa kali dia kehilangan bola dalam situasi krusial,bruno fernandes tetap menjadi pengatur permainan meskipun ada beberapa kali dia kehilangan bola dalam situasi krusial
fakta sih ini,fakta sih ini
ruben amorim memperlihatkan kualitasnya di laga kedua meskipun hasilnya imbang saya bisa melihat banyak peningkatan dalam permainan tim,ruben amorim memperlihatkan kualitasnya di laga kedua meskipun hasilnya imbang saya bisa melihat banyak peningkatan dalam permainan tim
lu ngomong apa sih,lu mengomong apa sih
bagus ga bang dorgu mainnya,bagus enggak bang dorgu mainnya
kapan lagi dapet pemain tapi kalo ke juve oke lah barter sama chiesa mah,kapan lagi dapat pemain tapi kalo ke juve oke lah barter sama chiesa mah
mu blm kalah sendiri cok moga konsisten,mu belum kalah sendiri cok moga konsisten
katanya percaya proses katanya tagar wetrusthag ko berubah lagi ten hag out mamam tuh dr main laga persahabatan aja dah keliatan cara mainnya sama,katanya percaya proses katanya tagar wetrusthag kok berubah lagi ten hag out mamam tuh dari main laga persahabatan saja deh kelihatan cara mainnya sama
bubar bubar,bubar bubar
maruk,maruk
senggol dikit jatoh pelanggaran,senggol dikit jatuh pelanggaran
percuma komen onana jelekatau apalah andalan ten hag itu,percuma komen onana jelekatau apalah andalan ten hag itu
ya syukur kalo lo menikmati permainan antah berantah aplg doyan liat bola di trashford,ya syukur kalo lo menikmati permainan antah berantah aplg doyan lihat bola di trashford
tahan emosi sayang,tahan emosi sayang
onana kiper terlawak dalam sejarah united,onana kiper terlawak dalam sejarah united
dia banyak bacot tapi ada benernya rashy udah gak punya niat movement bahaya kaya dulu makin yakin pas itu sebenarnya hoki aja positioning dia,dia banyak bacot tapi ada benernya rashy sudah enggak punya niat movement bahaya kaya dulu makin yakin pas itu sebenarnya hoki saja positioning dia
harus fifa bisa ubah posisi offside seperti ini jadi gol karna ada atau tdk pemain tsb gol bola contohnya kalo bola sengaja di tepis sama bek tapi masuk ke gawang tetap sahgol kalo ga masuk bisa berbuah pinalty,harus fifa bisa ubah posisi offside seperti ini jadi gol karena ada atau tidak pemain tersebut gol bola contohnya kalo bola sengaja di tepis sama bek tapi masuk ke gawang tetap sahgol kalo enggak masuk bisa berbuah pinalty
jadwal main kapan jam berapa,jadwal main kapan jam berapa
emg udh wajib diparkir rashford sm casemiro jgn dikasih main dr awal,memang sudah wajib diparkir rashford sama casemiro jangan dikasih main dari awal
ethout,ethout
riill bang,riill bang
senggol dikit pelanggaran kartu kuning awokawok meriam lontong byk drama,senggol dikit pelanggaran kartu kuning awokawok meriam lontong banyak drama
perubahan yang dibawa ruben amorim sangat positif namun lini serang harus lebih tajam untuk meraih kemenangan di lagalaga berikutnya,perubahan yang dibawa ruben amorim sangat positif namun lini serang harus lebih tajam untuk meraih kemenangan di lagalaga berikutnya
siapa yg ngewajarin sih susah replyan sama batu kali,siapa yang ngewajarin sih susah replyan sama batu kali
klo palmer gas ditukerin sterling malah downgrade dong,kalo palmer gas ditukerin sterling malah downgrade dong
jadwal main kapan jam berapa,jadwal main kapan jam berapa
tp kata pemujanya itu tidak bs dilakukan arteta di arsenal tp secara kolektif dan permainan arsenal jauh lebih bagus,tapi kata pemujanya itu tidak bisa dilakukan arteta di arsenal tapi secara kolektif dan permainan arsenal jauh lebih bagus
skor walau menang mu nggak bisa terus bermain begini pertahanan harus lebih rapat agar nggak kebobolan lagi,skor walau menang mu enggak bisa terus bermain begini pertahanan harus lebih rapat agar enggak kebobolan lagi
