before_normalisasi,after_normalisasi
fantastic wajah baru,fantastic wajah baru
min kok harinya,min kok harinya
kalau altay main menang sih,kalau altay main menang sih
sabar disayang sang pencipta,sabar disayang sang pencipta
lg eksperimen kan ya mending maksimalin dorgu dibanding dalot yg dah jelas mutunya,lagi eksperimen kan ya mending maksimalin dorgu dibanding dalot yang deh jelas mutunya
wo baru ini menemukan fans emyu dan proud,wo baru ini menemukan fan emyu dan proud
gue nunggu lu ngetrol jersey tanah abang min plis hayukk,gue nunggu lu ngetrol jersey tanah abang min plis hayo
jersey emyu,jersey emyu
masih sering blunder,masih sering blunder
nonton manchester united seru juga ya walaupun bukan fans emyu,menonton manchester united seru juga ya walaupun bukan fan emyu
hastagnya bagus mu muntot ahahah,hastagnya bagus mu muntot ahahah
goblok,goblok
wkwk sampah,wkwk sampah
kalo mau ganti pelatih ya minimal jangan ole lagi ya,kalo mau ganti pelatih ya minimal jangan ole lagi ya
ubur ubur ikan lele duet onana dalot manyala le,ubur ubur ikan lele duet onana dalot manyala boleh
main tuh gini blok,main tuh begini blok
manchester united lolos ke besar liga europa usai kalahkan fcsb mufc emyu mainoo,manchester united lolos ke besar liga europa usai kalahkan fcsb mufc emyu mainoo
emyu goblok ga ditonton bukannya menang malah tolol,emyu goblok enggak ditonton bukannya menang malah tolol
min pengen dibikinin juga,min pengin dibikinin juga
ternyata pertandingan emyu lawan coventry gak seburuk itu,ternyata pertandingan emyu lawan coventry enggak seburuk itu
meanwhile di eredivisie ajax lg memimpin klasemen poin sama ma psv tp msh pny match pelatihnya bagus nih cocok ngelatih emyu,meanwhile di eredivisie ajax lagi memimpin klasemen poin sama sama psv tapi masih punya match pelatihnya bagus nih cocok ngelatih emyu
jelas paham pak vincent niki,jelas paham pak vincent niki
kmrn ada yg emyu trus ada yg matcha jg eh skrg ada yg strawberry,kemarin ada yang emyu terus ada yang matcha juga eh sekarang ada yang strawberry
hari ini tgl anj,hari ini tanggal anjing
manuel ugarte di persiapan jeda internasional uriguay manchesterunited ugarte kingemyu,manuel ugarte di persiapan jeda internasional uriguay manchesterunited ugarte kingemyu
tai false nine kayak tai sok sok an nyobain formasi malah gagal ini mah amorim nya yg salah,tahi false nine kayak tahi sok sok an mencoba formasi malah gagal ini mah amorim nya yang salah
semoga di next match lawan palace besok nyekor deh biar percaya diri tinggi lagi kayak musim lalu,semoga di next match lawan palace besok nyekor deh biar percaya diri tinggi lagi kayak musim lalu
casemiro akan mempertahankan posisinya di manchester united dan akan menolak semua tawaran yg masuk manchesterunited casemiro kingemyu,casemiro akan mempertahankan posisinya di manchester united dan akan menolak semua tawaran yang masuk manchesterunited casemiro kingemyu
saat ini jika manchester united tanding melawan dewa united gue yakin manchester united bakalan keok deh,saat ini jika manchester united tanding melawan dewa united gue yakin manchester united bakalan keok deh
seru kurang gol aja dr mu,seru kurang gol saja dari mu
official hanibal mejbri meninggalkan manchester united dengan permanen menuju burnley manchesterunited hanibalmejbri kingemyu,official hanibal mejbri meninggalkan manchester united dengan permanen menuju burnley manchesterunited hanibalmejbri kingemyu
ft premier league r ben amorim debut king emyu ditahan imbang tim promosi yang sedang berada di zona degradasi ipswich town manchester united gol hutchison rashford,ft premier league r ben amorim debut king emyu ditahan imbang tim promosi yang sedang berada di zona degradasi ipswich town manchester united gol hutchison rashford
emyuu menango asuu emyu manchesterunited,emyuu menango asuu emyu manchesterunited
kebalik dong di mana sejarahnya fans emyu bisa santuy kalah aja sombong apalagi menang jangan mengaburkan yg sudah jelas gitu ah,kebalik dong di mana sejarahnya fan emyu bisa santuy kalah saja sombong apalagi menang jangan mengaburkan yang sudah jelas begitu ah
fans nya gak pakek marah ngatain depan mic kan tapi,fan nya enggak pakai marah mengatai depan mic kan tapi
rasmus holjund masih berkerja keras agar cepat kembali untuk tim dan segera mendapatkan menit bermain manchesterunited holjund kingemyu,rasmus holjund masih berkerja keras agar cepat kembali untuk tim dan segera mendapatkan menit bermain manchesterunited holjund kingemyu
bubar aja kalian,bubar saja kalian
jangan sia sia kan waktu istirahat mu dengan menonton tim setan,jangan sia sia kan waktu istirahat mu dengan menonton tim setan
setpiece mulu gacape apa anjing,setpiece mulu gacape apa anjing
degradasi aja klub sampah pemain pemain sampah apalagi nomor sama,degradasi saja klub sampah pemain pemain sampah apalagi nomor sama
ngomong nya mutermuter terus kyk cari alasan,mengomong nya mutermuter terus kayak cari alasan
infokan jadwal tanding nyuk,infokan jadwal tanding nyuk
iya iya emyu oke,iya iya emyu oke
resmi trebel hanya di pegang emyu dan city lessgo,resmi trebel hanya di pegang emyu dan city lessgo
hahaa hasil muntot lah,hahaa hasil muntot lah
dari awal emyu cetak goll lini tengah ga bisa kontrol permainan eriksen keliatan ga bisa menjalankan tugas nya semoga babak kedua ugarte casemiro terjadi lagi manchesterunited,dari awal emyu cetak goll lini tengah enggak bisa kontrol permainan eriksen kelihatan enggak bisa menjalankan tugas nya semoga babak kedua ugarte casemiro terjadi lagi manchesterunited
ten hag di pecat gacor gini brook emyu emyu manchesterunited mufc munche,ten hag di pecat gacor begini brook emyu emyu manchesterunited mufc munche
bocil ini fans emyu sejak lahir nama nya pakai nama pemain dan pelatih emyu derinfobola football kualifikasipialadunia manchesterunited,bocil ini fan emyu sejak lahir nama nya pakai nama pemain dan pelatih emyu derinfobola football kualifikasipialadunia manchesterunited
boxing day liga inggris diwarnai kartu merah bruno fernades wolves pecundangi manchester united mufc emyu onana wolves manchesterunited mu wolverhamptonwanderers ligainggris hasilpertandinganligainggris,boxing day liga inggris diwarnai kartu merah bruno fernades wolves pecundangi manchester united mufc emyu onana wolves manchesterunited mu wolverhamptonwanderers ligainggris hasilpertandinganligainggris
kita sama fans emyu laporin onana aja bang,kita sama fan emyu laporin onana saja bang
bisa kayaknya kak blio aja bisa bikin setan yang di logo emyu,bisa kayaknya kak blio saja bisa bikin setan yang di logo emyu
sepele,sepele
untung ayam sayur babak kedua suka main dibelakang,untung ayam sayur babak kedua suka main dibelakang
selesai tu emyu,selesai itu emyu
pertahanin erik ten hug dy pelatih mu terbaik sepanjang masa dy bakal bawa mu jadi juara amp,pertahanin erik ten hug dia pelatih mu terbaik sepanjang masa dia bakal bawa mu jadi juara amp
hari ini awakku sedang meriang dan butuh hiburan jg kang jd demi mencari hal yg menghibur sy buka chanel youtube manchester united dan melihat highlights mu vs liverpool alhamdulillah jd terhibur terimakasih emyu,hari ini awakku sedang meriang dan butuh hiburan juga kang jadi demi mencari hal yang menghibur saya buka chanel youtube manchester united dan melihat highlights mu vs liverpool alhamdulillah jadi terhibur terimakasih emyu
jangan ungkit masalalu le,jangan ungkit masalalu boleh
masih kak,masih kak
tahun di manchester united dan sekarang akan berpisah once red always red manchesterunited mctominay kingemyu,tahun di manchester united dan sekarang akan berpisah once red always red manchesterunited mctominay kingemyu
pembantaian gspurs,pembantaian gspurs
rasmus holjund masih berkerja keras agar cepat kembali untuk tim dan segera mendapatkan menit bermain manchesterunited holjund kingemyu,rasmus holjund masih berkerja keras agar cepat kembali untuk tim dan segera mendapatkan menit bermain manchesterunited holjund kingemyu
udah bubarin aja ini klub,sudah bubarin saja ini klub
sampe kapan ya kata biasakan nonton emyu sampe abis ini dipake,sampai kapan ya kata biasakan menonton emyu sampai habis ini dipakai
ugarte telah tiba di carington dan akan menandatangani kontraknya hari ini pengumuman official akan menyusul manchesterunited ugarte kingemyu,ugarte telah tiba di carington dan akan menandatangani kontraknya hari ini pengumuman official akan menyusul manchesterunited ugarte kingemyu
biasakan nonton mu sampe selesai,biasakan menonton mu sampai selesai
de ligt dilaga melawan boznia manchesterunited deligt kingemyu,deh ligt dilaga melawan boznia manchesterunited deligt kingemyu
gausah komen gausah komen gausah komen,enggak usah komen enggak usah komen enggak usah komen
emyu,emyu
sungguh aku tak bisa sampai kapan pun tak bisa membenci dirimu sesungguhnya aku tak mampu sulit untuk ku bisa sangat sulit ku tak bisa memisahkan segala cinta dan benci yang ku rasa oh antara cinta dan benci ggmu geisha onanaout amorin,sungguh aku tak bisa sampai kapan pun tak bisa membenci dirimu sesungguhnya aku tak mampu sulit untuk ku bisa sangat sulit ku tak bisa memisahkan segala cinta dan benci yang ku rasa oh antara cinta dan benci ggmu geisha onanaout amorin
woi itu klub sebelah abis kambek yg dipost emyu mulu wkwkk,woi itu klub sebelah habis kambek yang dipost emyu mulu wkwkk
tengok sedikit keadaan manchester united emyu manchesterunited,tengok sedikit keadaan manchester united emyu manchesterunited
buat milwall bristol city dan norwich siapsiap klean menghadapi emyu di championship musim depan superlive supersoccer inirasanyasuper manchesterunited,buat milwall bristol city dan norwich siapsiap klean menghadapi emyu di championship musim depan superlive supersoccer inirasanyasuper manchesterunited
wkwkwkw emang enak bau eek ayam,wkwkwkw memang enak bau eek ayam
buat milwall bristol city dan norwich siapsiap klean menghadapi emyu di championship musim depan superlive supersoccer inirasanyasuper manchesterunited,buat milwall bristol city dan norwich siapsiap klean menghadapi emyu di championship musim depan superlive supersoccer inirasanyasuper manchesterunited
udah tau koq bakal kalah lagi saatnya eth out lah ama top kalah ama yg mid table draw menang ama kelab bawah mu hanya mediocre club,sudah tau kok bakal kalah lagi saatnya eth out lah sama top kalah sama yang mid table draw menang sama kelab bawah mu hanya mediocre club
what max actually said to kdb eh kocak coba lu belah dada gua dan lu liat isinya apaan isinya manchester united itu artinya gua cinta manchester united manchester united till i die paham lu,what max actually said tapi kdb eh kocak coba lu belah dada gua dan lu lihat isinya apaan isinya manchester united itu artinya gua cinta manchester united manchester united till i die paham lu
langsung aja pialanya kasih ke king emyu,langsung saja pialanya kasih ke king emyu
awokokokok asyu ini tim,awokokokok asyu ini tim
mending kontrak aji santoso ae,mending kontrak aji santoso saja
uburubur ikan lele kapan lagi juara epl le,uburubur ikan lele kapan lagi juara epl boleh
sesuai hastag muntot,sesuai hastag mu muntot
ra persis ra mu podo podo goblokee wkwk,ra persis ra mu podo podo goblokee wkwk
klub bodoh,klub bodoh
bapuknya emyu tetap dianggap sebagai salah satu yang terbesar,bapuknya emyu tetap dianggap sebagai salah satu yang terbesar
teh kayu bajakah kalimantan kualitas terbaik herbal kayu akar bajakah asli sehatin makanan amp,teh kayu bajakah kalimantan kualitas terbaik herbal kayu akar bajakah asli sehatin makanan amp
daftar para pemain legend yg akan ikut serta dalam laga manchester united legends vs celtic legends manchesterunited kingemyu,daftar para pemain legend yang akan ikut serta dalam laga manchester united legends vs celtic legends manchesterunited kingemyu
emyu skrg sepele,emyu sekarang sepele
lu nonton ga kalau bukan onana tadi udah di bantai kosong,lu menonton enggak kalau bukan onana tadi sudah di bantai kosong
hadehh min,hadehh min
dari tim di liga europa manchester united adalah satusatunya tim yang tak terkalahkan king emyu is back unitedicon mufc uel,dari tim di liga europa manchester united adalah satusatunya tim yang tak terkalahkan king emyu is back unitedicon mufc uel
gw gemes banget sama si botak sesekali onana di ganti dulu kenapa sih emang sebegitu hebatnya dia sekali aja pengen liat gmna refleknya kiper pengganti onana susah cleant sheet soalnya jadi coba ganti dulu pertandingan kek,gue gemas banget sama sih botak sesekali onana di ganti dulu kenapa sih memang sebegitu hebatnya dia sekali saja pengin lihat bagaimana refleknya kiper pengganti onana susah cleant sheet soalnya jadi coba ganti dulu pertandingan kayak
selesai tuh emyu,selesai tuh emyu
emyu kmn,emyu kemana
km gpp,kamu enggak apa-apa
pliss mending naksir emyu,pliss mending menaksir emyu
jadwal manchester united dari gw hanya ada empat laga sulit rashford m fernandes m rashford adalah pemain streaky alias sekali ketemu sentuhannya bakal lanjut terus fernandes pemain kunci emyu meta baru,jadwal manchester united dari gue hanya ada empat laga sulit rashford m fernandes m rashford adalah pemain streaky alias sekali ketemu sentuhannya bakal lanjut terus fernandes pemain kunci emyu meta baru
entah kenapa musuh kalo lawan emyu jago semua najis aneh,entah kenapa musuh kalo lawan emyu jago semua najis aneh
santai aja buat fans baru beberapa pertandingan jangan kebakaran jenggot kalah menang wajar apalagi kena red card tapi buat pelatih ente gak bisa marah ya kepemain,santai saja buat fan baru beberapa pertandingan jangan kebakaran jenggot kalah menang wajar apalagi kena red card tapi buat pelatih ente enggak bisa marah ya kepemain
mu butuh michael carrick,mu butuh michael carrick
sampe kapan ya kata biasakan nonton emyu sampe abis ini dipake,sampai kapan ya kata biasakan menonton emyu sampai habis ini dipakai
eunha demennya cireng gambar emyu,eunha demennya cireng gambar emyu
eunha demennya cireng gambar emyu,eunha demennya cireng gambar emyu
sudah waktunya,sudah waktunya
gak seru bgt gak emosi km,enggak seru banget enggak emosi kamu
saatnya meramaikan wa nya fandar,saatnya meramaikan wa nya fandar
assmbuhlah,assmbuhlah
king emyu is bek manchesterunited,king emyu is bek manchesterunited
erik ten hag ketika diwawancara apakah sancho akan bertahan untuk saat ini setahu saya iya manchesterunited sancho kingemyu,erik ten hag ketika diwawancara apakah sancho akan bertahan untuk saat ini setahu saya iya manchesterunited sancho kingemyu
obrolan saya bersama anak lanang saya mas boleh suka klub apa saja asal jangan anak kenapa emang yahh saya klub itu logo nya setan ngga boleh suka atau berteman sama setan anak oh iyaa saya,obrolan saya bersama anak lanang saya mas boleh suka klub apa saja asal jangan anak kenapa memang ya saya klub itu logo nya setan enggak boleh suka atau berteman sama setan anak oh iya saya
udah mah hari senin si emyu mlah kalah lagi jdi pngen cepet ganti platih ini mah manchesterunited bapuk,sudah mah hari senin sih emyu malah kalah lagi jadi pengin cepat ganti platih ini mah manchesterunited bapuk
ingin ngatain klub anjing tapi sayang,ingin mengatai klub anjing tapi sayang
baru kemaren liat emyu maen rasanya bangga sekarang malah balik ke setelan pabrik emyu mu manchesterunited,baru kemarin lihat emyu main rasanya bangga sekarang malah balik ke setelan pabrik emyu mu manchesterunited
sitik engkas degradasi yok bisa yok degradasi wingi sing cangkeme hastag ten hag out endi ambune wis diwarah penyakite emyu iki pemain uduk pelatih longgor erro opo arek longgor sak congore diwehi pelatih apik malah dibuwak milih amorim manchesterunited,sitik engkas degradasi yuk bisa yuk degradasi wingi sing cangkeme hastag ten hag out endi ambune wis diwarah penyakite emyu iki pemain uduk pelatih longgor erro opo arek longgor sak congore diwehi pelatih apik malah dibuwak memilih amorim manchesterunited
utamakan orangtua mu diri mu impian mu dan keinginan mu lalu mu emyu derby nanti malam gees lawan ny tim biasa ajah menang lagi ini mah manchesterunited emyu,utamakan orangtua mu diri mu impian mu dan keinginan mu lalu mu emyu derby nanti malam gees lawan nya tim biasa saja menang lagi ini mah manchesterunited emyu
ubur ubur ikan lele duet onana dalot manyala le,ubur ubur ikan lele duet onana dalot manyala boleh
onana anjeng,onana anjeng
emang emyu knp,memang emyu kenapa
erik ten hag yakin jika rasmus holjund dan mason mount mungkin ada dalam squad melawan crystal palace manchesterunited kingemyu,erik ten hag yakin jika rasmus holjund dan mason mount mungkin ada dalam squad melawan crystal palace manchesterunited kingemyu
mu tuh klub sepak bola bukan roller coaster tapi kenapa naik turun terus performanya,mu tuh klub sepak bola bukan roller coaster tapi kenapa naik turun terus performanya
mc kenna tahu banget kelemahan pemain emyu di pressing ketat kelabakan keliatan ada beberapa pemain iq jongkok tengahnya kalah telak hutrison sama delap aja bikin kocar kacir welcome to business man united amorim,mc kenna tahu banget kelemahan pemain emyu di pressing ketat kelabakan kelihatan ada beberapa pemain iq jongkok tengahnya kalah telak hutrison sama delap saja bikin kocar kacir welcome tapi business man united amorim
luke shaw akan segera kembali dari cideranya setelah jeda internasional dan akan tersedia di laga southamton manchesterunited shaw kingemyu,luke shaw akan segera kembali dari cideranya setelah jeda internasional dan akan tersedia di laga southamton manchesterunited shaw kingemyu
nanti kalo liat saya di wiki jadi malu,nanti kalo lihat saya di wiki jadi malu
masih kak,masih kak
semalam habis nonton emyu pasti,semalam habis menonton emyu pasti
mau balas komen eh tnyata sehaluan sm,mau balas komen eh tnyata sehaluan sama
big chances terbanyak tapi gol cuma lucu manchesterunited kingemyu,big chances terbanyak tapi gol cuma lucu manchesterunited kingemyu
alhamdulillah bisa menang walopun hoki dgn playing style control counter yg hampir mirip dgn mou defend counter ya gak bisa berharap banyak jika berhadapan dgn big four rasanya perjalanan akan dinamik seperti musim kmren emyu manchesterunited,alhamdulillah bisa menang walopun hoki dengan playing style control counter yang hampir mirip dengan mou defend counter ya enggak bisa berharap banyak jika berhadapan dengan big four rasanya perjalanan akan dinamik seperti musim kemarin emyu manchesterunited
emang hebat dan dahsyat ini klub kalah jadi berita utama menang jadi trending treble jadi trending player in out jadi trending pelatih in out pun jadi trending ggmu go emyu manchesterunited,memang hebat dan dahsyat ini klub kalah jadi berita utama menang jadi trending treble jadi trending player ini out jadi trending pelatih ini out pun jadi trending ggmu go emyu manchesterunited
what dd emyu kalah,what dd emyu kalah
menang sekali kalah sering kali,menang sekali kalah sering kali
tanggal emyu imbang tanggal emyu kalah tanggal emyu kalah mufc manchesterunited amorim brunofernandes onana,tanggal emyu imbang tanggal emyu kalah tanggal emyu kalah mufc manchesterunited amorim brunofernandes onana
mikirin ava seh tarik napas sesungguhnya orang yg terburu buru adalah temen nya emyu bah,memikirkan ava sih tarik napas sesungguhnya orang yang terburu buru adalah teman nya emyu bah
fans emyu itu miskin emyu gak akan mungkin beli jersey asli karena beli di tanah abang kata salah podcaster fans liverpool,fan emyu itu miskin emyu enggak akan mungkin beli jersey asli karena beli di tanah abang kata salah podcaster fan liverpool
sekuat apa di tongkrongan dia kuat banget itu fans emyu post kebayang kan emyu zaman skrg kek apa tempaan mentalnya cuman salahnya beliau ni denial n pas rusak ngajak diajakin berbenah paling kena guilt tripping andanya,sekuat apa di tongkrongan dia kuat banget itu fan emyu post terbayang kan emyu zaman sekarang kayak apa tempaan mentalnya cuman salahnya beliau ini denial n pas rusak mengajak diajakin berbenah paling kena guilt tripping andanya
wkwk sampah,wkwk sampah
pasti adikmu fans emyu,pasti adikmu fan emyu
xixixi,xixixi
saatnya meramaikan wa nya fandar,saatnya meramaikan wa nya fandar
emyu,emyu
aet manchester united liverpool mctominay antony rashford amad diallo amad diallo mac allister salah elliott gila gila gila emyu ke semifinal,aet manchester united liverpool mctominay antony rashford amad diallo amad diallo mac allister salah elliott gila gila gila emyu ke semifinal
onani bangsat lagi kiper jancok,onani bangsat lagi kiper jancok
tadi sempet baca postingan akun fanbase mu katanya bayindir nggak fit ya min alamat onana bakalan dipasang nih semoga semua baikbaik saja muku,tadi sempat baca postingan akun fanbase mu katanya bayindir enggak fit ya min alamat onana bakalan dipasang nih semoga semua baikbaik saja muku
izinkan saya di era kebangkitan emyu ini timeline penuh dengan klub terbaik dengan penduduk bumi adalah fans klub itu yak betul manchester united,izinkan saya di era kebangkitan emyu ini timeline penuh dengan klub terbaik dengan penduduk bumi adalah fan klub itu ya betul manchester united
auah terserah lu aja lah,auah terserah lu saja lah
ada sisa menit waktu normal di babak kedua manchester united liverpool premier league susah di prediksi entah apa yg bakal terjadi di babak kedua emyu bisa kejar skor trus comeback atau liverpool kill the game munliv,ada sisa menit waktu normal di babak kedua manchester united liverpool premier league susah di prediksi entah apa yang bakal terjadi di babak kedua emyu bisa kejar skor terus comeback atau liverpool kill the game munliv
bukti cintaku sama emyu,bukti cintaku sama emyu
klub pekok,klub pekok
maksudnya terlempar dari fa cup kalau lawan emyu menang kan sekarang jadwal main jadi ga bisa ke dubaj,maksudnya terlempar dari fa cup kalau lawan emyu menang kan sekarang jadwal main jadi enggak bisa ke dubaj
out teh hag,out teh hag
plot twist hari ini,plot twist hari ini
nah comeback menang lah jangan kalah mulu fans ggmu merasa kecewa,nah comeback menang lah jangan kalah mulu fan ggmu merasa kecewa
barclays premier league itu sama dengan bri liga ya bang ya tenang bang gue dukung lo biar tolol ga di borong sendiri,barclays premier league itu sama dengan bri liga ya bang ya tenang bang gue dukung lo biar tolol enggak di borong sendiri
min pliss deh besok senin,min pliss deh besok senin
memang suka tantangan fans emyu keknya wazza ngacu ke nick wayne rooney fans emyu model gini ga dikit cm ga semuanya jg cuman biasanya ga nyadar kalo dianya bermasalah n ga nyadar dia sumber masalah krn org ga mau ribet n mendi,memang suka tantangan fan emyu kayaknya wazza ngacu ke nick wayne rooney fan emyu model begini enggak dikit cuma enggak semuanya juga cuman biasanya enggak menyadar kalo dianya bermasalah n enggak menyadar dia sumber masalah karena orang enggak mau ribet n mendi
harihari maen tolol,harihari main tolol
kalah boleh tetep sombong enggak,kalah boleh tetap sombong enggak
langsung kasih aja pialanya ke king emyu manchester united ggmu southampton onana garnacho rashford,langsung kasih saja pialanya ke king emyu manchester united ggmu southampton onana garnacho rashford
tinggal emyu deh yg bisa treble europa league fa cs,tinggal emyu deh yang bisa treble europa league fa cs
napoli sepertinya akan menaikan pembayaran untuk scott mctominay sebesar m sepertinya waktu tes medis menunjukan kalo mctominay ini zidane regen makanya ditambahin manchesterunited mctominay kingemyu,napoli sepertinya akan menaikan pembayaran untuk scott mctominay sebesar m sepertinya waktu tes medis menunjukan kalo mctominay ini zidane regen makanya ditambahin manchesterunited mctominay kingemyu
assane diao diaoune sudah menjadi incaran manchester united sejak lama dan mereka menunjukan ketertarikan manchesterunited kingemyu,assane diao diaoune sudah menjadi incaran manchester united sejak lama dan mereka menunjukan ketertarikan manchesterunited kingemyu
sejarah mulu kapan menangnya le,sejarah mulu kapan menangnya boleh
alhamdulillah tumbang mending united main di champiosip,alhamdulillah tumbang mending united main di champiosip
padahal nek menang iso dadi pemuncak klasemen wilayah timur malah kalah,padahal nek menang iso dadi pemuncak klasemen wilayah timur malah kalah
henderson enak jaman ku toh,henderson enak jaman ku toh
singkat bgt min captionnya mana sombongnya min,singkat banget min captionnya mana sombongnya min
treble ga segampang itu le,treble enggak segampang itu boleh
arsenol dapat hikmahnya,arsenol dapat hikmahnya
ngen,ngen
gosah tawa luhk emyu,gosah tawa luhk emyu
pas di emyu susah bgt buat nyekor dasar setan merah,pas di emyu susah banget buat nyekor dasar setan merah
maksudnya terlempar dari fa cup kalau lawan emyu menang kan sekarang jadwal main jadi ga bisa ke dubaj,maksudnya terlempar dari fa cup kalau lawan emyu menang kan sekarang jadwal main jadi enggak bisa ke dubaj
wkwkwk,wkwkwk
ikutlah apa kata gd gd gusdur inspiratif gurubangsa solutif alfatihah jam siti emyu lpg manchester united gengsolosumberbencana,ikutlah apa kata gd gd gusdur inspiratif gurubangsa solutif alfatihah jam siti emyu lpg manchester united gengsolosumberbencana
kerja bagus,kerja bagus
reminder aja nih penutup tanggal februari kemarin hehe manchesterunited emyu kingemyu,reminder saja nih penutup tanggal februari kemarin hehe manchesterunited emyu kingemyu
mungkin la liga beranggapan exposure ex emyu bakalan gede kek yg udah becks dan cr hehe,mungkin lah liga beranggapan exposure ex emyu bakalan gede kayak yang sudah becks dan cr hehe
club ini klo menang aneh klo kalah ya sdh biasa,club ini kalo menang aneh kalo kalah ya sudah biasa
akhir ini tiap emyu main klo ngga tumbang ya kalah rutinitas baru,akhir ini tiap emyu main kalo enggak tumbang ya kalah rutinitas baru
