before_normalisasi,after_normalisasi
sebenernya offside kayanya si itu cuma kalopun di anulir dan perpanjangan waktu gua tetep pede kalo mu bakal menang si karna keliatan menit menit akhir udah pada panas pemainnya,sebenarnya offside kayanya sih itu cuma kalopun di anulir dan perpanjangan waktu gua tetap percaya diri kalo mu bakal menang sih karena kelihatan menit menit akhir sudah pada panas pemainnya
raspot pak gakguna dari kemaren masi aja di maenin,raspot pak gakguna dari kemarin masih saja di maenin
dorgu sama maino kayak abang adek njir,dorgu sama maino kayak abang adek anjir
positif tapi ada beberapa kesalahan yang bikin degdegan semoga amorim bisa segera memperbaikinya,positif tapi ada beberapa kesalahan yang bikin degdegan semoga amorim bisa segera memperbaikinya
amorim perlu perbaiki defensive transition masih sering kecolongan counter attack,amorim perlu perbaiki defensive transition masih sering kecolongan counter attack
musim pertama emyu ke bro musim kemaren cedera banyak belum lagi politik penjualan klub dll yg emang tenang management waras ya di musim ini masa lu gatau sih hal kayak ginian wkwkwkk karduus karduus rip iq,musim pertama emyu ke bro musim kemarin cedera banyak belum lagi politik penjualan klub dll yang memang tenang management waras ya di musim ini masa lu enggak tau sih hal kayak beginian wkwkwkk karduus karduus rip iq
iy rashford thn belakangan drop bgt tp crossing rashford bbrp kali akurat n mnciptakan peluang vs pool kemaren,iya rashford tahun belakangan drop banget tapi crossing rashford beberapa kali akurat n mnciptakan peluang vs pool kemarin
amorim perlu waktu satu musim penuh untuk benahi semua kekacauan era ten hag,amorim perlu waktu satu musim penuh untuk benahi semua kekacauan era ten hag
kiper reflek busuk anj,kiper reflek busuk anjing
gaya permainan lebih agresif tapi sering kehabisan tenaga di babak kedua,gaya permainan lebih agresif tapi sering kehabisan tenaga di babak kedua
nih klub fix bener dikutuk emang,nih klub fix benar dikutuk memang
mainnya terlalu banyak umpan ke belakang harusnya lebih direct,mainnya terlalu banyak umpan ke belakang harusnya lebih direct
januari bisa dibeli bro kalo harga dia ada yg cocok sma club manapun,januari bisa dibeli bro kalo harga dia ada yang cocok sama club manapun
rabiot itu cmf bukan amf bos duh gimana yaa,rabiot itu cmf bukan amf bos duh bagaimana ya
tetep aja rashford main fulltime yg diganti amad,tetap saja rashford main fulltime yang diganti amad
yora sports,yora sports
lini belakang benarbenar hancur kalah harus lebih hatihati dan lebih solid ke depannya,lini belakang benarbenar hancur kalah harus lebih hatihati dan lebih solid ke depannya
reflex onana sangat bagus tu gol pertama bengong doang,reflex onana sangat bagus itu gol pertama bengong doang
sumpah orang yg ngutuk mu ni pro benerbukan kaleng kutukannya,sumpah orang yang ngutuk mu ini pro benerbukan kaleng kutukannya
lae oalahh,lae oalahh
pertandingan lawan liverpool menurut saya malah rashford ngasih umpan yg harusnya jadi golmalah garnacho yg sering kehilangan bola,pertandingan lawan liverpool menurut saya malah rashford mengasih umpan yang harusnya jadi golmalah garnacho yang sering kehilangan bola
sangat berharap mu bisa menang di pertandingan besar selanjutnya,sangat berharap mu bisa menang di pertandingan besar selanjutnya
nggak berharap apa,enggak berharap apa
senang lihat progres tim amorim bawa perubahan yang ditunggu,senang lihat progres tim amorim bawa perubahan yang ditunggu
bikin mla nntngk ada prbhan,bikin mla nntngk ada prbhan
rashford pun tak guna,rashford pun tak guna
tominay mending keluar dah enek bngt liat nya,tominay mending keluar deh enek banget lihat nya
saham,saham
heaton knpa itu wooyy,heaton kenapa itu wooyy
namanya juga trashford emang ga ada bakat mainnya,namanya juga trashford memang enggak ada bakat mainnya
transisi dari bertahan ke menyerang sangat cepat bagus sekali,transisi dari bertahan ke menyerang sangat cepat bagus sekali
pemain baru pengen cetak gol aja,pemain baru pengin cetak gol saja
martinez jaga disebelahnya mas harusnya maguire motong bola itu,martinez jaga disebelahnya mas harusnya maguire motong bola itu
akhirnya permainan kita punya karakter amorim membawa perubahan besar,akhirnya permainan kita punya karakter amorim membawa perubahan besar
botak sengaja mainin rashford biar makin cepat dia di pecat,botak sengaja mainin rashford biar makin cepat dia di pecat
amorim lebih taktis dalam mengatur momentum pertandingan,amorim lebih taktis dalam mengatur momentum pertandingan
lah ada yg nyenggol ktanya setiap tahun dapet tropi bro tuh botak ya gw bales gitu dong masa tropi domestik non epl aja dibanggain sekelas mu,lah ada yang nyenggol katanya setiap tahun dapat tropi bro tuh botak ya gue balas begitu dong masa tropi domestik non epl saja dibanggain sekelas mu
lagiann ujungnya yg di mainin maguire evan mason mound rasford casemiro kok ngarep apa sama botak,lagiann ujungnya yang di mainin maguire evan mason mound rasford casemiro kok mengharap apa sama botak
ruben amorim harus lebih tegas dalam rotasi pemain lini serang yang kurang tajam menjadi masalah besar di laga pertama,ruben amorim harus lebih tegas dalam rotasi pemain lini serang yang kurang tajam menjadi masalah besar di laga pertama
yoi bng mungkin untuk casemiro bakal dicoba klo ugarte udh masuk squad,yoi bang mungkin untuk casemiro bakal dicoba kalo ugarte sudah masuk squad
penyelesaian akhir kita sangat buruk hari ini ada banyak peluang yang seharusnya bisa kita selesaikan dengan lebih baik,penyelesaian akhir kita sangat buruk hari ini ada banyak peluang yang seharusnya bisa kita selesaikan dengan lebih baik
ente kadang tuh ky gini nih,ente kadang tuh kaya begini nih
pov untuk pertandingan kemarin v liverpool knp hrs ada rashford ya krn belio satu nya homegrown klo gak salah aturannya setiap klubpertandingan hrs memainkan min pemain homegrown,pov untuk pertandingan kemarin v liverpool kenapa harus ada rashford ya karena belio satu nya homegrown kalo enggak salah aturannya setiap klubpertandingan harus memainkan min pemain homegrown
sdh bisa,sudah bisa
salut buat pemain yang tetap berusaha meski tertinggal jauh semangat terus,salut buat pemain yang tetap berusaha meski tertinggal jauh semangat terus
sudah bagus mau di kasi tuchel malah percaya proses,sudah bagus mau di kasih tuchel malah percaya proses
what a game permainan macam apa,what a game permainan macam apa
mending dulu min di waktu masih hak siar dipegang mnc group main set disiarin di tv lokal sekarang lebih penting sinetron,mending dulu min di waktu masih hak siar dipegang mnc group main set disiarin di tv lokal sekarang lebih penting sinetron
yaudah iya,yaudah iya
lu kan nanya posisi unbeaten juga bilbao emang unbeaten kah,lu kan tanya posisi unbeaten juga bilbao memang unbeaten kah
ada perkembangan yang bagus tapi masih banyak detail yang harus diperbaiki,ada perkembangan yang bagus tapi masih banyak detail yang harus diperbaiki
vs arnold aja kemaren loyoapalagi nanti vs awb kelar neh orang,vs arnold saja kemarin loyoapalagi nanti vs awb kelar nih orang
ya makanya kan abang bilang sancho bisa jual ya karena performa dia jelek kalau ugerte disamping kontrak masih panjang performa dia juga bagus makanya harga segitu,ya makanya kan abang bilang sancho bisa jual ya karena performa dia jelek kalau ugerte disamping kontrak masih panjang performa dia juga bagus makanya harga segitu
alamat,alamat
saya melihat perbaikan yang jelas di bawah ruben amorim tetapi kami harus lebih tajam di depan gawang hasil imbang menunjukkan bahwa masih banyak yang perlu diperbaiki,saya melihat perbaikan yang jelas di bawah ruben amorim tetapi kami harus lebih tajam di depan gawang hasil imbang menunjukkan bahwa masih banyak yang perlu diperbaiki
akhirnya berguna juga,akhirnya berguna juga
pressing intensity meningkat tapi masih sering kecolongan serangan balik,pressing intensity meningkat tapi masih sering kecolongan serangan balik
tp kata pemujanya itu tidak bs dilakukan arteta di arsenal tp secara kolektif dan permainan arsenal jauh lebih bagus,tapi kata pemujanya itu tidak bisa dilakukan arteta di arsenal tapi secara kolektif dan permainan arsenal jauh lebih bagus
fans fomo tau nya mintak menang suruh gak mainin dalot sedangkan gak tau kondisi tim dan stok pemain yg ada padahal dorgu lebih sering main di rb di klub sebelum nya tapi dia juga bisa di lb karena punya kaki dominan kaki kiri udah di jelas in stok cb,fan fomo tau nya mintak menang suruh enggak mainin dalot sedangkan enggak tau kondisi tim dan stok pemain yang ada padahal dorgu lebih sering main di ribu di klub sebelum nya tapi dia juga bisa di lb karena punya kaki dominan kaki kiri sudah di jelas ini stok coba
gue gk nontoon onana mainnya gmna yah kok kebobolan goal gk bangeet ya cara antisipasinya,gue enggak nontoon onana mainnya bagaimana ya kok kebobolan goal enggak banget ya cara antisipasinya
amorim harus perbaiki lini tengah masih kalah dibanding era ten hag,amorim harus perbaiki lini tengah masih kalah dibanding era ten hag
saya harap ruben amorim bisa segera memperbaiki lini serang meskipun kami imbang ada banyak hal positif yang bisa diambil dari permainan tim,saya harap ruben amorim bisa segera memperbaiki lini serang meskipun kami imbang ada banyak hal positif yang bisa diambil dari permainan tim
dah biasa dikecewakan ya bawa santai aja daripada bisa stress,deh biasa dikecewakan ya bawa santai saja daripada bisa stres
kalo pelatih nya zidan mungkin performa rashi akan kembali ganas seperti dulu,kalo pelatih nya zidan mungkin performa rashi akan kembali ganas seperti dulu
buka mata lebar ini pelatih emg minim taktik sampai kiamat,buka mata lebar ini pelatih memang minim taktik sampai kiamat
hasil imbang ini sedikit mengecewakan tetapi saya bisa melihat semangat baru dalam permainan mu di bawah ruben amorim,hasil imbang ini sedikit mengecewakan tetapi saya bisa melihat semangat baru dalam permainan mu di bawah ruben amorim
bro ga liat match pertama se op apa maguire,bro enggak lihat match pertama se op apa maguire
saya melihat banyak perubahan positif dalam permainan tim meskipun hasil imbang ini saya yakin ruben amorim akan membawa mu kembali ke jalur kemenangan,saya melihat banyak perubahan positif dalam permainan tim meskipun hasil imbang ini saya yakin ruben amorim akan membawa mu kembali ke jalur kemenangan
amad lagi berduka ko dimainkanayah dari istri meninggal,amad lagi berduka kok dimainkanayah dari istri meninggal
bismillah aja untuk sisa musim ini,bismillah saja untuk sisa musim ini
jadwal main kapan jam berapa,jadwal main kapan jam berapa
semoga ada ugarte jadi bisa refresh lagi dah performanya case,semoga ada ugarte jadi bisa refresh lagi deh performanya case
siap si paling efootball,siap sih paling efootball
taktik amorim membuat mu lebih unpredictable ini yang kita butuhkan,taktik amorim membuat mu lebih unpredictable ini yang kita butuhkan
garnacho in delight biar hidup permainan jgn telat masukannya,garnacho ini delight biar hidup permainan jangan telat masukannya
ten hag masih mending lah ini amorim kayak pelatih tim kampung malu,ten hag masih mending lah ini amorim kayak pelatih tim kampung malu
amorim masakannya makin enak,amorim masakannya makin enak
dikira gampang yaa mas megang mu hahaha mou aja sebangga itu bisa finish di posisi sampe bilang itu puncak karirnya eth ini imba bgt waktu di ajax loh tapi ya megang emyu bukan perihal mudah,dikira gampang ya mas memegang mu hahaha mou saja sebangga itu bisa finish di posisi sampai bilang itu puncak karirnya eth ini imba banget waktu di ajax loh tapi ya memegang emyu bukan perihal mudah
belum rejeki,belum rejeki
d chrome aja ketik tigoals,di chrome saja ketik tigoals
r ben amorim sukses meningkatkan mentalitas tim mereka lebih percaya diri di lapangan,r ben amorim sukses meningkatkan mentalitas tim mereka lebih percaya diri di lapangan
jadwal main kapan jam berapa,jadwal main kapan jam berapa
mending jadiin duit,mending jadikan duit
yaudah iya,yaudah iya
hoo terkuras buat emosi overthinking dan di area kerja tadi dibully sepulang kerja lihat livescore giliran aku yg ngebully,hoo terkuras buat emosi overthinking dan di area kerja tadi dibully sepulang kerja lihat livescore giliran aku yang ngebully
onana bawa sial,onana bawa sial
share jadwanya emyu dong bang,share jadwanya emyu dong bang
maulana gak nyambung lo yg dibilang berkembang itu arteta bukan ten hag,maulana enggak menyambung lo yang dibilang berkembang itu arteta bukan ten hag
meskipun belum sempurna tapi mu terlihat lebih terorganisir sejak dilatih amorim,meskipun belum sempurna tapi mu terlihat lebih terorganisir sejak dilatih amorim
harinya,harinya
yoi bng mungkin untuk casemiro bakal dicoba klo ugarte udh masuk squad,yoi bang mungkin untuk casemiro bakal dicoba kalo ugarte sudah masuk squad
klo di liat ini emng kontraknya onana main terus di liga mslnya bayindir ini mulai di percaya di fa cup dan uel tpi di liga blom prnh di mainin,kalo di lihat ini memang kontraknya onana main terus di liga mslnya bayindir ini mulai di percaya di fa cup dan uel tapi di liga belum pernah di mainin
taktik amorim luar biasa serangan cepat dan efektif ini sepak bola kelas dunia,taktik amorim luar biasa serangan cepat dan efektif ini sepak bola kelas dunia
jadwal main kapan jam berapa,jadwal main kapan jam berapa
pov untuk pertandingan kemarin v liverpool knp hrs ada rashford ya krn belio satu nya homegrown klo gak salah aturannya setiap klubpertandingan hrs memainkan min pemain homegrown,pov untuk pertandingan kemarin v liverpool kenapa harus ada rashford ya karena belio satu nya homegrown kalo enggak salah aturannya setiap klubpertandingan harus memainkan min pemain homegrown
antony tuker mudryk aja,antony tuker mudryk saja
tenang minimal trophy musim ini,tenang minimal trophy musim ini
ruben amorim sudah mulai memperkenalkan filosofi baru namun saya merasa lini serang masih perlu banyak perbaikan untuk meraih kemenangan,ruben amorim sudah mulai memperkenalkan filosofi baru namun saya merasa lini serang masih perlu banyak perbaikan untuk meraih kemenangan
di kutuk bully liverpool puasa tahun pdahal di kurun waktu itu ada dapet ucl sekarang mu giliran bakal puasa gelar dan gak akan dapat piala bergengsi apapun paling mentok ueropa league,di kutuk bully liverpool puasa tahun padahal di kurun waktu itu ada dapat ucl sekarang mu giliran bakal puasa gelar dan enggak akan dapat piala bergengsi apapun paling mentok ueropa league
ya syukur kalo lo menikmati permainan antah berantah aplg doyan liat bola di trashford,ya syukur kalo lo menikmati permainan antah berantah aplg doyan lihat bola di trashford
ntar mah giliran di buang dijual gitu malah gacor di club baru malah greget jadinya,entar mah giliran di buang dijual begitu malah gacor di club baru malah greget jadinya
etdah itu jelas offside bang jauh banget offsidenya,etdah itu jelas offside bang jauh banget offsidenya
iya bener belum sampe akhir musim awkwkkw ten hag stay musim,iya benar belum sampai akhir musim awkwkkw ten hag stay musim
sangat berharap mu bisa menang di pertandingan besar selanjutnya,sangat berharap mu bisa menang di pertandingan besar selanjutnya
udah beli pemain banyak dan kemauan pelatih kalo mainnya gk berubah sih emang katrok ten hag,sudah beli pemain banyak dan kemauan pelatih kalo mainnya enggak berubah sih memang katrok ten hag
ga ada bedanya ama hag gonta ganti pemain kenapa ya ga kayak klub lain pelatih baru tapi udah paten formasinya,enggak ada bedanya sama hag gonta ganti pemain kenapa ya enggak kayak klub lain pelatih baru tapi sudah paten formasinya
masalah di mu ini ga melulu karna pelatih coba di inget lg deh statement ronaldo blm lama ini tentang mu,masalah di mu ini enggak melulu karena pelatih coba di ingat lagi deh statement ronaldo belum lama ini tentang mu
boleh juga yah main joshua zikri sekarang,boleh juga ya main joshua zikri sekarang
berdoa aja gaes semoga nana ga ngelawak,berdoa saja gaes semoga nana enggak ngelawak
amorim lebih fleksibel dalam taktik tidak sekaku ten hag yang terlalu idealis,amorim lebih fleksibel dalam taktik tidak sekaku ten hag yang terlalu idealis
pasti kebobolan gak mungkin gak ada kata gak gol pasti kebobolan jewer kuping gw kalo sampe gak kebobolan,pasti kebobolan enggak mungkin enggak ada kata enggak gol pasti kebobolan jewer kuping gue kalo sampai enggak kebobolan
jadwal main kapan jam berapa,jadwal main kapan jam berapa
jasa vektor dm aja,jasa vektor dm saja
boleh juga yah main joshua zikri sekarang,boleh juga ya main joshua zikri sekarang
flop juga gak masalah sih harga murahgaji juga turun jauh tidak ada biaya peminjaman juga,flop juga enggak masalah sih harga murahgaji juga turun jauh tidak ada biaya peminjaman juga
ga ada istilah salah siapa ga ada yg tau juga kedepannya manajemen cuma manusia bukan nabi boyy,enggak ada istilah salah siapa enggak ada yang tau juga kedepannya manajemen cuma manusia bukan nabi boyy
level eth ya cmn segitu aja,level eth ya cuman segitu saja
fit tapi planga plongo,fit tapi planga plongo
pertandingan lawan liverpool menurut saya malah rashford ngasih umpan yg harusnya jadi golmalah garnacho yg sering kehilangan bola,pertandingan lawan liverpool menurut saya malah rashford mengasih umpan yang harusnya jadi golmalah garnacho yang sering kehilangan bola
de gea diamonde de light maguire mazroi mctomnay mainodavies kvaratskhelia hojlundgyokeres olise,deh gea diamonde deh light maguire mazroi mctomnay mainodavies kvaratskhelia hojlundgyokeres olise
main dah satu squad,main deh satu squad
onana main home beh combo mematikan,onana main home beh combo mematikan
pemain kita harus mulai nonton tutorial youtube cara passing yang benar,pemain kita harus mulai menonton tutorial youtube cara passing yang benar
setuju dan kualitas united akan tetap seperti itu jika masih ada rashy,setuju dan kualitas united akan tetap seperti itu jika masih ada rashy
halah mourinho lagi emang di mu pada saat itu dapet piala abis itu kemana di roma juga b aja sekarang ke fenerbahce yaa gitu aja bagus karna brandingnya kuat bagus karna team management secara taktik b aja,halah mourinho lagi memang di mu pada saat itu dapat piala habis itu kemana di roma juga b saja sekarang ke fenerbahce ya begitu saja bagus karena brandingnya kuat bagus karena team management secara taktik b saja
astaga onana,astaga onana
tim lebih agresif dan punya banyak variasi serangan senang melihat ini,tim lebih agresif dan punya banyak variasi serangan senang melihat ini
ten hag sudah menciptakan dasar yang solid dalam permainan tim namun mereka perlu lebih tajam dalam penyelesaian akhir,ten hag sudah menciptakan dasar yang solid dalam permainan tim namun mereka perlu lebih tajam dalam penyelesaian akhir
badut,badut
bro itu kalo depannya fulham ga bapuk udah brp gol itu,bro itu kalo depannya fulham enggak bapuk sudah berapa gol itu
hojlund mulai nyetel sama tim yang gue tunggutunggu adalah musim depannya pasti lebih brutal,hojlund mulai nyetel sama tim yang gue tunggutunggu adalah musim depannya pasti lebih brutal
di lapangan aja gak gerak apa ya pasti tetap fitlah onanananananaa,di lapangan saja enggak gerak apa ya pasti tetap fitlah onanananananaa
amorim masterclass ten hag cuma bisa mimpi buat tim main sebagus ini,amorim masterclass ten hag cuma bisa mimpi buat tim main sebagus ini
setuju,setuju
beban club,beban club
pertandingan lawan liverpool menurut saya malah rashford ngasih umpan yg harusnya jadi golmalah garnacho yg sering kehilangan bola,pertandingan lawan liverpool menurut saya malah rashford mengasih umpan yang harusnya jadi golmalah garnacho yang sering kehilangan bola
bapuk amat,bapuk amat
pak gubernur juga bapuk betul lah,pak gubernur juga bapuk betul lah
kyle walker dari awal kan udah epl kocak iyaa udah tua tapi kan pengalam di eplnya masa mau dibandingin sama case bro broo,kyle walker dari awal kan sudah epl kocak iya sudah tua tapi kan pengalaman di eplnya masa mau dibandingin sama case bro broo
nonton pertandingan tadi tuh mixed feelings ada momen keren tapi juga banyak blunder,menonton pertandingan tadi tuh mixed feelings ada momen keren tapi juga banyak blunder
hasil imbang di pertandingan pertama agak mengecewakan namun ada perbaikan dalam cara bermain mu di bawah ruben amorim,hasil imbang di pertandingan pertama agak mengecewakan namun ada perbaikan dalam cara bermain mu di bawah ruben amorim
dibilang buang itu mountbuang,dibilang buang itu mountbuang
jangankan jamie baginda maha raja towel aja pasti bilang gitu,jangankan jamie baginda maha raja towel saja pasti bilang begitu
oh ya oke ya ampun pedes bener sindiran nya,oh ya oke ya ampun pedas benar sindiran nya
menyesal total supporter mu sekarang era amorim era kegelapan,menyesal total supporter mu sekarang era amorim era kegelapan
dalot dikasih kesempatan main sampe full time kayanya emang bakalan diambil dorgu posisi dia,dalot dikasih kesempatan main sampai full time kayanya memang bakalan diambil dorgu posisi dia
tolol,tolol
teorinya begitu cuma gk tau tuh rashford ada clausul apa gmana sih rashford udh kayak pejabat gak bisa di ganggu gugat suka suk weh,teorinya begitu cuma enggak tau tuh rashford ada clausul apa bagaimana sih rashford sudah kayak pejabat enggak bisa di ganggu gugat suka suka weh
terus coba sebutin siapa yg cocok gantiin,terus coba sebutin siapa yang cocok gantiin
tuker palmer kalo mau,tuker palmer kalo mau
jgn chilwell kaki kaca sama aja kyk shaw,jangan chilwell kaki kaca sama saja kayak shaw
kok offside ya bukannya itu sejajar walaupun ga ada pemain lawan,kok offside ya bukannya itu sejajar walaupun enggak ada pemain lawan
degradasi diadngan pemain satu kelurahan nya,degradasi diadngan pemain satu kelurahan nya
klo bisa nontonnya jangan pas onana main bwang tm,kalo bisa nontonnya jangan pas onana main bwang tm
ruben amorim sudah mulai menunjukkan kualitasnya meskipun hasil pertama imbang saya yakin dia bisa membawa mu ke level yang lebih tinggi,ruben amorim sudah mulai menunjukkan kualitasnya meskipun hasil pertama imbang saya yakin dia bisa membawa mu ke level yang lebih tinggi
senggol dikit jatuh kartu wasitnya,senggol dikit jatuh kartu wasitnya
maulana casemiro gak lu sebut sebagai masalah gol dari kesalahan dia loh itu alasan kenapa ugarte di beli,maulana casemiro enggak lu sebut sebagai masalah gol dari kesalahan dia loh itu alasan kenapa ugarte di beli
taek ah introspeksi dong luu,tahi ah introspeksi dong lu
mu lebih solid dalam penguasaan bola tapi masih kurang tajam di depan,mu lebih solid dalam penguasaan bola tapi masih kurang tajam di depan
zirkzee sama hojlund depan serem sih ada fisik ada teknik musim depan bakal jadi duet maut,zirkzee sama hojlund depan seram sih ada fisik ada teknik musim depan bakal jadi duet maut
mu harus meningkatkan permainan passing di lini tengah banyak yang harus diperbaiki,mu harus meningkatkan permainan passing di lini tengah banyak yang harus diperbaiki
ngasal ae kalau komen jelas ga pake play maker wkwk maksud lu bruno dia jdi dm boy eriksen maino jdi sayap tapi agak masuk jdi wing bek yg bolak balik atas bawah sndiri kalau babak diallo jdi wing bek kanan garna sayap kiri maino sayap,ngasal saja kalau komen jelas enggak pakai play maker wkwk maksud lu bruno dia jadi dm boy eriksen maino jadi sayap tapi agak masuk jadi wing bek yang bolak balik atas bawah sendiri kalau babak diallo jadi wing bek kanan garna sayap kiri maino sayap
betul banget bang kacau jadinya di menit menit krusial,betul banget bang kacau jadinya di menit menit krusial
nah itu dia bro beda kalo hojlund udah mentok masuk si zikri langsung leluasa banget winger mu karna bisa buka ruang walaupun cuma keliatan mondar mandir,nah itu dia bro beda kalo hojlund sudah mentok masuk sih zikri langsung leluasa banget winger mu karena bisa buka ruang walaupun cuma kelihatan mondar mandir
perlu waktu adaptasi tapi filosofi amorim lebih cocok dengan dna united,perlu waktu adaptasi tapi filosofi amorim lebih cocok dengan dna united
jadi salah pelatih gitu karna bawa mereka ke mu mereka kan dipilih karna pernah rekan team makanya diambil dan ternyata susah adapt di epl kalo pemainnya ternyata susah adapt di epl pelatih jadi salah gitu karna dibawa ke mu,jadi salah pelatih begitu karena bawa mereka ke mu mereka kan dipilih karena pernah rekan team makanya diambil dan ternyata susah adapt di epl kalo pemainnya ternyata susah adapt di epl pelatih jadi salah begitu karena dibawa ke mu
bayindir mazraoui de ligt martinez dalot mainoo ugarte amad bruno garnacho zirkzee onana pinjemin aja liga tarkam,bayindir mazraoui deh ligt martinez dalot mainoo ugarte amad bruno garnacho zirkzee onana pinjemin saja liga tarkam
biata transfer dulu dah ketutup sama penjualan jersey dia di musim pertama mungkin atau minimal nya mu untunglah atau ga rugi banget apalagi liat gaji yg ga sebanding sama kontribusinya,biata transfer dulu deh ketutup sama penjualan jersey dia di musim pertama mungkin atau minimal nya mu untunglah atau enggak rugi banget apalagi lihat gaji yang enggak sebanding sama kontribusinya
jadwal main kapan jam berapa,jadwal main kapan jam berapa
mu harus meningkatkan permainan passing di lini tengah banyak yang harus diperbaiki,mu harus meningkatkan permainan passing di lini tengah banyak yang harus diperbaiki
saya optimis dengan pengaruh ruben amorim meskipun hasil imbang rashford dan bruno fernandes semakin banyak bekerja sama,saya optimis dengan pengaruh ruben amorim meskipun hasil imbang rashford dan bruno fernandes semakin banyak bekerja sama
jadwal main kapan jam berapa,jadwal main kapan jam berapa
amorim jenius akhirnya tim ini punya pelatih dengan otak sepak bola sejati,amorim jenius akhirnya tim ini punya pelatih dengan otak sepak bola sejati
blunder paling fatal membuang mengganti degea dgn onana,blunder paling fatal membuang mengganti degea dengan onana
beli pemaen mahal cuma buat pelapis,beli pemaen mahal cuma buat pelapis
saya suka gaya bermain ini lebih menyenangkan untuk ditonton,saya suka gaya bermain ini lebih menyenangkan untuk ditonton
