before_normalisasi,after_normalisasi
amorim batu klo ga bisa strategi bek berjalan jgn kau paksa babi ruud aj pake bek bisa bikin gol bikin perubahan lah liat pertandingan gimana babi jg klen lama lama,amorim batu kalo enggak bisa strategi bek berjalan jangan kau paksa babi ruud saja pakai bek bisa bikin gol bikin perubahan lah lihat pertandingan bagaimana babi juga kalian lama lama
ini saluran king emyu kenapa guys manchesterunited footbalovers fbtlindonesia emyu,ini saluran king emyu kenapa guys manchesterunited footbalovers fbtlindonesia emyu
hobi,hobi
pliss mending naksir emyu,pliss mending menaksir emyu
bumi emang masih berputar ya emyu lolos ke babak selanjutnya eh city udah tersingkir duluan btw gimans laga perdana nistelrooy siap sementara saingin pep superlive supersoccer inirasanyasuper manchesterunited manchestercity,bumi memang masih berputar ya emyu lolos ke babak selanjutnya eh city sudah tersingkir duluan btw gimans laga perdana nistelrooy siap sementara saingin pep superlive supersoccer inirasanyasuper manchesterunited manchestercity
juventus akan jorjoran untuk sancho setelah chiesa resmi deal ke liverpool bismilah here we go hari ini manchesterunited sancho kingemyu,juventus akan jorjoran untuk sancho setelah chiesa resmi deal ke liverpool bismilah here we go hari ini manchesterunited sancho kingemyu
selama pelatihnya amorim terabas ajalah gw percaya sama taktiknya dia beda klo yg pegang botak belanda draw mulu,selama pelatihnya amorim terabas ajalah gue percaya sama taktiknya dia beda kalo yang pegang botak belanda draw mulu
ternyata dosennya skorskit manchesterunited emyu footballfunny,ternyata dosennya skorskit manchesterunited emyu footballfunny
jadwal manchester united dari gw hanya ada empat laga sulit rashford m fernandes m rashford adalah pemain streaky alias sekali ketemu sentuhannya bakal lanjut terus fernandes pemain kunci emyu meta baru,jadwal manchester united dari gue hanya ada empat laga sulit rashford m fernandes m rashford adalah pemain streaky alias sekali ketemu sentuhannya bakal lanjut terus fernandes pemain kunci emyu meta baru
wkwkwk lucu bet ya,wkwkwk lucu banget ya
selama pelatihnya amorim terabas ajalah gw percaya sama taktiknya dia beda klo yg pegang botak belanda draw mulu,selama pelatihnya amorim terabas ajalah gue percaya sama taktiknya dia beda kalo yang pegang botak belanda draw mulu
late post makasih mngnya aku emyu yaa bukan barca wkwkwk makasih juga freebies nya,late post terima kasih mngnya aku emyu ya bukan barca wkwkwk terima kasih juga freebies nya
daya beli lg menyedihkan,daya beli lagi menyedihkan
wah luar biasa kevin diks ternyata ikut andil dalam kemenangan dramatis fc k benhavn atas manchester united emyu benarbenar harus terpuruk di dasar klasemen,wah luar biasa kevin diks ternyata ikut andil dalam kemenangan dramatis fc ke benhavn atas manchester united emyu benarbenar harus terpuruk di dasar klasemen
untuk kasus oyedele dia akan main di salah satu klub top di negara yang dia bela di level internasional itu kan kabar baik disyukuri aja kalau karir dia bagus bahkan dia gak balik ke emyu pun dia akan tetap selalu jadi lulusan akademi manchester united itu membanggakan,untuk kasus oyedele dia akan main di salah satu klub top di negara yang dia bela di level internasional itu kan kabar baik disyukuri saja kalau karir dia bagus bahkan dia enggak balik ke emyu pun dia akan tetap selalu jadi lulusan akademi manchester united itu membanggakan
selesai tim ini lama gak punya karakter lagi,selesai tim ini lama enggak punya karakter lagi
wkwkk cupu,wkwkk cupu
tanggal emyu imbang tanggal emyu kalah tanggal emyu kalah mufc manchesterunited amorim brunofernandes onana,tanggal emyu imbang tanggal emyu kalah tanggal emyu kalah mufc manchesterunited amorim brunofernandes onana
sancho dan mctom di klub barunya kok bisa menari kasih assist obrak abrik lawan kok bisa ada yg salah dengan,sancho dan mctom di klub barunya kok bisa menari kasih assist obrak abrik lawan kok bisa ada yang salah dengan
manuel ugarte telah terdaftar di premier league manchesterunited ugarte kingemyu,manuel ugarte telah terdaftar di premier league manchesterunited ugarte kingemyu
glory glory man united manchester is red forever red devil ill rather walk alone besok kita nikah pake tema emyu juga gapapa sayangku,glory glory man united manchester is red forever red devil ill rather walk alone besok kita nikah pakai tema emyu juga gapapa sayangku
polisi jerman secara brutal melecehkan wanita karena mengenakan jilbab chaffiyeh palestina di sebuah mal di berlin petugas polisi jerman akan menangkap dan menarik siapa pun yg mereka lihat yg memiliki simbol palestina malam emyu pepaya pisang manchester united,polisi jerman secara brutal melecehkan wanita karena mengenakan jilbab chaffiyeh palestina di sebuah mal di berlin petugas polisi jerman akan menangkap dan menarik siapa pun yang mereka lihat yang memiliki simbol palestina malam emyu pepaya pisang manchester united
ga ada kebanggaan alias kalah mulu anjiirr,enggak ada kebanggaan alias kalah mulu anjiirr
ternyata pertandingan emyu lawan coventry gak seburuk itu wkwk,ternyata pertandingan emyu lawan coventry enggak seburuk itu wkwk
emyu su_,emyu su_
tahun di manchester united dan sekarang akan berpisah once red always red manchesterunited mctominay kingemyu,tahun di manchester united dan sekarang akan berpisah once red always red manchesterunited mctominay kingemyu
wkwkw bapuk lu w menit sebelul main dah yakin kalah bener kalah kan,wkwkw bapuk lu gue menit sebelul main deh yakin kalah benar kalah kan
sitik engkas degradasi yok bisa yok degradasi wingi sing cangkeme hastag ten hag out endi ambune wis diwarah penyakite emyu iki pemain uduk pelatih longgor erro opo arek longgor sak congore diwehi pelatih apik malah dibuwak milih amorim manchesterunited,sitik engkas degradasi yuk bisa yuk degradasi wingi sing cangkeme hastag ten hag out endi ambune wis diwarah penyakite emyu iki pemain uduk pelatih longgor erro opo arek longgor sak congore diwehi pelatih apik malah dibuwak memilih amorim manchesterunited
karena kami tau walau emyu gak juara epl pun tetap yg terbanyak juara epl itu manchester united,karena kami tau walau emyu enggak juara epl pun tetap yang terbanyak juara epl itu manchester united
menang ga nih,menang enggak nih
awal desember yang ceria dan indahmenang telak clean sheetglory glory glory united emyu ggmu mufc manchesterunited,awal desember yang ceria dan indahmenang telak clean sheetglory glory glory united emyu ggmu mufc manchesterunited
fans mu mana yang tak sakit hati melihat team nya seperti sekarang cepat pulih dan bangkit ggmu,fan mu mana yang tak sakit hati melihat team nya seperti sekarang cepat pulih dan bangkit ggmu
main ga ada polanya banyak salah umpan dan pelanggaran finishing jg lemah padahal modal pemainnya lumayan bagus tahun kemarin hampir sama cm terselamatkan piala c,main enggak ada polanya banyak salah umpan dan pelanggaran finishing juga lemah padahal modal pemainnya lumayan bagus tahun kemarin hampir sama cuma terselamatkan piala sih
lebih banyak posting tumbang daripada menang,lebih banyak posting tumbang daripada menang
ft brighton manchester united kata untuk emyu kocak rrid mufc bhamun,ft brighton manchester united kata untuk emyu kocak rrid mufc bhamun
bentar lagi juga ada liverpool yg nyusul,bentar lagi juga ada liverpool yang menyusul
bisa menang gk,bisa menang enggak
klub ampas,klub ampas
hobi,hobi
kasihan jadi bahan bullybullyan mulu nih fandom,kasihan jadi bahan bullybullyan mulu nih fandom
nonton west ham united vs manchester united ga dari awal karena tadi ibu gua minta nonton kuis arisan menit ke skor masih imbang tanpa gol ayo lah emyu masa ga menang epl whumun,menonton west ham united vs manchester united enggak dari awal karena tadi ibu gua meminta menonton kuis arisan menit ke skor masih imbang tanpa gol ayo lah emyu masa enggak menang epl whumun
okweoweowek produk portugal kocak,okweoweowek produk portugal kocak
galatasaray sedang dalam pembicaraan untuk peminjaman casemiro selama musim manchesterunited casemiro kingemyu,galatasaray sedang dalam pembicaraan untuk peminjaman casemiro selama musim manchesterunited casemiro kingemyu
dungu ajg,dungu ajg
uburubur ikan lele,uburubur ikan lele
eh kocakcoba lu sayat dada gua sampe berdarah dan lu liat di dada gua ada apaanada emyu bositu artinya gua cinta manchester united emyu till i diepaham lu,eh kocakcoba lu sayat dada gua sampai berdarah dan lu lihat di dada gua ada apaanada emyu bositu artinya gua cinta manchester united emyu till i diepaham lu
udah pasti menang ya ya ya ya,sudah pasti menang ya ya ya ya
manchester united resmi mengumumkan kedatangan winger timnas norwegia celin bizet dari tottenham hotspur durasi kontraknya berlaku hingga pengumumumannya gini amat tim sosmednya emyu women lol barclayswsl,manchester united resmi mengumumkan kedatangan winger timnas norwegia celin bizet dari tottenham hotspur durasi kontraknya berlaku hingga pengumumumannya begini amat tim sosmednya emyu women lol barclayswsl
update nistelrooy done deal buat jadi manager leicester city mang enaak sukuriinnsukuriin luu king emyu manchesterunited,update nistelrooy done deal buat jadi manager leicester city memang enaak sukuriinnsukuriin lu king emyu manchesterunited
sumber berita yg mengatakan antony ingin pergi ke fenerbache tidak valid hoax manchesterunited antony kingemyu,sumber berita yang mengatakan antony ingin pergi ke fenerbache tidak valid hoax manchesterunited antony kingemyu
kan buat arsenal sama leicester mah emyu tim kasta bawahnya fair doong,kan buat arsenal sama leicester mah emyu tim kasta bawahnya fair dong
emyu nih bos manchesterunited,emyu nih bos manchesterunited
pas udah baca kata judi gue big no deh apalagi udah judi bola fans emyu gak kuat gue jadi istrinya,pas sudah baca kata judi gue big no deh apalagi sudah judi bola fan emyu enggak kuat gue jadi istrinya
mau alesan apa lagi pemain lengkap semua ah taii ten hag si raja disiplin,mau alesan apa lagi pemain lengkap semua ah taii ten hag sih raja disiplin
ayo semangat semangat dong,ayo semangat semangat dong
wkwk bener bang klub goblok dah itu gadak yg bisa dibanggain,wkwk benar bang klub goblok deh itu gadak yang bisa dibanggain
selamat pagi di penghujung akhir tahun berikut gol kedua newcastle united yang mengantarkan kemenangan atas manchester united aka emyu tadi malam,selamat pagi di penghujung akhir tahun berikut gol kedua newcastle united yang mengantarkan kemenangan atas manchester united aka emyu tadi malam
line up gelandang utama untuk musim ini casemiro eriksen sisa tahun bisa lah bagi ilmunya sebelum free transfer musim depan manchesterunited ugarte kobbie brunofernandes kingemyu,line up gelandang utama untuk musim ini casemiro eriksen sisa tahun bisa lah bagi ilmunya sebelum free transfer musim depan manchesterunited ugarte kobbie brunofernandes kingemyu
gausah komen gausah komen gausah komen,enggak usah komen enggak usah komen enggak usah komen
tau aja cara nanti ngabisin duit thr,tau saja cara nanti ngabisin duit thr
udah kalah main orang bruno mandi duluan apa yang bisa diharapkan dari tim bosok dark system tsunami trofi ngimpi kali,sudah kalah main orang bruno mandi duluan apa yang bisa diharapkan dari tim bosok dark system tsunami trofi mimpi kali
produk emyu,produk emyu
emyu emang nyungsep lagi tapi chelsea jangan ketawa lah temenin emyu dulu di goa sana superlive supersoccer inirasanyasuper manchesterunited chelsea,emyu memang nyungsep lagi tapi chelsea jangan ketawa lah temenin emyu dulu di goa sana superlive supersoccer inirasanyasuper manchesterunited chelsea
saatnya ruwatan dan ganti nama,saatnya ruwatan dan ganti nama
ft liga inggris wolves manchester united m cunha h hwang bruno fernandes emyu butut epl premierleague boxingday,ft liga inggris wolves manchester united m cunha h hwang bruno fernandes emyu butut epl premierleague boxingday
abang baru banyak ternyata typing di atas banyak typonya maaf kemarin sambil ngantuk diving abang udah sedalam samudera pasifik nih adek mau bantuin ta keren banget kita emang harus bahagia tiap hari kalo abang singkat saja karna manchester u,abang baru banyak ternyata typing di atas banyak typonya maaf kemarin sambil ngantuk diving abang sudah sedalam samudera pasifik nih adek mau bantuin ta keren banget kita memang harus bahagia tiap hari kalo abang singkat saja karena manchester lu
kalah mesti,kalah mesti
bisa bisa nya kita percaya sama onana mending kaleng krupuk jaga gawang,bisa bisa nya kita percaya sama onana mending kaleng krupuk jaga gawang
jangan ditahajudin plis dia udah sadar gak perlu didoain lagi jadi fans emyu t_t,jangan ditahajudin plis dia sudah sadar enggak perlu didoain lagi jadi fan emyu t_t
wkwk pemain nya badut semua,wkwk pemain nya badut semua
ragu menang kalo onana nih kiper ntar,ragu menang kalo onana nih kiper entar
udah dulu min jumawanya takut knp knp besok,sudah dulu min jumawanya takut kenapa kenapa besok
emyu goblok ga ditonton bukannya menang malah tolol,emyu goblok enggak ditonton bukannya menang malah tolol
guwendeng guwendeng,guwendeng guwendeng
di tanya premier league apa,di tanya premier league apa
buat milwall bristol city dan norwich siapsiap klean menghadapi emyu di championship musim depan superlive supersoccer inirasanyasuper manchesterunited,buat milwall bristol city dan norwich siapsiap klean menghadapi emyu di championship musim depan superlive supersoccer inirasanyasuper manchesterunited
emang emyu knp,memang emyu kenapa
nominasi player of the month agustus versi manchester united amad diallo noussair mazraoui garnacho feeling garnacho atau mazraoui yg menang manchesterunited mazraoui amad garnacho kingemyu,nominasi player of the month agustus versi manchester united amad diallo noussair mazraoui garnacho feeling garnacho atau mazraoui yang menang manchesterunited mazraoui amad garnacho kingemyu
emyu,emyu
mainoo cuk oper ke belang terus gk ada pergerakan kalah duel,mainoo cuk oper ke belang terus enggak ada pergerakan kalah duel
tim goblok,tim goblok
zirkzee dilaga vs boznia manchesterunited zirkzee kingemyu,zirkzee dilaga vs boznia manchesterunited zirkzee kingemyu
anjg busuk mainnya jancok,anjg busuk mainnya jancok
sengaja ya apalagi yang pake editan emyu perlu senior sambit dulu hahahhaa inisial,sengaja ya apalagi yang pakai editan emyu perlu senior sambit dulu hahahhaa inisial
ragu menang kalo onana nih kiper ntar,ragu menang kalo onana nih kiper entar
kalah kok lawan brighton kaya emyu dong lebih sering,kalah kok lawan brighton kaya emyu dong lebih sering
assalamualaikum,assalamualaikum
beginilah seharusnya manchester united bermain amorim master class muneve mufc,beginilah seharusnya manchester united bermain amorim master class muneve mufc
ini udah pasti utk fans mu entah wik en ato hr senin kl hasil pertandingan selalu kalah,ini sudah pasti untuk fan mu entah wig en atau hari senin kalo hasil pertandingan selalu kalah
nonton merah gs,menonton merah gs
kasih paham min,kasih paham min
su team mu kalah kae lho cok asu,su team mu kalah kae lho cok asu
tahun siap liat king emyu angkat trofi superlive supersoccer inirasanyasuper manchesterunited,tahun siap lihat king emyu angkat trofi superlive supersoccer inirasanyasuper manchesterunited
tim congok ancene,tim congok ancene
oh ini yg katanya fans emyu miskin gabisa beli baju official store,oh ini yang katanya fan emyu miskin enggak bisa beli baju official store
selesaisudah ten dan onana,selesaisudah ten dan onana
gua kira emyu itu udh paling gblk ternyata gua lebih gblokk anjj,gua kira emyu itu sudah paling gblk ternyata gua lebih gblokk anjj
epl ft manchester united everton rashford zirkzee ngeri banget oi emyu sekarang blibli,epl ft manchester united everton rashford zirkzee ngeri banget oi emyu sekarang blibli
apa yg akan terjadi malam ini mari kita mulai deg deg annya,apa yang akan terjadi malam ini mari kita mulai deg deg annya
kebalik dong di mana sejarahnya fans emyu bisa santuy kalah aja sombong apalagi menang jangan mengaburkan yg sudah jelas gitu ah,kebalik dong di mana sejarahnya fan emyu bisa santuy kalah saja sombong apalagi menang jangan mengaburkan yang sudah jelas begitu ah
semangat senin,semangat senin
match hareup dewa enjoy jaminan meunang lawan emyu mah,match hareup dewa enjoy jaminan meunang lawan emyu mah
dia di ajax sama betis jago berarti emang emyu aja yang pembawa sial wkwkwk,dia di ajax sama betis jago berarti memang emyu saja yang pembawa sial wkwkwk
ted lasso ngelatih emyu baru menarik,ted lasso ngelatih emyu baru menarik
telpon h keane mari rematch,telpon h keane mari rematch
mu bapuk,mu bapuk
uda dikasih tahu mourinho ga percaya sih,sudah dikasih tahu mourinho enggak percaya sih
lu daripada ikutan epl tapi bikin fansnya setres tiap minggu mending resign aja gih ikut daptar pon sumatra aja,lu daripada ikutan epl tapi bikin fansnya setres tiap minggu mending resign saja gih ikut daptar pon sumatra saja
terus lah menjadi badut,terus lah menjadi badut
jadwal bola liga europa jumat november pukul wib sctv manchester united vs paok link sakura bola emyu,jadwal bola liga europa jumat november pukul wib sctv manchester united vs paok link sakura bola emyu
hayah kiper e onana tak turu wae le,hayah kiper e onana tak turu wae boleh
nyindir bupati manchester,menyindir bupati manchester
tolol maka nya jersey gue mentok cuma yg sponsor aon aja setelah nya sampah,tolol maka nya jersey gue mentok cuma yang sponsor aon saja setelah nya sampah
malaica bantu tim kitman,malaica bantu tim kitman
selesai itu emyu,selesai itu emyu
jujur a aku masih percaya dgn kalimat trust the process walaupun udh tahun,jujur a aku masih percaya dengan kalimat trust the process walaupun sudah tahun
amad diallo jadi pahlawan lagi bawa manchester united imbang lawan liverpool di anfield persaingan maguire vs trent menyala ketika tekad emyu berjuang mereka bisa tampil baik mufc lfc amaddiallo epl livmun update news seketika,amad diallo jadi pahlawan lagi bawa manchester united imbang lawan liverpool di anfield persaingan maguire vs trent menyala ketika tekad emyu berjuang mereka bisa tampil baik mufc lfc amaddiallo epl livmun update news seketika
emyu yo eben,emyu ya eben
sabarku turah wkwk,sabarku turah wkwk
tolol eram bolo,tolol eram bolo
starting lineup premierleague mw manchester united vs leicester rvn menurunkan skuad serupa saat imbangi chelsea bedanya kali ini amad start garnacho bench match ini jadi laga keempat sekaligus terakhir bagi nistelrooy as manager interim emyu mufc munlei,starting lineup premierleague mau manchester united vs leicester rvn menurunkan skuad serupa saat imbangi chelsea bedanya kali ini amad start garnacho bench match ini jadi laga keempat sekaligus terakhir bagi nistelrooy as manager interim emyu mufc munlei
raja liga inggris atau premier league kalo liga inggris tinggal tunggu beberapa bulan lagi ada yg imbangin,raja liga inggris atau premier league kalo liga inggris tinggal tunggu beberapa bulan lagi ada yang imbangin
emang emyu knp,memang emyu kenapa
fun fact kevin diks bagian dari skuat fc k benhavn yang mengalahkan manchester united di champions league musim lalu emyu pun terjungkal jadi penghuni dasar klasemen,fun fact kevin diks bagian dari skuat fc ke benhavn yang mengalahkan manchester united di champions league musim lalu emyu pun terjungkal jadi penghuni dasar klasemen
muntot anj,muntot anjing
emyu sekelas apa bang persic cilegon awowkwkok,emyu sekelas apa bang persic cilegon awowkwkok
scott mctominay disambut fans napoli manchesterunited mctominay kingemyu,scott mctominay disambut fan napoli manchesterunited mctominay kingemyu
emm hari dimaklumi kalo temen temen kalian pada sensi dimaklumin ya ges,emm hari dimaklumi kalo teman teman kalian pada sensi dimaklumin ya ges
kmrn di comeback emyu skrng kalah lawan papan bawah,kemarin di comeback emyu sekarang kalah lawan papan bawah
min pengen dibikinin juga,min pengin dibikinin juga
onana punya saham di ineos,onana punya saham di ineos
yuk bisa yuk plis onana jgn aneh ntar dimarahin,yuk bisa yuk plis onana jangan aneh entar dimarahi
saatnya meramaikan wa nya fandar,saatnya meramaikan wa nya fandar
kmrn ada yg emyu trus ada yg matcha jg eh skrg ada yg strawberry,kemarin ada yang emyu terus ada yang matcha juga eh sekarang ada yang strawberry
kalo pun pendekatan juga dia belom tentu mau ke emyu,kalo pun pendekatan juga dia belum tentu mau ke emyu
jujur kemaren sangat percaya sama nih pelatih ajax tapi makin kesini kepercayaan semakin luntur dengan melihat beberapa keputusan dia di lapangan atau diluar lapangan sekalipun terimakasih dan sampai jumpa tenhagout manchesterunited emyu,jujur kemarin sangat percaya sama nih pelatih ajax tapi makin kesini kepercayaan semakin luntur dengan melihat beberapa keputusan dia di lapangan atau diluar lapangan sekalipun terimakasih dan sampai jumpa tenhagout manchesterunited emyu
iya ya udah jumat tanggal,iya ya sudah jumat tanggal
kirain emyu,mengira emyu
oke gas muatamu,oke gas muatamu
tengok sedikit keadaan manchester united emyu manchesterunited,tengok sedikit keadaan manchester united emyu manchesterunited
siap,siap
fulltime brace amp,fulltime brace amp
ah udah gini biasanya ngejinx,ah sudah begini biasanya ngejinx
kalau altay main menang sih,kalau altay main menang sih
degradasi semoga,degradasi semoga
sumber berita yg mengatakan antony ingin pergi ke fenerbache tidak valid hoax manchesterunited antony kingemyu,sumber berita yang mengatakan antony ingin pergi ke fenerbache tidak valid hoax manchesterunited antony kingemyu
bercyanda,bercyanda
bagus juga editan foto nya,bagus juga editan foto nya
xg manchester united liverpool sekarang apa solusimu erik ten hag hal yg dapat dipastikan jika emyu tidak segera berbernah sampai januari maka dapat dipastikan kita akan memiliki pelatih baru awal tahun depan manchesterunited kingemyu,xg manchester united liverpool sekarang apa solusimu erik ten hag hal yang dapat dipastikan jika emyu tidak segera berbernah sampai januari maka dapat dipastikan kita akan memiliki pelatih baru awal tahun depan manchesterunited kingemyu
menghadapi senin dgn cukup full senyum mengingat emyu menang kemarin,menghadapi senin dengan cukup full senyum mengingat emyu menang kemarin
main ga ada polanya banyak salah umpan dan pelanggaran finishing jg lemah padahal modal pemainnya lumayan bagus tahun kemarin hampir sama cm terselamatkan piala c,main enggak ada polanya banyak salah umpan dan pelanggaran finishing juga lemah padahal modal pemainnya lumayan bagus tahun kemarin hampir sama cuma terselamatkan piala sih
emyu maksudnya,emyu maksudnya
emang dasare emyu bae sing pengak dih likring,memang dasare emyu bae sing pengak dih likring
wo baru ini menemukan fans emyu dan proud,wo baru ini menemukan fan emyu dan proud
yoro mazraoui ampun dah zirkzee bisa passing kah,yoro mazraoui ampun deh zirkzee bisa passing kah
mau mengumpat apalagisemua sdh terwakilkan,mau mengumpat apalagisemua sudah terwakilkan
akankah amorim ngamuk lagi mecahin mangkok gelas di ruang ganti emyu,akankah amorim ngamuk lagi mecahin mangkok gelas di ruang ganti emyu
ini kiper terbodoh sepanjang sejarah mu,ini kiper terbodoh sepanjang sejarah mu
dorgu apes bgt debut kipernya onana,dorgu apes banget debut kipernya onana
jujur a aku masih percaya dgn kalimat trust the process walaupun udh tahun,jujur a aku masih percaya dengan kalimat trust the process walaupun sudah tahun
oh jadi emyu malam tadi menang ya manchesterunited,oh jadi emyu malam tadi menang ya manchesterunited
tidak mmikirkan akhir musim tiba terdegradasi,tidak mmikirkan akhir musim tiba terdegradasi
nntn emyu,menonton emyu
jonny evans resmi mengumumkan pensiun dari timnas nasional manchesterunited evans kingemyu,jonny evans resmi mengumumkan pensiun dari timnas nasional manchesterunited evans kingemyu
wkwk emg level emyu ada dimana bang,wkwk memang level emyu ada dimana bang
obat ojo nonton emyu,obat ojo menonton emyu
selama backnya leister masih wout faes gampang ngalahinnya,selama backnya leister masih wout faes gampang ngalahinnya
tiga poin buat musuh yang iyanya hahahahaa,tiga poin buat musuh yang iyanya hahahahaa
bodoh,bodoh
masuk goa lg aja ampas,masuk goa lagi saja ampas
fans emyu saat ini bhamun manchesterunited manunited ggmu,fan emyu saat ini bhamun manchesterunited manunited ggmu
match hareup dewa enjoy jaminan meunang lawan emyu mah,match hareup dewa enjoy jaminan meunang lawan emyu mah
kalo maen jam udh pasti menang tapi kalo maen jam an udh pasti kalah,kalo main jam sudah pasti menang tapi kalo main jam an sudah pasti kalah
tolol wkwkkw,tolol wkwkkw
selesai di epl,selesai di epl
pulangin aja papahmu min aku udah mulai cape,pulangin saja papahmu min aku sudah mulai cape
mau sampai kapan onana di pertahaninficek banget,mau sampai kapan onana di pertahaninficek banget
terlalu op emyu nya,terlalu op emyu nya
emyu gamau ansu fati ajakah beli,emyu enggak mau ansu fati ajakah beli
fans emyu ngapain bahas chelsea,fan emyu mengapai bahas chelsea
selama pelatihnya amorim terabas ajalah gw percaya sama taktiknya dia beda klo yg pegang botak belanda draw mulu,selama pelatihnya amorim terabas ajalah gue percaya sama taktiknya dia beda kalo yang pegang botak belanda draw mulu
manchester united akan mengenakan jersey ketiga mereka dilaga melawan crystal palace manchesterunited kingemyu,manchester united akan mengenakan jersey ketiga mereka dilaga melawan crystal palace manchesterunited kingemyu
rashford garnacho casemiro dan malacia satu dari mereka kemungkinan bakal cabut dari emyu januari ini dengan nama pertama adalah mungkin yang paling kencang untuk keluar dari manchester united,rashford garnacho casemiro dan malacia satu dari mereka kemungkinan bakal cabut dari emyu januari ini dengan nama pertama adalah mungkin yang paling kencang untuk keluar dari manchester united
